;;;;;;;;;;;;;x
first_treaty_of_fort_laramie_initiated;Treaty of Fort Laramie;;;;;;;;;;;;;x
california_goldrush;The California Gold Rush;;;;;;;;;;;;;x
colombia_goldrush;The Colombia Gold Rush;;;;;;;;;;;;;x
house_gag_rule_enacted;House Gag Rule;;;;;;;;;;;;;x
the_plantation_and_ranching_act;The Plantation & Ranching Act;;;;;;;;;;;;;x
english_band;The British Band;;;;;;;;;;;;;x
indian_raiders;Indian Raiders;;;;;;;;;;;;;x
new_settlement;New Settlement;;;;;;;;;;;;;x
frontiersmen_modifier;The Frontier;;;;;;;;;;;;;x
native_american_minor_modifier;Native American State;;;;;;;;;;;;;x
enact_the_homestead_act_title;The Homestead Act;;;;;;;;;;;;;x
enact_the_homestead_act_desc;In the West lies the vast and vacant land of the Great Plains. It is an harsh an unproductive land, home to nothing but bands of roaming savages and bison. We can offer these lands -Federal lands- free to any man who wants to put a plow into the unbroken sod. Offering the golden opportunity of freedom and self-sufficience to all who conquer this tough sod with hard work, and providing productive land to our nation.;;;;;;;;;;;;;x
enact_the_plantation_and_ranching_act_title;The Plantation & Ranching Act;;;;;;;;;;;;;x
enact_the_plantation_and_ranching_act_desc; The Great Plains are a harsh place with tough sod and little rainfal, not easily conquered or cultivated. Turning it into productive land benefitting the nation would require major investment, far beyond the means of small scale farmers. The Federal lands of the West ought to be granted to those of means, for the establishment of plantations and ranches.;;;;;;;;;;;;;x
first_treaty_of_fort_laramie_title;The Treaty of Fort Laramie;;;;;;;;;;;;;x
first_treaty_of_fort_laramie_desc;Tens of thousands travel West on the Oregon and Santa Fe Trails each year, searching for fresh lands, opportunity, gold, or just running away from something. A long and arduous journey not made any easier by hostile Indian nations, who -even when not explicitly targetting the wagon trains- make -with their incessent warfare- the journey a particularly risky endevour. We can call a great conference of the plains Indians to force an end to their warfare, guarantee the right of free passage of our wagon trains, as well as secure lands west of the Mississippi for settlement.;;;;;;;;;;;;;x
indian_removal_act_title;The Indian Removal Act;;;;;;;;;;;;;x
indian_removal_act_desc;While in the North the Indians have long since dissappeared, in the South the Five Civilised Tribes -the Cherokee, Chickasaw, Choctaw, Creek and Seminole- are still firmly established. It would be hard to argue that they are prospering though: they are subject of continuous encroachment by settlers seeking new, fertile, lands to farm. In this march of progress, it is unlikely that their way of life -or indeed they themselves- will survive for long. It has been argued that the tribes should be evacuated West, across the Mississippi, where they can live and preserve their way of life under self-rule.\n\nEnacting the Indian Removal Act will allow us to start negotiating to this effect.;;;;;;;;;;;;;x
indian_cessations_title;The Indian Cessations;;;;;;;;;;;;;x
indian_cessations_desc;For years the hypocritical North has been lecturing us on the need to respect the Indians living on our lands, to protect them and to not settle their territories. Yet they do so from the comfort of having their own lands cleared of Indians and opened for settlement by generations past. Now free from their domination, we can finally open the Indian lands to settlement!;;;;;;;;;;;;;x
EVTNAME16070;Fire-Eaters;;;;;;;;;;;;;x;
EVTDESC16070;'It has put at rest, forever, all the agitating questions relating to our peculiar institution.'\n\nHis words are soft-spoken, but carry an inner flame of righteous anger directed at anyone and anything he deems as threatening the institution of slavery. 'Fire-Eaters', radical pro-slavery agitators, have appeared in $PROVINCENAME$;;;;;;;;;;;;;x;
EVTDESC16080;'When the sun come back and the first quail calls,\nFollow the Drinking Gourd\nFor the old man's waiting for to carry you to freedom,\nIf you follow the Drinking Gourd.'\n\n-Follow the Drinkin' Gourd\n\nAccording to legend, the song 'Follow the Drinkin' Gourd' was a song written to guide slaves, escaping from slavery in the South to freedom in the North, by telling them to walk in the direction of the 'Drinkin' Gourd', another name for the Big Dipper, a circumpolar asterism that always appears in the northern sky.;;;;;;;;;;;;;x;;;;
EVTNAME16111;The Slave Markets of $STATENAME$;Marché aux esclaves;Sklavenmarkt;;Mercado de esclavos;;;;;;;;;x;;;;
EVTDESC16111;'We hold these Truths to be self-evident, that all Men are created equal, that they are endowed by their Creator with certain unalienable Rights, that among these are Life, Liberty, and the pursuit of Happiness.' -- The Declaration of Independence, 1776\n\nThe dank locale is dimly lit, and reeks of sweat and unwashed bodies. Cramped walls, littered with chains and ropes, tell tales of the trade that goes on in this auction house. One by one, blacks are shoved unto a small stage to stand, their hands tied, while the auctioneer calls out the bids. Here, human beings are herded like cattle to be sold into involuntary servitude, serfdom, and slavery.;;;;;;;;;;x;
EVTNAME16115;Slave Ships;;;;;;;;;x;
EVTDESC16115;They step off the ship, dazzled by the bright light of the sun they had not seen for many months, looking upon this strange new land and its strange inhabitants. Perhaps, deep down, they had hoped that this was the end of their hardship, but the plantations of the South spare no man...\n\nWhile the Atlantic Slave Trade might officially have ended, the ports of America are bustling with activity, fulfilling the needs of an institution that nation dears not abolish.;;;;;;;;;x;
EVTNAME16116;Slave Ships;;;;;;;;;x;
EVTDESC16116;They step off the ship, dazzled by the bright light of the sun they had not seen for many a week, looking upon this strange new land and its strange inhabitants, perhaps feeling a tingling of freedom, after being stuck in a dank and cramped hold for so long. Perhaps even, deep down, they had hoped that this would be the end of their hardship, but the plantations of the South spare no man...\n\nWhile the Atlantic Slave Trade might officially have ended, the coast of $STATENAME$ is bustling with activity, fulfilling the needs of an institution the nation dears not abolish.;;;;;;;;;x;
EVTNAME16121;Abolitionist Pamphlets;;;;;;;;;;;;;x;;;;
EVTDESC16121;An extensive tract, describing the purported unconstitutionality of slavery, is being widely disseminated in $PROVINCENAME$. Allowing its continued circulation might upset the lower classes -- where it has seen its widest circulation -- but attempting to curtail distribution will definitely be regarded as an attack on freedom of speech, which will anger the districts big-wigs. Shall we try to curtail the distribution?;;;;;;;;;;;;;x;;;;
EVTNAME16131;Fugitive Slave;;;;;;;;;;;;;x;;;;
EVTDESC16131;'Where am I!?', he wakes up screaming. Upon being told that he was found collapsed just a few yards north across from the $STATENAME$ border, he starts laughing. It's a calm laugh, interrupted only by the occasional cough. - '$STATENAME$. I'm in $STATENAME$. Oh merciful Lord, I'm in $STATENAME$!' The man is a slave, escaped from some or other plantation down South of Mason-Dixon. He's wounded, but still alive. What perils he has suffered on his way to $PROVINCENAME$, only the good Lord knows. Federal law mandates that he be returned to his owner.;;;;;;;;;;;;;x;;;;
EVTOPTB16130;He stays in $STATENAME$;;;;;;;;;;;;;;x;;;;;;;;;;;;;;
EVTNAME16141;Underground Railroad;;;;;;;;;;;;;x;;;;
EVTDESC16141;The Underground Railroad was an informal network, run by abolitionists of varying creeds and colors, dedicated to helping slaves escape from the southern slave-states to freedom in the North. We have every reason to believe that $PROVINCENAME$ has recently developed into a hotbed of Railroad activity. We could put pressure on local politicians to combat their activities, but only at the risk of stirring up abolitionist sentiments in the North.;;;;;;;;;;;;;x;;;;
EVTNAME16151;Copperheads;;;;;;;;;;;;;x;;;;
EVTDESC16151;The 'Copperheads' were a group of Democrats in the Northern United States who, during the Civil War, opposed the war, and favored a peace settlement with the South. The moniker came originally from Unionists likening them to poisonous snakes, but it soon struck home with the Copperheads themselves. While there is no war yet, there is staunch resistance to abolitionism within some democratic circles in $PROVINCENAME$. Stepping up the local political campaigning could probably neutralize them, but only at the cost of offending Southern sentiments.;;;;;;;;;;;;;x;;;;
EVTNAME16311;The Amistad;;;;;;;;;;;;;x
EVTDESC16311;The Supreme Court is about to hear a contentious case involving the Spanish schooner 'La Amistad', which had been brought to one of our ports after suffering a slave rebellion.\nThe British have taken a keen interest in the case: arguing that the slaves had originated in Africa and were transported -in violation of treaties signed by both Spain and the U.S.- across the Atlantic: They should therefore be released. A position much lauded and supported by domestic abolitionists, who have formed commitees to support the Amistad slaves. The Spanish, however, counter that the Amistad was carrying domestic slaves, born before 1820, for -legal- internal trade and, as the crime occured on a Spanish ship, to Spanish nationals, in Spanish waters, only they have juristiction on the matter, in accordance with treaties signed between our nations.;;;;;;;;;;;;;x
EVTDESC16313;In a ruling delivered today, the Supreme Court has decided that the slaves involved in the violent rebellion aboard the Spanish schooner 'Amistad' of 1839, later apprehended near Long Island, New York, are legal property of their Spanish owners and should be returned to their possession as soon as possible in accordance with the Pinckney's Treaty. The court has no standing to question the legality of their status of slaves under Spanish law, and would be a mute point, as the slaves would -under U.S. law- have to be returned to Spain to stand trial for their involvement in the mutiny and death of the crew. This ruling is viewed as a landmark victory for property rights, and by extension slave power.;;;;;;;;;;;;;x
EVTDESC16314;In a ruling delivered today, the Supreme Court has decided that the slaves involved in the violent rebellion aboard the Spanish schooner 'Amistad' of 1839, later apprehended near Long Island, New York, are, in light of the outlawing of the trans-atlantic slave trade, slaves nor property, but, as the mutiny occured on a Spanish ships in Spanish waters resulting in the death of Spanish nationals, the Court has no standing to judge this matter and they have to be returned to Spain to stand trial.;;;;;;;;;;;;;x
EVTNAME16320;Civil Discourse;;;;;;;;;;;;;x;;;;
EVTDESC16320;'Mr. Sumner, I have read your speech twice over carefully. It is a libel on South Carolina, and Mr. Butler, who is a relative of mine.'-Representative Preston Brooks\n\nA brutal onslaught took place on the House floor today, as Southern representative Brooks pulled out his cane and proceeded to beat abolitionist Sumner senseless over an inflamatory and offensive speech made earlier. Caught by suprise, Sumner had no defense and no help, as any intercession was blocked by Brook's associates. Not even the breaking of the cane or Sumner's collapse to the ground halted the assault, only the arrival of the Sergeant at Arms did. Sumner lives, but is expected to suffer lasting damage from his ordeal.\nAnd yet, while this may be the most prominent example to date, this is not an isolated incident, as the battle lines over the issue of slavery are increasingly clear in our society.;;;;;;;;;;;;;x;;;;
EVTNAME16326;Prigg v. Pennsylvania;;;;;;;;;;;;;x
EVTDESC16326;A man by the name of Edward Prigg was convicted some time ago under Pennsylvania law on grounds of abduction and assault for trying to return a -virtually free, but never legally emancipated- slave to her legal owners. As such action is legal under the Constitution and federal law, Prigg has brought suit against the state of Pennsylvania on the grounds that Pennsylvania law violates the Constitution and federal law.\n\nThe Supreme Court, having heard the arguments, has ruled that the Pennsylvania law is unconstitutional as a denial of slaveholder right's to recover their property under the Constitution and federal law. However, the rulling included the caveat that, if state law so prohibits, state officials cannot be compelled to enforce these rights. In effect, this rulling relieves state officials from their duty to enforce the return of fugitive slaves and makes it a fully federal matter, only enforcable by federal officials.;;;;;;;;;;;;;x
EVTDESC16327;A man by the name of Edward Prigg was convicted some time ago under Pennsylvania law on grounds of abduction and assault for trying to return a -virtually free, but never legally emancipated- slave to her legal owners. As such action is legal under the Constitution and federal law, Prigg has brought suit against the state of Pennsylvania on the grounds that Pennsylvania law violates the Constitution and federal law.\n\nThe Supreme Court, having heard the arguments, has ruled that the Pennsylvania law is unconstitutional as a denial of slaveholder right's to recover their property under the Constitution and federal law. Adding that state officials are compelled to uphold the constitutional rights of slaveholders, failure to do so resulting in penalties.;;;;;;;;;;;;;x
EVTNAME650010;The Trail of Tears;;;;;;;;;;;;;x;;;;
EVTDESC650010;The U.S. Congress has enacted the Indian Removal Act, which authorises the U.S. President to enter into negotiations with us to swap our territory east of the Mississippi for new lands west of the river.\n\nThey have now come to force us of our land, and we dear not refuse.;;;;;;;;;;;;;x;;;;
EVTNAME650011;Treaty of Dancing Rabbit Creek;;;;;;;;;;;;;x;;;;
EVTDESC650011;'In the whole scene there was an air of ruin and destruction, something which betrayed a final and irrevocable adieu. ... I asked one why they were leaving their country. "To be free," he answered, could never get any other reason out of him. We... watched the expulsion... of one of the most celebrated and ancient American peoples.' -Alexander de Tocqueville, Democracy in America.\n\nUnder the terms of the Indian Removal Act, we have agreed to a landswap with the Choctaw Nation. They are now marching West, to settle in a new home, away from the bones of their ancestors.;;;;;;;;;;;;;x;;;;
EVTNAME650012;Treaty of Cusseta;;;;;;;;;;;;;x;;;;
EVTDESC650012;'Your Father has provided a country large enough for all of you, and he advises you to remove to it. There your white brothers will not trouble you: They will have no claim to the land, and you can live upon it you and all your children, as long as the grass grows or the water runs, in peace and plenty. It will be yours forever.' -President Andrew Jackson\n\nUnder the terms of the Indian Removal Act, we have agreed to a landswap with the Creek Nation. They are now marching West, to settle in a new home, away from the bones of their ancestors.;;;;;;;;;;;;;x;;;;
EVTNAME650013;Treaty of New Echota;;;;;;;;;;;;;x;;;;
EVTDESC650013;'I saw the helpless Cherokees arrested and dragged from their homes, driven at the bayonet point into the stockade. In the chill of a drizzling rain, I saw them loaded like cattle or sheep into wagons and started toward the west... We encountered a terrific sleet and snow storm with freezing temperatures, from that day until we reach the end of the fateful journey, the sufferings of Cherokees were awful. The trail of the exiles was a trail of death. They had to sleep in the wagons and on the ground without fire. And I've known as many as twenty-two of them to die in one night of pneumonia due to ill treatment, cold and exposure...' -Private John G. Burnett\n\nUnder the terms of the Indian Removal Act, we have agreed to a landswap with the Cherokee Nation. They are now marching West, to settle in a new home, away from the bones of their ancestors.;;;;;;;;;;;;;x;;;;
EVTNAME650015;Treaty of Payne's Landing;;;;;;;;;;;;;x;;;;
EVTDESC650015;Under the terms of the Indian Removal Act, we have agreed to a landswap with the Seminole Nation. However they claim -not completely unjustified- that the treaty was signed under duress and the new lands unsuitable for their needs. They are therefor refusing to go.;;;;;;;;;;;;;x;;;;
EVTNAME650020;The Great Intrusion;;;;;;;;;;;;;x;;;;
EVTDESC650020;"Gold! Gold! I have found Gold! A mountain of Gold!" To the White Man, gold is the object of ultimate desire. And in their persuit of it, nothing is sacred to them. Forests, mountains, settlements, treaties, all that stands between the White Man and his gold will be destroyed. Now the news of gold in our territory is spreading into White Man's lands, and this is sure to cause many to come to our lands in search of it.;;;;;;;;;;;;;x;;;;;;;;;;;;;;;;;x;;;;
EVTNAME650021;Golden Georgia;;;;;;;;;;;;;x;;;;
EVTDESC650021;A man returned to $PROVINCENAME$ from the North Georgia mountains today, carrying with him a rock with a distinctive hue, a very distinctive hue. It does not take long for it to be confirmed what the man already knew...\n\nIt seem that, this year, it isn't just the trees turning golden in Georgia.;;;;;;;;;;;;;x;;;;
EVTNAME650022;Golden Georgia!;;;;;;;;;;;;;x
EVTDESC650022;A dried up old traveller has returned from the mountains. When given a whiskey he says with a hoarse voice 'Gold! I have found Gold! A mountain of Gold!'\n\nHoping to pay his tap with a nugget, the barkeep informs him that what he thought of as gold is in fact worthless pyrite: fool's gold...;;;;;;;;;;;;;x
EVTNAME650025;Worcester v. Georgia;;;;;;;;;;;;;x;;;;
EVTDESC650025;'The relationship between the Indian Nations and the United States is that of nations. ... The Federal Government inhereted the sole right to deal with the Indian Nations from Great Britain.'\n\nThe Supreme Court has issued a ruling today, vacating the conviction of Samuel Worcester who was caught on Indian lands without a license. A requirement under Georgian state law, the Supreme Court ruled that the Indian Tribes are sovereign nations and state law is not applicable on their lands.\n\nA major setback for Georgia, which had been pursuing Indian removal in its own right, as well as advocates of states rights, as it reinforces federal supremacy.;;;;;;;;;;;;;x;;;;
EVTNAME660015;American Encroachment;;;;;;;;;;;;;x;;;;
EVTDESC660015;The Americans are ever encroaching on our territory, causing a rise in tensions. If we do not agree to some land cessions, we might loose it all!;;;;;;;;;;;;;x;;;;
EVTNAME660016;The Treaties of $PROVINCENAME$;;;;;;;;;;;;;x;;;;
EVTDESC660016;As our nation grows and ever expands westwards, tensions between our settlers and the Indians, and amongst the Indians themselves is a growing cause for concern: violence is never far on the frontier.\n\nTo protect our settlers we've been entering into treaties with the $STATENAME$ Indian tribes to open lands for settlement, as well as stabilise inter-tribal relations.;;;;;;;;;;;;;x;;;;
EVTNAME660020;The Black Hawk War;;;;;;;;;;;;;x;;;;
EVTDESC660020;In 1832 Black Hawk and a band of his followers -the British Band- crossed the Mississippi east to his home village, however the territory it occupied was ceded to US previously, and now occupied by squaters awaiting the possibility to buy it. While he may have had peaceful intentions, it was interpreted as a hostile move by the American authorities, who attacked him leading to the subsequen Black Hawk War.\n\nThis event will repeat as it triggers various other events.;;;;;;;;;;;;;x;;;;
EVTNAME660021;Frontier Life;;;;;;;;;;;;;x;;;;
EVTDESC660021;Frontiersmen are rough men, used to rough ways. They have to be. Away from the cities and civilisation, they live a harsh life of hard work and self reliance. Yet it also holds its own rewards. It is a life of adventure, it is a life of independence, it is a life of freedom. Nowhere can a man better prove himself than on the frontier.\n\nA group of $PROVINCENAME$ frontiersmen got a taste of the real frontier today, when their encampment was set upon by a group of wild Indians. Apparently, the Indians used to call it home... ;;;;;;;;;;;;;x;;;;
EVTNAME660022;The Marching Band;;;;;;;;;;;;;x;;;;
EVTDESC660022;Under a British flag they march, these Indians. A banner woven of the finest silk, granted to them for their support of the British in the War of 1812. Now, once more, this British Band marches against us...\n\nTheir intentions may not be stated, but thousands of heavily armed Indians, they do not march for no reason...!;;;;;;;;;;;;;x;;;;
EVTNAME660023;And They Keep Marching On...;;;;;;;;;;;;;x;;;;
EVTDESC660023;The Indian band marching through Illinois is proving to be an elusive force, their silk banner appearing in $PROVINCENAME$, while reports place them somewhere completely else. They are yet to open full hostilities, but the people of Illinois are getting ever more anxious on what this might mean...;;;;;;;;;;;;;x;;;;
EVTNAME660025;Disaster!;;;;;;;;;;;;;x;;;;
EVTDESC660025;All of Illinois is in turmoil as news of the disaster our forces suffered spreads... An advanced detachment harrying the British Band broke and ran when their encampment set upon by, what was perhaps, 1/6th their number of Indians. An utter and complete disgrace, which has thoroughly shaken, perhaps destroyed, the faith our people have in the armed forces...;;;;;;;;;;;;;x;;;;
EVTDESC660030;When the Americans killed a group sent to negotiate under a flag of truce, Black Hawk decided it was war! From now he engaged on a campaign of raiding American settlements and spreading wanton destruction.;;;;;;;;;;;;;x;;;;
EVTNAME660031;Refugees!;;;;;;;;;;;;;x;;;;
EVTDESC660031;'Bloodthirsty Warriors... Sweeping northern Illinois with the bosom of destruction...!'\n\n$PROVINCENAME$ is swamped with refugees from Northern Illinois and Southern Wisconson, fleeing raiding by the British Band and its leader Black Hawk.\n\n[You lost a province to the Indian Tribes.];;;;;;;;;;;;;x;;;;
EVTNAME660032;Refugees!;;;;;;;;;;;;;x;;;;
EVTDESC660032;$PROVINCENAME$ is swamped with refugees from Northern Illinois and Southern Wisconson, who left their homes after news of that the British Band has arrived in their region spread, yet the army did not show up to protect them.\n\n[You lost a province to the Indian Tribes.];;;;;;;;;;;;;x;;;;
EVTNAME660033;Raids!;;;;;;;;;;;;;x;;;;
EVTDESC660033;Various Indian nations would join in Black Hawk's war. If not to support Black Hawk, then certainly to settle some score or another.;;;;;;;;;;;;;x;;;;
EVTNAME660040;The Bad Axe Massacre;;;;;;;;;;;;;x;;;;
EVTDESC660040;Trapped on three sides by the army, on the fourth by a gunboat on the river, there was no escape for Black Hawk's British Band. Those managing to escape across the river, were mercilessly hunted down by Sioux allies.\n\nThe British Band has been decimated and is unlikely to bother us again soon.;;;;;;;;;;;;;x;;;;
EVTNAME660042;The Black Hawk Purchase;;;;;;;;;;;;;x;;;;
EVTDESC660042;Our victory over Black Hawk, his British Band and his allies, has given us grounds to acquire $PROVINCENAME$ for our own settlement.;;;;;;;;;;;;;x;;;;
EVTNAME660043;A Humiliating Defeat;;;;;;;;;;;;;x;;;;
EVTDESC660043;Sunday soldiers they are, these militia men, more interested in earning glory and having a jolly good time than winning battles. Faced with Black Hawk's fearless Band, committed to their cause, they faltered and showed their true colours. Once more they ran.\n\nThe people and state of Illinois have decided that they prefer to leave the North Illinois to Indians...;;;;;;;;;;;;;x;;;;
EVTNAME660051;A meeting at Fort Lamarie;;;;;;;;;;;;;x;;;;
EVTDESC660051;The Great Father has called a meeting of all the Plains Nations, no doubt to force the cession of our lands...;;;;;;;;;;;;;x;;;;
EVTDESC660052;The Great Father has called a meeting of all the Plains Nations, at Fort Lamarie. This is located within Sioux territory: our nemesis!;;;;;;;;;;;;;x;;;;
EVTNAME660055;The Treaty of Fort Laramie;;;;;;;;;;;;;x;;;;
EVTDESC660055;The $FROMCOUNTRY_ADJ$ have agreed to our proposals.;;;;;;;;;;;;;x;;;;
EVTDESC660056;The $FROMCOUNTRY_ADJ$ have rejected our proposals.;;;;;;;;;;;;;x;;;;
EVTDESC660057;The $FROMCOUNTRY_ADJ$ have sent word that they do not intent to participate to answer our call for a conference, stating that Fort Laramie is within Sioux territory, their enemies.;;;;;;;;;;;;;x;;;;
EVTNAME680100;The Oregon Trail;;;;;;;;;;;;;x;;;;
EVTDESC680100;[Placeholder];;;;;;;;;;;;;x;;;;
EVTNAME680101;The York Factory Express;;;;;;;;;;;;;x;;;;
EVTDESC680101;[Placeholder];;;;;;;;;;;;;x;;;;
EVTNAME680102;The Great Trek of $YEAR$;;;;;;;;;;;;;x;;;;
EVTDESC680102;[Placeholder];;;;;;;;;;;;;x;;;;
EVTNAME680105;The Oregon Trail;;;;;;;;;;;;;x;;;;
EVTDESC680105;New settlers have arrived in the Oregon Territory. Traveling west over the Oregon Trail, these are American settlers.;;;;;;;;;;;;;x;;;;
EVTNAME680106;The York Factory Express;;;;;;;;;;;;;x;;;;
EVTDESC680106;New settlers have arrived in the Oregon Territory. Traveling west via the York Factory Express, these are British settlers.;;;;;;;;;;;;;x;;;;
EVTNAME680103;New Lands!;;;;;;;;;;;;;x;;;;
EVTDESC680103;The rapid inflow of migrants means most easily accessible lands have been settled. New arrivals, looking for better territories, have decided to settle new lands!;;;;;;;;;;;;;x;;;;
EVTNAME675000;Into the Wild;;;;;;;;;;;;;x;;;;
