;;;;;;;;;;;;;x
EVTDESC675000;Moving through the wilderness along ancient Indian paths, when suddenly the atmosphere changes: The wood are starting to thin and the narrow path becomes what could almost be considered a road. Tree stumps indicate someone recently logged these woods, then, there, in the distance, smoke! Coming from what appears to be a log cabin!\n\nSlowly, as the population along the coast increases, people are pushing back the frontier in search of new and fertile lands to settle.\n\n[You gained $PROVINCENAME$];;;;;;;;;;;;;x;;;;
EVTNAME675001;Into the West;;;;;;;;;;;;;x;;;;
EVTDESC675001;[Placeholder]\n\n[You gained $PROVINCENAME$];;;;;;;;;;;;;x;;;;
EVTNAME675002;The Numbered Treaties;;;;;;;;;;;;;x;;;;
EVTDESC675002;[Placeholder]\n\n[You gained $PROVINCENAME$];;;;;;;;;;;;;x;;;;
EVTNAME675003;Along the $STATENAME$ Coast;;;;;;;;;;;;;x;;;;
EVTDESC675003;Maps you say? Maps?! Sure, they show the coast and currents well enough, but human settlements? No... Things change too rapidly here to keep up to date maps on such matters.\nAs the ship enters the bay it becomes clear that the reports of settlement had been greatly exeggerated. Somebody is living here, but not enough to make this a profitable venture... But it matters not, if not here, then a few miles up the coast there will be more people. And so the ship pushes further northward, ever northwards... \n\n[You gained $PROVINCENAME$];;;;;;;;;;;;;x;;;;
EVTNAME675010;Canadian Settlement Act;;;;;;;;;;;;;x;;;;
EVTDESC675010;The growing population of Canada is pushing people west, into the wood and onto the priarie.;;;;;;;;;;;;;x;;;;
EVTNAME675031;Gold!;;;;;;;;;;;;;x
EVTDESC675031;'Gold! Gold! Gold from the $COUNTRY_ADJ$ River!'\n\nA man, as if possessed, runs through the streets of $PROVINCENAME$, raising a vial of gold in one hand, flapping his hat in the other, franticly proclaim the discovery of gold in the mountains of California.\n\nEarlier this day, that very same man opened the only store in prospecting equipment in the region...;;;;;;;;;;;;;x
EVTNAME675032;Gold!;;;;;;;;;;;;;x
EVTDESC675032;A dried up old traveller has returned from the wilderness. When given a whiskey he says with a hoarse voice 'Gold! I have found Gold! A mountain of Gold!'\n\nHoping to pay his tap with a nugget, the barkeep informs him that what he thought of as gold is in fact worthless pyrite: fool's gold...;;;;;;;;;;;;;x
EVTNAME675035;The Forty-Niners;;;;;;;;;;;;;x
EVTDESC675035;'It was a driving, vigorous, restless population... It was a curious population. It was the only population of the kind the world has ever seen gathered together, and it is not likely the world will ever see its like again. For, observe, it was an assemblage of two hundred thousand young men -not simpering, dainty, kid-gloved weaklings, but stalwart, muscular, dauntless young braves, brimful of push and energy, royally endowed with every attribute that goes to make up a peerless and magnificent manhood- the very pick and choice of the world's glorious ones... The stranges population, the finest population, the most gallant host that ever trooped down the startled solitudes of an unpopulated land.' -Mark Twain\n\nThey come from all walks of life, these 49ers, setting out for a new new life, hoping to strike it rich in the mountains of California.;;;;;;;;;;;;x
EVTNAME675036;The Forty-Niners;;;;;;;;;;;;;x
EVTDESC675036;As news of the gold finds of California spreads around the world, men of all walks of life are descending on the state, hoping to find instand wealth in the mountains.\n\nThe people of Oregon, being closest to the action, are among the first to participate in this mass movement of people, and in doing so are opening up new territories for settlement.;;;;;;;;;;;;;x
EVTNAME675041;Gold!;;;;;;;;;;;;;x
EVTDESC675041;A dried up old traveller has returned from the wilderness. When given a whiskey he says with a hoarse voice 'Gold! I have found Gold! A mountain of Gold!';;;;;;;;;;;;;x
EVTNAME675042;Gold!;;;;;;;;;;;;;x
EVTDESC675042;A dried up old traveller has returned from the wilderness. When given a whiskey he says with a hoarse voice 'Gold! I have found Gold! A mountain of Gold!'\n\nHoping to pay his tap with a nugget, the barkeep informs him that what he thought of as gold is in fact worthless pyrite: fool's gold...;;;;;;;;;;;;;x
EVTNEWS16310_long;In a landmark ruling delivered today, the U.S. Supreme Court has decided that the slaves involved in the violent rebellion aboard the Spanish schooner 'Amistad' of 1839, later apprehended near Long Island, New York, were merely, in light of the outlawing of the trans-atlantic slave trade, acting in defense of their personal liberty. They are therefore, to the joy of the abolitionists, to be set free.;;;;;;;;;;;;;x
EVTNEWS16310_medium;The U.S. Supreme Court issued a ruling today that the slaves involved in the violent rebellion aboard the Amistad were merely, in light of the outlaw of the trans-atlantic slave trade, acting in defense of their personal liberty, and are therefore to be set free.;;;;;;;;;;;;;x
EVTNEWS16310_short;The U.S. Supreme Court issued a ruling today that the slaves rebelling aboard the Amistad were merely acting in defense of their personal liberty, and are therefore to be set free.;;;;;;;;;;;;;x
EVTNEWS16313_long;In a landmark ruling delivered today, the U.S. Supreme Court has decided that the slaves involved in the violent rebellion aboard the Spanish schooner 'Amistad' of 1839, later apprehended near Long Island, New York, are legally the property of their Spanish owners, and are therefore, in accordance with Pinckney's Treaty, to be returned to their Spanish owners at the earliest convenience. Further nothing that they would -under U.S. law- have to be extradited to Spain to stand trial for their involvement in the mutiny and murder of the crew in any case.;;;;;;;;;;;;;x
EVTNEWS16313_medium;The U.S. Supreme Court issued a ruling today that the slaves involved in the violent rebellion aboard the Amistad are legally property and are therefore, in accordance with Pinckney's Treaty, to be returned to their Spanish owners at the earliest convenience.;;;;;;;;;;;;;x
EVTNEWS16313_short;The U.S. Supreme Court issued a ruling today that the slaves rebelling aboard the Amistad are property and are therefore to be returned to their Spanish owners at the earliest convenience.;;;;;;;;;;;;;x
EVTNEWS16314_long;In a ruling sure to please few, the U.S. Supreme Court has decided that those involved in the violent rebellion aboard the Spanish schooner 'Amistad' of 1839, later apprehended near Long Island, New York, are, in light of the outlawing of the trans-atlantic slave trade, not legally slaves, but U.S. law requires their extradition to Spain to stand trial for their involvement in the mutiny and death of the crew.;;;;;;;;;;;;;x
EVTNEWS16314_medium;The U.S. Supreme Court issued a ruling today that those involved in the violent rebellion aboard the Amistad are property nor slaves, but are, in accordance with U.S. law, to be extradited to the Spanish to stand trial for their involvement in the death of the crew.;;;;;;;;;;;;;x
EVTNEWS16314_short;The U.S. Supreme Court has ruled that those involved in the rebellion aboard the Amistad are not slaves, but still have to be extradited to Spain to stand trial for the death of the crew.;;;;;;;;;;;;;x
EVTNEWS16320_long;A brutal beating took place on the floor of the U.S. House of Representatives when the Southern assaulted the abolitionist Sumner with his cane, till the cane broke and his victim collapsed. Sumner, who is badly injured and expected to suffer lasting damage from his ordeal, had earlier made an inflamatory speech condemning slavery and the Kansas-Nebraska Act, and was particularly offensive to one of its authors: Senator Butler, uncle to Brooks.;;;;;;;;;;;;;x;;;;
EVTNEWS16320_medium;The heathed atmosphere surrounding the issue of slavery has let one Southern representative to assault and beat senseless an abolitionist representative after he made inflamatory and degratory remarks concerning slaveholders and the South.;;;;;;;;;;;;;x;;;;
EVTNEWS16320_short;A brutal beating took place on the floor of the U.S. House of Representatives, as a Southern representative assaulted an abolitionist after he made inflamatory and offensive remarks.;;;;;;;;;;;;;x;;;;
EVTNEWS660025_TITLE;STILLMAN RAN!;;;;;;;;;;;;;x
EVTNEWS660025_LONG;Tensions between Indians and American settlers in Illinois have been rising steadily of late, as Indian chief Black Hawk and his British Band -so called because they fight under a British banner gifted to them for their support in the War of 1812- have been making their way across northern Illinois. Combat was neigh unavoidable, but has resulted in a humiliating defeat for the Illinois militia, who ran after facing an Indian force 1/6th their size.;;;;;;;;;;;;;x
EVTNEWS660025_MEDIUM;Humiliating defeat inflicted on the Illinois militia by Black Hawk and his English Band of native soldiers after the militia killed emissaries under a flag of truce. May the place be forever remember as there where Stillman Ran.;;;;;;;;;;;;;x
EVTNEWS660025_SHORT;Commander of the Illinois militia Stillman beat a hastly and panicked retreat after being set upon by Black Hawk and his British Band of Indian warriors.;;;;;;;;;;;;;x
EVTNEWS675036_TITLE;Californian Gold;;;;;;;;;;;;;x
EVTNEWS675035_LONG;California may now very well be renamed the Golden State, for all along its rivers and mountains easily recoverable gold is to be found in great quantities. From all over the American nation and the world, and from all walks of life, hundreds of thousands have left their old lives behind and are heading for the mountains of California, hoping to strike it rich. ;;;;;;;;;;;;;x
EVTNEWS675035_MEDIUM;Gold has been found in considerable quantities on the American River. One person brought thirty dollars worth to the mint, gathered there in a short time. $STATENAME$, no doubt, is rich in mineral wealth: Great chances here for scientific capitalists.;;;;;;;;;;;;;x
EVTNEWS675035_SHORT;California may now very well be renamed the Golden State, for all along its rivers and mountains easily recoverable gold is to be found in great quantities: opportunities abound.;;;;;;;;;;;;;x
indian_removal_act_NEWS_LONG;An act passsed by the U.S. Congress has authorised the President to enter into negotiations with Indian tribes with the aim of securing their removal from their traditional homelands to new lands west of the Mississippi. An act of mercy, the U.S. President argues, as their homelands are encroached upon by settlers. Under this march of progress, the Indians are sure to dissappear anyway. West of the Mississippi, away from civilisation, they can at least preserve their way of life and maintain self-determination.;;;;;;;;;;;;;x
indian_removal_act_NEWS_MEDIUM;Under a newly passed Act of Congress, the U.S. President has been authorised to negotiate with Indian tribes for their removal to federal territory west of the Mississippi. An act of mercy, the U.S. President argues, as under the march of progress they would face extinction.;;;;;;;;;;;;;x
indian_removal_act_NEWS_SHORT;Today the U.S. Congress passed an act authorising the President to negotiate with Indian tribes for their removal to federal territories west of the Mississippi.;;;;;;;;;;;;;x
