schomburgk_line_title;The Schomburgk Line;;;;;;;;;;;;;
antoine_clot_desc;A French doctor named Antoine Clot has held an esteemed medical practice in Egypt for 5 years as Surgeon-in-Chief of the Armies. Before he arrived from France, our country did not yet have a medical care system: since then he has worked as director of the first medical school in Egypt, Kasr al-Aini Medical School, and even has been made chief surgeon for Muhammad Ali Pasha. Clot is a force of Egypt's modernization. With this modernization comes a need to bring women into the fold. We should grant Clot's request to open a women's medical school.;;;;;;;;;;;;;
PRIESTJOVICA;The always separatist-minded Serbs have launched a rebellion against us in Bosnia, led by a radical Orthodox priest named Jovica Ilic. It was sparked when Ilic petitioned former Prince Milos Obrenovic for support for an armed revolt, then met with fellow priests who each agreed to help organize participants. Violence is currently concentrated in Tuzla and around Banja Luka. With Prince Milos' support, this rebellion can prove dangerous down the road. Should we allow the Serbs and Croats to ever get any silly ideas again, after Serbia's short-lived independence from 1804 to 1817?;;;;;;;;;;;;;
EVTDESC16051840;In the rural town of Uster, Zürich canton, locals gathered today in a peaceful assembly to protest the overrepresentation of the cantonal capital compared to Zürich's rural parts. They argue that Uster's livelihood has been neglected, causing its locals to languish in poverty and remain largely uneducated. They also call for a new constitution to overhaul the governance of all Switzerland's cantons. For citizens to call for the constitution's repeal or amendment is unheard of: they are legally prohibited from petitioning the government to make such changes. Neverless, the liberal ideas left behind by Napoleon's rule clearly are still showing their influence. This will definitely not be the last call by our people for fair representation.;;;;;;;;;;;;; 
EVTDESC16051841;Never before have our people made such strong demands against our government while also not shedding a drop of blood. Today, discontent locals in the Freiamt region of Aargau canton led an uprising in protest of reduced rural representation in the constitution. They demonstrated their resolve by organizing themselves into militias. Despite clashes across Freiamt where about 6,000 total militia members confronted Swiss forces--with both sides prepared to engage--not a single shot was fired. Miraculously, the government agreed to a revision to the constitution and negotiated an end to the uprising. This marks an indelible end to the illiberal, undemocratic government before Napoleon's time, where the government could get away with unequal or unfair representation of the people. Aargau was ruled particularly heavy-handedly by governor Johannes Herzog, who has been claimed to want to run a duchy instead of a canton. Well, his tyranny ends now.;;;;;;;;;;;;; 
EVTDESC16051843;The tyrannical general Resid Mehmed has at long last acted on the Ottomans' behalf to tighten their choke hold on the Albanian people. The general invited 500 Albanian beys to attend a meeting where they would be rewarded for their loyalty to their government. When they arrived, the beys were greeted by a military procession--but the next thing they knew, upon a hand signal from Mehmed, the Turkish soldiers opened fire on the beys and killed them all. \n\nThe Ottomans have removed the one element in the government we could count on to stop our full annexation. Lest we let our dream of an independent Albania die out, we must rally our people and declare a war for our liberation against the Ottomans--right now. Our surviving political leaders have already organized soldiers to do so.;;;;;;;;;;;;; 
EVTDESC16051844;General Resid Mehmed has taken rash action to tighten our grip on the administration in Albania by committing a massacre against Albanian beys, traditional chieftains. About 500 of them were invited to a meeting where they were told they were to be rewarded for their loyalty to the government at. They attended, and after their arrival they were greeted by a ceremonial solute parade of soldiers, which was in fact an ambush. Upon a sign from Resid Mehmed, they fired upon the beys, slaughtering them all. This massacre comes as a response to the behavior of the Pashaliks of Yanina and Shkodra, who had ambitions to finally create an independent Albania. But the Albanian people will not stand for this--they have already taken up arms to challenge our forces head-on.;;;;;;;;;;;;;
PNT_prov_gov_conservative;Lazistan;;;;;;;;;;;;;
bavarian_ludwig_railway_title;The Bavarian Ludwig Railway;;;;;;;;;;;;;
bavarian_ludwig_railway_desc;Railways are the future of transportation. With their recent invention in Britain promising speedy commutes between cities, it is not hard to imagine that Germany would benefit greatly from building their own. The Royal Privileged Ludwig Railway Company may obtain a charter for building a railway in Bavaria right now--also the first in all of Germany.;;;;;;;;;;;;;
GREATMOONHOAX;A series of articles anonymously published in New York newspaper The Sun are causing a stir. They claim there exists not only life but an entire civilization on Earth's moon, with no one having previously observed them. It features fantastical illustrations of the moon's geography and creatures such as a man with bat wings, which the articles claim are common inhabitants on the moon. These claims are clearly false, but they nevertheless have proven beneficial for The Sun's circulation, allowing the paper to claim a new height of success. The articles' author, meanwhile, has yet to be revealed.;;;;;;;;;;;;;
FIRSTCANUTREVOLT;Lyon, a city dominated by silk-based manufacturing, has descended into chaos in the wake of riots by silk workers, who are known in French as canuts. The workers, reacting to a drop in wages, are demanding a minimum price to be imposed on silk products and seized weapons from the national guard to enforce this demand. They soon engaged the national guard and the military in battle, leaving Lyon entirely in their hands. However, the government was able to retake the city without further bloodshed and without conceding to the workers' demands.;;;;;;;;;;;;;
france_bullies_algeria_title;The Conquest of Algiers;;;;;;;;;;;;;
france_bullies_algeria_desc;Tension between France and the Deylik of Algiers, an autonomous part of the Ottoman Empire, has escalated due to Algerian pirates raiding European ships. With these Barbary Pirates being a major thorn in our backside, it's about time we show them their place and conquer Algiers for ourselves. We even have the perfect casus belli: a provocation by Hussein Dey, who struck the French consul, Pierre Deval, with a fan during a heated argument over both countries' trade debts to each other.;;;;;;;;;;;;;
CONCEPCIONEARTHQUAKE;A devastating earthquake has hit Concepción and nearby Talcahuano today at 11:30 AM. The quake combined with a resulting tsunami have left Concepción destroyed, with most buildings in ruins. Miraculously, though, casualties have remained low, with only 50 people reported dead. The lack of deaths is attributable to how the quake was slow to intensify and happened at about high noon, allowing locals to get to safety in time. Charles Darwin happened to be in Concepción as the earthquake struck, on a stop for the second voyage of the HMS Beagle. He would describe the quake as such: "I happened to be on shore, and was lying down in the wood to rest myself. It came on suddenly, and lasted two minutes, but the time appeared much longer. The rocking of the ground was very sensible . . . The people rushed out of doors in the greatest alarm. It is these accompaniments that create that perfect horror of earthquakes, experienced by all who have thus seen, as well as felt, their effects.";;;;;;;;;;;;;
PHILIPE1ASE1;An assassination attempt was made on King Louis-Philippe today at the hands of Republican terrorists. During a royal procession held near the Place de la République in Paris, conspirators Giuseppe Marco Fieschi, Theodore Pépin, and Philippe Morey discharged a homemade volley gun with 25 barrels at the King and his soldiers. The barrage killed 18 people but only minorly wounded Louis-Philippe, and Fieschi was immediately captured. \n\nIt has since then been discovered that four barrels of the volley gun did not fire due to the components' failure. Surely more would have died, including the King, had the weapon worked as intended. Fieschi is imprisoned and awaiting trial, while Pépin and Morey are still at large.;;;;;;;;;;;;;
ZAKHOISSORAN;We were established in 1399 and subjugated by the Turks in 1554. We stayed their peacable vassal for several centuries until Mir Mohammed proclaimed himself "Emir Mansur"--an independent ruler. We have since then expanded our army and begun waging war on neighboring principalities, hoping to become the dominant Kurdish tribe. But now, we have gone a bridge too far for the Ottomans--figuratively and literally--crossing the ancient Delal Bridge to conquer Zaxho, a part of the Emirate of Bohtan, which is a Turk vassal. This can only end badly. . .;;;;;;;;;;;;;
ZAKHOISBOHTAN;The Emirate of Soran was established in 1399 and subjugated by us in 1554. It stayed our peacable vassal for several centuries until the ambitious Mir Mohammed proclaimed himself "Emir Mansur"--an independent ruler. He has since then expanded his army and begun waging war on neighboring principalities, hoping for Soran to become the dominant Kurdish tribe. But now, he has gone a bridge too far--figuratively and literally--crossing the ancient Delal Bridge to conquer Zaxho, a part of our vassal the Emirate of Bohtan. Something must be done to stop Soran's expansion.;;;;;;;;;;;;;
soran_je_ottoman_title;The Subjugation of Soran;;;;;;;;;;;;;
soran_je_ottoman_desc;While the Emirate of Soran has been driven back, the Emir still poses a threat to the region's stability. Letting his rule continue despite his rebellious actions may inspire other Kurdish chiefs to do the same. While the last expedition retook Soran's conquests but had to turn back shortly before the capital, Rewanduz, due to bad wheather, this second attack is sure to put an end to the dangerous Emir once and for all.;;;;;;;;;;;;;
fund_french_settlement_in_algeria_title;Funding New French Settlers in Algeria.;;;;;;;;;;;;;
fund_french_settlement_in_algeria_desc;Although our New World colonies are gone, our settler-colonial ventures are not yet over, still going strong in Algeria. But more often than not, these settlers will need a considerable amount of funding to ensure their livelihood in the new land. Thus, as the mother nation, it is seen as our duty to provide for their needs. The question is how much money we shall offer them, if at all.;;;;;;;;;;;;;
RGADEADAF;With our newfound victory over the Algerians, we must continue the fight against the tribesman who are holding out, rallying in the hinterland against colonial rule. No one must be left alive to resist French rule!;;;;;;;;;;;;;
FRANCETROLLED;France has pathetically attempted to conquer our great nation, and they have failed, as they had failed in Egypt in 1800, Haiti in 1804, and Russia in 1812. It is time to choose to either move forward as an independent nation or reapproach the Ottoman Empire for protection.;;;;;;;;;;;;;
ANDOURENA;It is time to decide our policy of on the new settlers in Algeria and what they shall recive from the French state.;;;;;;;;;;;;;
TUZCUOGLUREVOLTS;A rebellion has risen within the Sanjak of Lazistan, resisting the installment of derebeys--local governors--who are cruel and care most about consolidating Ottoman control. This comes as a result of a blood feud between the Hazinedaroglu and Tuzcuoglu families, both of whom have vied for control of Lazistan as derebeys. Derebey Adjara Osman Hazinedaroglu has used his authority to levy large taxes on his subjects, which contributed to food scarcity in 1829 and 1830. Locals have now begun to stop paying taxes and rebel, with rival Derebey Tahir Aga Tuzcuoglu as their leader. We cannot allow Tuzcuoglu to continue his defiance. We must put an end to the rabble.;;;;;;;;;;;;;
TUZCUOGLUCRUSHED;Lazistan has been pacified and plundered by our army. With the Tuzcuoglu family removed from power, we can tighten our grip on the province and ensure its governors will be unconditionally loyal to us.;;;;;;;;;;;;;
AGRESSION_WAR_CONQUEST_ANY_NAME_TUR_PNT;The Laz Uprising;;;;;;;;;;;;;
NORMAL_WAR_CONQUEST_ANY_NAME_TUR_PNT;The Laz Uprising;;;;;;;;;;;;;
uruguay_const_1830_title;The Uruguayan Constitution of $YEAR$;;;;;;;;;;;;;
uruguay_const_1830_desc;Inspired by the liberal ideas of the American and French revolutionaries, calls for a constitution firmly establishing Uruguay as a representative democracy are echoing within the government. Under this constitution, Uruguay will be represented by a president and a two-chamber legislative branch consisting of the Chamber of Representatives and the Chamber of Senators. Meanwhile, supreme legal power will be put in the hands of the Supreme Court of Justice. The constitution will also strengthen the federal government's authority--so much so that our country will be considered a unitary republic. Nevertheless, the constitution's passing will be a firm, welcomed step in the direction toward equality and justice.;;;;;;;;;;;;;
anglo_ashanti_treaty_title;The Anglo-Ashanti Treaty;;;;;;;;;;;;;
anglo_ashanti_treaty_desc;Border conflicts with the Ashanti Empire have been a constant occurrence since we first established our colony on the Gold Coast. With it obvious, though, that the Ashanti cannot fully repel our troops and retake that land, perhaps we should send them an ultimatum. We shall force an agreement that our borders will lie on the opposite banks of the Pra River, the natural boundary of the Gold Coast colony. Of course, there's nothing stopping us from eventually breaking this treaty and conquering them entirely.;;;;;;;;;;;;;
romania_semiconst_1831_title;The Regulamentul Organic;;;;;;;;;;;;;
romania_semiconst_1831_desc;While the Romanian principalities of Wallachia and Moladvia are Ottoman vassals, we have retained garrisons in them since the war of 1828-29. The populace is becoming increasingly resentful of this, especially as we have confiscated Wallachia and Moldavia's treasuries for the time being. It is up to us to shape their governments for the better and hand them back control over their finances. The proposed Organic Regulation would form the organic law, or legal system forming the basis of government, of the principalities. It would establish a national assembly in Iasi and Bucharest elected by no more than 3000 of the most influential citizens. Furthermore, the Organic Regulation would, among other things, ensure the independence of the judiciary and establish a poll tax in place of the old indirect taxes.;;;;;;;;;;;;;
REGULAMENTULORGANIC;Russia has imposed a legal system forming the basis of government on us:  the so-called Regulamentul Organic, or "Organic Regulation." This semi-constitutional document returns to us the Russian-confiscated treasury, establishes a national assembly elected by the three thousand most influential citizens, ensures the independence of the judiciary and replaces the old indirect taxes with a poll tax among many other reforms.;;;;;;;;;;;;;
REFORMISTREVOLUTION;The government of José María Vargas has become opposed by a growing movement for the restoration of Gran Colombia. The rebels are led by heroes of the war of independence, including Santiago Mariño, Diego Ibarra and José Laurencio Silva, all formerly loyalists to the bolivarian cause. They have rallied their forces in the city of Maracaibo and begun marching East to take Caracas. Now, in turn, José Antonio Páez, the man who split Venezuela from Gran Colombia and spelled its doom has returned from retirement and assembled militia to join the struggle on the government's side. It seems that the old rivalry between proponents and detractors of Gran Colombia is to play out one final time--on the battlefield.;;;;;;;;;;;;;
peru_const_1834_title;The Peruvian Constitution of $YEAR$;;;;;;;;;;;;;
peru_const_1834_desc;Now that the Bermudists have been defeated, we can finally set about finishing the new constitution. The proposed draft mostly reiterates the 1828 constitution and follows its liberal spirit but makes some adjustments to combat instability which has been experienced since. For example, the post of vice-president would be removed due to the bad contact of former VP Antonio Gutiérrez de la Fuente. Another example is the prohibition of immediate presidential reelection, a tactic used by Augustín Gamarra to elongate his presidency.;;;;;;;;;;;;;
CONSTITUTIONALCONGRESSPRU;The 1828 Constitution had agreed that in 1833, five years later, a new constitution would be formulated to adapt to the new situation of our country and possibly implement a federal system. Thus, a constitutional congress has gathered and heald a vote to elect a provisional president until the new constitution is finished. Pretenders for the position were the liberal Luis José de Obregoso, the conservative Pedro Pablo Bermúdez and the independent Domingo Nieto. Obregoso won with 47 votes to Bermúdez's 36 and Nieto's 1.;;;;;;;;;;;;;
CONSTITUTIONALCIVILWAR;Pedro Pablo Bermúdez has rejected the result of the constitutional convention's election of José de Obregoso and risen up in revolt, beginning a civil war. While Bermúdez enjoys the support of most of the army, the populace of Lima and Arequipa are on the side of Obregoso, forcing Bermudist troops to retreat from the cities, unable to capture them with the adamant opposition of the populace.;;;;;;;;;;;;;
eventtwo_bermudists;The Civil War of 1834;;;;;;;;;;;;;
belgium_const_1831_title;The Belgian Constitution;;;;;;;;;;;;;
belgium_const_1831_desc;Belgium's existence is extraordinary, considering how divided along linguistic and cultural lines our two major ethnic groups are. Nevertheless, it is our duty to consolidate our brand-new nation, uniting the Flemish, the Walloons and the small German minority. We shall create a constitutional monarchy, a compromise between liberals and the conservatives. The state will have three branches of government and afford privileges to the Catholic Church. Basic freedoms such as that of expression, worship, and the press will be guaranteed. However, only landed subjects will be able to vote.;;;;;;;;;;;;;
BELGIANANTHEM;La Brabançonne, the song that has become a rallying cry and source of Belgian nationalism, was not, in fact, been written by a Belgian. A French mercenary serving in Brussels, known by the alias Jenneval, composed the original poem the song is based on before dying in action. The title refers to inhabitants of the region of Brabant, where Brussels is located. The poem originally scolded rioters during the revolution and claimed the Dutch Prince of Orange would be the "example of kings" and "father of Belgians" if he granted Belgium independence. However, following the bombardment of Antwerp, he wrote a second version condemning the Dutch for their brutality. An arrangement with the second version's lyrics, set by François van Campenhout to the tune of "L'Air des lancers polonais" ("Song of the Polish Lancers"), has immediately gained popularity among our people.;;;;;;;;;;;;;
BELGIUMNEEDSAKING;Although our constitution declares us a constitutional monarchy, as of yet we lack a monarch. Three options have been debated: Firstly, the Duke of Nemours, son of revolutionary king Louis-Philippe of France. Secondly, Leopold of Saxe-Coburg-Gotha, a member of the British royal house. Thirdly, a minor noble. The French candidate, while ensuring French protection would surely be concerning to the UK and Prussia who would see it as an increase in revolutionary influence in Europe. On the other hand, the British candidate would probably have some strings attached.;;;;;;;;;;;;;
BELGIUMNEEDSAKINGFRANCE;Belgium has sent us an emissary to propose the coronation of the Duke of Nemours, son of king Louis-Philippe as king of Belgium. While this would give us much influence over Belgium, it would surely attract the ire of the British and Prussians. Additionally, Belgium's industry, which is larger than ours, would, by increased interaction with our economy, hurt French artisans.;;;;;;;;;;;;;
BELGIUMNEEDSAKINGFRBEL;King Louis-Philippe has given the go-ahead to the coronation of the Duke of Nemours. Celebrations have begun amid his arrival in Brussels. Belgium finally has a king, and a popular one at that!;;;;;;;;;;;;;
BELGIUMNEEDSABONKFR;The Duke of Nemours, son of king Louis-Philippe of France, has been crowned king of Belgium at the bequest of the provisional government. This act spreads the influence of the French revolution further throughout Europe and endangers the old order. With the Louis-Philippe's son on the throne, Belgium is now a French protectorate in all but name.;;;;;;;;;;;;;
BELGIUMNEEDSAKINGFRNO;Louis-Philippe has refused to let his son become king of France. The reason he gives for this is twofold: On the one hand, he does not wish to raise the ire of the other European powers, specifically Prussia and the UK, by extending his influence. On the other hand, Belgium's industry far outmatches France's and economic intermingling between the two would hurt French artisans.;;;;;;;;;;;;;
BELGIUMNEEDSAKINGBRIISH;Belgium has sent us an emissary proposing the coronation of Leopold of Saxe-Coburg-Gotha as their king. While it would definitely increase our influence on Belgium, we would get mixed up in their ongoing conflict with the Dutch. An agreement called the "Treaty of the Eighteen Articles" has been proposed which would agree to the coronation of Leopold under the condition that the matters of Limburg and Luxembourg are for Britain to decide.;;;;;;;;;;;;;
BELGIUMNEEDSAKINGFRNOBLE;The British have outright refused to let Leopold of Saxe-Coburg-Gotha become our king, wanting to have nothing to do with our revolutionary state.;;;;;;;;;;;;;
BELGIUMNEEDSAKINGENGYES;The British have given the OK to the coronation of Leopold of Saxe-Coburg-Gotha. He has already arrived in Brussels amid much jubilation. Belgium finally has a king, and a popular one at that!;;;;;;;;;;;;;
BELGIUMAKINGENGTROLL;The British have agreed to have Leopold be crowned king of Belgium. However, they have demanded that we first sign the so-called "Treaty of the Eighteen Articles." This document would give Britain ultimate authority to decide the fate of Limburg and Luxembourg.;;;;;;;;;;;;;
BELGIUMAKINGENGTROLLNO;Belgium has agreed to sign the Treaty of the Eighteen Articles in faith that we will make a fair judgement over the issue of Limburg and Luxembourg. Leopold of Saxe-Coburg-Gotha will, after all, be king of Belgium.;;;;;;;;;;;;;
BELGIUMAKINGENGTROLLYES;Belgium has refused to sign the Treaty of the Eighteen Articles, for they lack faith that we will make a fair judgement over the issue of Limburg and Luxembourg. Leopold of Saxe-Coburg-Gotha will not, after all, be king of Belgium.;;;;;;;;;;;;;
BELGIUMINDEPENDENCE;Rebel leaders have formed a provisional government to cooperate and organize the revolt into a formidable united force. Today, they have finally declared the independence of "Belgium," a Catholic state encompassing Luxembourg, Wallonia, Flanders and Limburg. All these lands are, aside from a few forts still held by our troops, in the hands of the rebels. They have already begun reaching out to other European powers in pursuit of recognition. After the disaster in the September Days, our army is in too much disarray to fight. Our only option is biding our time and invading once we have built up our strength and licked our wounds.;;;;;;;;;;;;;
SEPTEMBERDAYS;A force of 12,000 soldiers under the leadership of Prince Frederick marched into Brussels, determined to restore order. Yet they were completely unprepared for the challenge they faced: seemingly every inhabitant is on the side of the rebellion. The soldiers were embattled from all sides and constantly under fire. The raw ferocity and determination of the populace brought the organized army to its knees, unable to hold in face of such opposition. After four days of fighting, they were routed and fled North in disarray. This humiliating defeat has solidified the rebels' position and cast doubt on whether we shall ever be able to retake the south.;;;;;;;;;;;;;
BRUSSELSRIOTS;Tensions have long been rising in our Catholic southern provinces due to grievances, including but not limited to the following: underrepresentation of Catholics in the General Assembly, the south having to pay for the larger debt of the north, Protestant domination of government ministries, and inadequate freedoms of press and assembly. With news of the successful recent revolution in France, the situation has escalated. A large group of opera-goers began rioting in the streets after attending The Mute Girl of Portici, a sentimental and patriotic opera set during an Italian 17th-century uprising against Spanish rule. Droves of inhabitants joined the mob, which proceeded to storm government offices. Now, a day later, the mayhem has only worsened, spreading across the south and driving our forces into retreat.;;;;;;;;;;;;;
THEFLAHAUTPLANENG;France has proposed that we partition Belgium instead of recognizing it. We would receive Ghent and Antwerp, while France would get Wallonia and Brussels, Prussia would be given Luxemburg and Liège, and the Dutch would receive Limburg and Hasselt. Antwerp's port would be the most likely to be used to launch an invasion of our isles with its large, close port. Thus, its control would be immensely beneficial to our defense.;;;;;;;;;;;;;
