schomburgk_line_title;The Schomburgk Line;;;;;;;;;;;;;
THEFLAHAUTPLANPRU;France has proposed that we partition Belgium instead of recognizing it. We would receive Luxemburg and Liège, while France would get Wallonia and Brussels, the UK would be given Ghent and Antwerp, and the Dutch would receive Limburg and Hasselt. Luxemburg and Liège have a large German population that would gladly join us in the future pursuit of German unification. The area is also rich in coal and iron.;;;;;;;;;;;;;
THEFLAHAUTPLANFAILS;Other powers in Europe have refused to agree to the Flahaut plan, denouncing it as unjust to the Belgian cause and unfairly imbalanced to favor us. Thus, without support of the others, the plan cannot go ahead.;;;;;;;;;;;;;
THEFLAHAUTPLANSUCCEEDS;With the other powers enthusiastically agreeing, Belgium is soon to be no more. As they have no chance against our combined might, the partition is already proceeding without opposition.;;;;;;;;;;;;;
THEFLAHAUTPLANSUCCEEDSBEL;France, the UK, Prussia and the Netherlands have agreed to partition us in the so-called Flahaut Plan. Faced with the might of all Western European great powers working together, we have no choice but to surrender.;;;;;;;;;;;;;
THEFLAHAUTPLANSUCCEEDSNET;France, the UK and Prussia have worked out a deal to partition Belgium in the so-called Flahaut Plan. Faced with the might of all Western European great powers working together, Belgium has no choice but to surrender. We will receive Limburg and Hasselt--a fraction of the territory lost, but still better than nothing.;;;;;;;;;;;;;
flauhaut_plan_title;The Flahaut Plan;;;;;;;;;;;;;
flauhaut_plan_desc;Belgium has no right to exist. Its people speak Dutch, French and German, an amalgamation utterly undeserving of a nation-state of its own. Therefore, it would be best to divide its lands. With us receiving Wallonia and Brussels, Prussia getting Luxembourg and Liège, the UK being given Antwerp and Ghent, and the Netherlands receiving Limburg and Hasselt, the Western European great powers would surely all be on board.;;;;;;;;;;;;;
ASSAMQUESTION;The Assamese kingdom of Kachari was assisted by British forces in its liberation from Burmese occupation in the Anglo-Burmese War. It makes up part of the larger region of Assam, a strip of land above Bengal comprising the fertile Brahmaputra river valley. The previous king of Kachari, Govinda Chandra Hasnu, has died and is succeeded by an heir friendly to British interests. This heir, Senapati Tularam Thaosen, is willing to give up the throne in exchange for British protection--allowing us to annex Kachari into the East India Company.;;;;;;;;;;;;
assam_puppetted_title;Puppet Assam;;;;;;;;;;;;;
assam_puppetted_desc;We would love nothing more than to control all of Assam for its rich farmland and the expansion of Britain's markets in India. The locals, however, do not easily consent to foreign rule. There is a way around this: we could restore native autonomy in the region by installing a king as tributary. The king we have in mind is Purandar Singha, a prince of the Ahom Kingdom. Under our plan, he will be installed as a ruler in Upper Assam, guaranteeing our undisputed dominance in the region without directly governing it.;;;;;;;;;;;;