end_ottoman_domination_title;End Ottoman Domination;;;;;;;;;;;;;
staatsgrundgesetz_hanova_desc;The Staatsgrundgesetz, a constitution proposed by the estates and supported by cabinet minister Caspar Detlev von Schulte would liberalize our monarchy to appease the left and prevent a repetition of the events of 1830. It would combine the Generalsteuerkasse with the K nigliche Generalkasse to a singular Steuerkasse and give the power to set our country's budget to the estates. The city of Hannover's magistrates that the government currently appoints would be made independent with a simple government veto right to their appointment, giving the city more autonomy. More importantly, it would open the upper house of the estates to farmers and the middle class. While staunch conservatives oppose this constitution, it is clearly necessary to maintain the stability of our country.;;;;;;;;;;;;;
KAPODISTRASDED;Ex-foreign minister of Tsar Alexander I of Russia - and first governor of Greece - Ioannis Kapodistrias, has just been murdered on the steps of the church of Saint Spyridon in Nafplion. His assassination was carried out by the disgruntled brother and son of one Petrobey Mavromichalis (a popular and successful leader in the uprising against Ottoman rule), whose imprisonment had been ordered by Kapodistrias. Konstantinos- Ioannis  brother, and Ioannis  son Georgios waited on the steps of the church, and killed Kapodistrias by stabbing him in the chest, and consecutively shooting him in the head. After the deed, Konstantis was shot by general Fotomaris, who witnessed the murder from his window. Georgios, however, had slipped away from the scene and would only surrender to authorities days later. He was subsequently put to death by firing squad, his last words being:  Peace Brothers! ;;;;;;;;;;;;;
althorpact_title;Althorp's Act;;;;;;;;;;;;;
althorpact_desc;The Factory Act, or Althorp s Act, would seek to establish a regular working day, specifically for children in the workforce. Children through the ages 9-12 are limited to 48 hours of work per week, children under the age of 9 would not be allowed in factories (apart from silk mills), children under the age of 18 are not allowed to work at night, children through the ages 9-13 must not work more than 8 hours a day with an hour lunchbreak, children through the ages 14-18 must not work more than 12 hours with an hour lunchbreak. The Act would also establish a Factory Inspectorate, and allow for routine factory inspections.;;;;;;;;;;;;;
ALAWITEREV;While having been relatively content with autonomous rule in the mountains of Latakia, the Alawis within our borders have started organizing an uprising at a scale we have yet to see. The cause of the recent unrest is partly due to the call for mass mobilization by Muhammad Ali, which upset the Alawites who remain loyal to the Ottomans. During a march of Egyptian soldiers from Aleppo to Latakia some 4,000 Alawi militants attacked the column, forcing the Egyptians to retreat to Latakia. The Alawite forces pursued, and laid siege to Latakia, causing much damage and monetary loss. We need to act now to return order to our rebellious provinces!;;;;;;;;;;;;;
PEASANTSPALESTINEREVOLT;Egypt's war effort against the Ottomans has led to extreme unrest in Palestine. To gather an army capable of marching to Constantinople, Ibrahim Pasha has ordered a fifth of all Muslims under Egyptian rule to be conscripted, including those in the now-conquered Levant. With this extensive draft has come high taxes that are draining the income of Levantine Arab peasants. These peasants, not owning land of their own, receive housing on the farms they tend to by their landlord and are meanwhile paid a subsistence wage that cannot survive high taxing.\n\nWith these factors contributing to huge unrest, the Palestinian sheikh Qasim al-Ahmad has ordered his followers to disobey the Egyptian draft orders and refuse to pay these taxes. Peasants and nobles alike have declared an open revolt, storming cities such as Hebron, Nablus, and Safed.;;;;;;;;;;;;;
AGRESSION_CONQUEST_ANY_NAME_EGY_PLS;The Peasants' Revolt in Palestine;;;;;;;;;;;;;
NORMAL_CONQUEST_ANY_NAME_EGY_PLS;The Peasants' Revolt in Palestine;;;;;;;;;;;;;
AGRESSION_CONQUEST_ANY_NAME_EGY_ALA;The Alawite Revolt;;;;;;;;;;;;;
NORMAL_CONQUEST_ANY_NAME_EGY_ALA;The Alawite Revolt;;;;;;;;;;;;;
SPANISHCHOLERA;It's been nine months since cholera hit France, and our authorities knew it was only a matter of time before it came to Spain as well. Over the past month, cholera was reported in Vigo, Galicia, which now hosts the majority of cases in all the country. The outbreak initially was caused by the landing of auxiliary troops in Portugal, where the War of Portuguese Succession still rages on. Almost instantly another outbreak emerged in Barcelona. But cases are spreading most widely in the south, where thousands of deaths have occurred. The plague is bringing winds of rebellion to the population, who resent the government's poor response.;;;;;;;;;;;;;
ODAALAPATRIA;A poem in Catalan entitled 'La P tria,' or 'The Homeland' in English, by Carles Aribau, has been published recently. The poem is fueling the rebirth of Catalan as a literary language and, thus, its re-emergence in everyday use. It tells of the longing for an independent Catalonia and exalts the Catalan language--a clear threat to the unity of our nation.;;;;;;;;;;;;;
FRANKFURTERWACHENSTURM;There is a spectre haunting Germany--that of liberalism--and its effects are becoming more and more visible. Today, fifty students stormed Frankfurt's Hauptwache and Konstablerwache police offices, attempting to gain access to the German Confederacy's treasury. This, in turn, would enable them to hold the Confederacy's leadership hostage and force the German states' unification. The police summarily apprehended the perpetrators. Eight of them, however, escaped to the United States. \n\nIt remains to be seen how much more influence these revolutionaries' circles will gain in Germany. One of the groups participating in the attack, the Burschenschaft, will not rest until Germany becomes a single political entity for the first time in over a millennium.;;;;;;;;;;;;;
FRANKFURTERWACHENSTURMOPT;Divided we stand, united we fall?;;;;;;;;;;;;;
RESTORERSARGQUOTEUNQUOTE;A dreary silence hangs over Buenos Aires, the calm forced upon a city after the sudden topple of the provincial government. The previously-elected governor of Buenos Aires, Juan Ram n Balcarce, has been been deposed and replaced with Juan Jos  Viamonte, a crony of Juan Manuel de Rosas. Balcarce provoked the anger of the Rosas-supporting federalists after announcing that Rosas would be tried for treason, having seized absolute power during his governance from 1829 to 1832. Thus, a contingent of federalists immediately headed for Buenos Aires from Rosas' military campaign in the Pampas and threatened to forcibly oust Balcarce. Rosas' wife, Encarnaci n Ezcurra, worked behind the scenes to ensure further military support for the coup.;;;;;;;;;;;;;
RESTORERSARGQUOTEUNQUOTEOPT;Y'all better watch out for the federales.;;;;;;;;;;;;;
KRAKOWCONSTITUTION1833;Our constitution as an independent city-state has been revised under the supervision of Austrian Chancellor Klemens von Metternich. Having started the redrafting in 1832 and completed it this year, our government has consequently been reorganized to grant more power to the occupation authorities of Austria, Prussia, and Russia. Dissidents have also been purged from our Senate. We are only independent in name now.;;;;;;;;;;;;;
KRAKOWCONSTITUTION1833OPT;Then again, when did we have the power to enforce our independence?;;;;;;;;;;;;;
munchengratz_conference_title;The M nchengr tz Conference;;;;;;;;;;;;;
munchengratz_conference_desc;The Ottomans' fate is inextricably tied to the welfare and security of Central and Eastern Europe. Having been pushed out of the Levant by Egypt, there is an increased risk that the Ottoman Empire may fall and disrupt the balance of power maintained after Napoleon's defeat. Austrian Chancellor Klemens von Metternich, therefore, proposes petitioning our former allies in the Holy Alliance--Prussia and Russia--to act together with us to maintain the Ottomans' stability. This would ensure no one power exerts total control over the Ottomans' domestic and foreign policies--least of all Russia, who gained the ability to close the Dardanelles to foreign trade at will in the Treaty of Unkiar Skelessi. We would also ensure a symbolic preservation of the conservative status quo as each of the monarchies in the former Holy Alliance battle surges of liberalism.;;;;;;;;;;;;;
MUNCHENGRATZCONFERENCERUS;The Ottomans' fate is inextricably tied to the welfare and security of Central and Eastern Europe. Having been pushed out of the Levant by Egypt, there is an increased risk that the Ottoman Empire may fall and disrupt the balance of power maintained after Napoleon's defeat. Austrian Chancellor Klemens von Metternich, therefore, proposes re-establishing the Holy Alliance of the Napoleonic Wars--Austria, Prussia and Russia--to act together to maintain the Ottomans' stability. This would ensure no one power exerts total control over the Ottomans' domestic and foreign policies--obviously meant to target us, considering the control Russia now has over trade in the Dardanelles per the Treaty of Unkiar Skelessi. We would also ensure a symbolic preservation of the conservative status quo as each of the monarchies in the former Holy Alliance battle surges of liberalism.;;;;;;;;;;;;;
MUNCHENGRATZCONFERENCEPRU;The Ottomans' fate is inextricably tied to the welfare and security of Central and Eastern Europe. Having been pushed out of the Levant by Egypt, there is an increased risk that the Ottoman Empire may fall and disrupt the balance of power maintained after Napoleon's defeat. Austrian Chancellor Klemens von Metternich, therefore, proposes re-establishing the Holy Alliance of the Napoleonic Wars--Austria, Prussia and Russia--to act together to maintain the Ottomans' stability. This would ensure no one power exerts total control over the Ottomans' domestic and foreign policies--least of all Russia, who gained the ability to close the Dardanelles to foreign trade at will in the Treaty of Unkiar Skelessi. We would also ensure a symbolic preservation of the conservative status quo as each of the monarchies in the former Holy Alliance battle surges of liberalism.;;;;;;;;;;;;;
MUNCHENGRATZCONFERENCESUCCEEDS;The M nchengr tz Convention ended today in us, Prussia, and Russia signing of a treaty to work together to preserve the Ottomans' stability and remain diplomatically close. Our Holy Alliance has been revived!;;;;;;;;;;;;;
MUNCHENGRATZCONFERENCEFAILS;The M nchengratz Convention ended in failure as Austrian, Prussian, and Russian delegates fought over the proposed treaty's terms. Our countries' self-centered foreign policies may cause Europe's balance of power to collapse. We did not care enough to work together to stop it.;;;;;;;;;;;;;
MUNCHENGRATZA;The M nchengr tz Conference;;;;;;;;;;;;;
MUNCHENGRATZB;The M nchengr tz Conference Fails;;;;;;;;;;;;;
MUNCHENGRATZC;The M nchengr tz Conference Succeeds;;;;;;;;;;;;;
ARG_prov_gov_conservative_adj;Unitarian;;;;;;;;;;;;;
ARC_prov_gov_conservative_adj;Federalist;;;;;;;;;;;;;
INCORPORATIONOFPERTH;The Swan River colony was established in 1829, declared by Captain Charles Fremantle of the HMS Challenger and has continued to sustain a decently sizable population since, with today s numbers reaching 1500 people. The name is only a pars pro toto for Western Australia, and it has now been approved for a more formal renaming to include a larger area under a single lieutenant-governor.;;;;;;;;;;;;;
SOSHANGANELIKESTROLLING;Word has reached us that Zulu King Dingane kaSenzangakhona has attacked the Portuguese fort at Louren o Marques. The garrison had apparently already largely fled and didn't put up a fight, allowing the victorious Zulu to sack the settlement and return to their lands in the South. This now leaves a power vacuum: With the Portuguese crushed and the Zulu horde headed back South, the coast is undefended and ripe for the picking.;;;;;;;;;;;;;
SOSHANGANEREKT;Disaster has struck our settlement in Louren o Marques. The prosperous slave trading port has long been our center of control over the southern coast of Mozambique and central hub of the commerce taking place in nearby trading posts. The initial calamity was Zulu King Dingane kaSenzangakhona's recent sudden attack on the settlement. A large portion of the garrison fled the fort along with governor Dion sio Ant nio Ribeiro who was later hunted down and killed. The remaining token force surrendered to the invaders without a fight, leaving the Zulu to plunder Louren o Marques. After the Zulus returned to their lands in the South, a new force arrived from the North: The Gaza Kingdom under Soshangane. Not only did he expel the remainder of our forces from the southern coast, he even crushed an expedition from Sofala, forcing our several of our colonial districts to recognize him as king and pay him tribute.;;;;;;;;;;;;;
academia_mihaleana_title;Academia Mihaileana;;;;;;;;;;;;;
academia_mihaleana_desc;Iasi lacks a higher learning institution. Perhaps the time has come to change that. We can promote intellectual Georghe Asachi's proposal for founding a new school in the city--one teaching both secondary and tertiary education.;;;;;;;;;;;;;
DEZUIDAFRIKAAN;De Zuid-Afrikaan, a monthly newspaper in South Africa, was established after the freedom of the press that is enjoyed in the motherland was granted to the Cape Colony. The paper aims to promote the interests of the educated Cape Dutch community, and so far has called for unity between the Dutch and English settlers.;;;;;;;;;;;;;
DEZUIDAFRIKAANOPT;Die Zuid-Afrikaan, uitgawe 1.;;;;;;;;;;;;;
NOONGARMASSACRE;The Binjarebs, a Nyungar tribe, have clashed with Western Australian colonists since the colony's foundation in 1829, when thousands of settlers began fencing off land and hunting the native wild-life, causing food shortages for the Aboriginal people. These clashes culminated in the colony's Governor, James Stirling, leading a detachment of 25 soldiers, police, and settlers to attack the Binjarebs. Over the next hour they shot and killed between 15 and 80 Nyungar men, women and children. The police superintendent was speared and later died. The Perth Gazette noted the attack as a "severe but well merited chastisement". ;;;;;;;;;;;;;
NOONGARMASSACREOPT;Sufficiently exemplary.;;;;;;;;;;;;;
end_ottoman_oppression_title;End the Ottoman Oppression!;;;;;;;;;;;;;
end_ottoman_oppression_desc;The Greek uprisings have done what the western world, and even the Ottoman sultan have considered all but impossible. Without any foreign assistance, the Greek people have thrown out their oppressors from the seat of power in Constantinople, and have laid claim to all that was previously taken from them in centuries past. The city is once again ours, and we can recenter the eastern world once again around that of Constantinople, the city of kings!;;;;;;;;;;;;;
end_ottoman_partisan_title;End the Partisan Raids;;;;;;;;;;;;;
end_ottoman_partisan_desc;Ever since the independence of the Rhomaion state, the local Turkish population and loyalists to the old Sultan's regime have raided the Greek countryside, wreaking havoc on the state's income and on the national economy. With a proper Rhomaion army finally put together, the Ottoman raids can be put to an end, and the perpetrators rightfully put to death.;;;;;;;;;;;;;
end_bureaucratic_rot_title;Clean up the Bureaucracy;;;;;;;;;;;;;
end_bureaucratic_rot_desc;With the Rhomaion state in power once again, one of the greatest weaknesses it unfortunately inherited from the Ottoman empire was a disloyal and rotting bureaucratic structure. With a hefty investment into a bureaucratic reform program, this can be dealt with.;;;;;;;;;;;;;
end_cession_tuscan_title;End the Tuscan Cession!;;;;;;;;;;;;;
end_cession_tuscan_desc;During the Napoleonic Wars, the territories of the Bourbon-Parma line were taken away, repossessed to France in 1801 in exchange for rule over Tuscany as the kingdom of Etruria. In the aftermath of the Napoleonic wars, the duchy of Tuscany was restored, with the exception of Lucca being handed back to the Bourbon-Parmas until such time as Parma was once again inherited to them. While Parma has been restored to the line, there is a unique opportunity to protest the annexation of Lucca back into Tuscany, using this to justify a restoration of Etruria under the Bourbon line.;;;;;;;;;;;;;
intervention_italy_1848_title;Intervention in Italy;;;;;;;;;;;;;
intervention_italy_1848_desc;The Italian Peninsula has erupted into open war, as Sardinia takes advantage of the weakened state of the Austrian Empire to seize control over Lombardia. With the status quo upended, this poses an existential threat to Bourbon interests on the peninsula, and if left unchecked may well result in the collapse of the balance of powers. Intervention, while aiding an enemy in the Austrian Empire, may prove to the best intersts of the French Kingdom in the long run.;;;;;;;;;;;;;
rebuild_palace_versailles_title;Rebuild the Versailles Palace!;;;;;;;;;;;;;
rebuild_palace_versailles_desc;The Versailles Palace, despite its famous parties and court culture, was never fully in operating condition. Attempts to finish and maintain the grand project have frequently been shut down due to the financial strain put on the economy. Furthermore, during the French Revolution, the Versailles Palace was torn apart and ransacked by revolutionary forces, leaving much in ruin or otherwise fully emptied out. With the Bourbon monarchy once again secure in its position, we have the opportunity to repair and finish the palace, leaving France with a capital to be truly proud of!;;;;;;;;;;;;;
create_sgf_france_title;Unite Southern Germany!;;;;;;;;;;;;;
create_sgf_france_desc;The Bavarian alliance has proven quite useful to France in the past, however it has its limits. Bavaria, ultimately, is not capable on its own to compete with the forces of Austria or Prussia sufficiently to prevent the unification of Germany. However, should France maintain enough influence in southern Germany, it could perhaps exploit the alliance with Bavaria to strengthen the latter's position, upending the balance of power in Germany...;;;;;;;;;;;;;
trigger_england_war_bor_title;Strike down Albion!;;;;;;;;;;;;;
trigger_england_war_bor_desc;The French navy has been modernized, and now Britain can be dealt with accordingly...;;;;;;;;;;;;;
form_boe_fra_title;Unite France and Spain!;;;;;;;;;;;;;
form_boe_fra_desc;In the early 1700s, the Hapsburg line of the Spanish monarchy died out, leaving the throne to the king of France at the time. This event, which nearly united the thrones of France and Spain into a single monarchy, directly led to the War of Spanish Succession in 1701. Despite the best efforts of the two crowns, the Hapsburg coalition achieved a partial victory, leading to the treaty of Utrecht in 1714. Now, the opportunity has come to refute this damnable treaty, and reunite the two kingdoms once more!;;;;;;;;;;;;;
form_boe_spc_title;Unite France and Spain!;;;;;;;;;;;;;
form_boe_spc_desc;In the early 1700s, the Hapsburg line of the Spanish monarchy died out, leaving the throne to the king of France at the time. This event, which nearly united the thrones of France and Spain into a single monarchy, directly led to the War of Spanish Succession in 1701. Despite the best efforts of the two crowns, the Hapsburg coalition achieved a partial victory, leading to the treaty of Utrecht in 1714. Now, the opportunity has come to refute this damnable treaty, and reunite the two kingdoms once more!;;;;;;;;;;;;;
boe_burgundy_claim_title;The Crown of Burgundy;;;;;;;;;;;;;
boe_burgundy_claim_desc;In ages long past, the Spanish monarchy found itself inheriting the crown of Burgundy after the last of its male line died out. With that came domination over Eastern France and the Benelux. While the last of these domains would be lost in the War of Spanish Succession, the restoration of the united monarchy has provided a unique opportunity to undo this wrong, and cement Spanish control over the Benelux once more.;;;;;;;;;;;;;
boe_northern_italy_title;The Crown of Italy;;;;;;;;;;;;;
boe_northern_italy_desc;The Bourbon realm of France long desired control over northern Italy, with a great deal of conflict being centered around control over the small states in the region against the Holy Roman Empire and the Hapsburgs that ruled it. Now, with the Bourbon realms united, Italy can brought to heel, ending the many conflicts once and for all.;;;;;;;;;;;;;
marotist_reforms_title;Marotist Reforms;;;;;;;;;;;;;
marotist_reforms_desc;Following the controversy surrounding Maroto regarding suspected Christino loyalties, he was pardoned by the king when the charges proved false. With his status as a primary leader of the Carlist cause restored, it has been suggested that the army adopt several reforms that he himself has pushed forth to modernize the Spanish army.;;;;;;;;;;;;;
carlist_distributism_title;Carlist Distributism;;;;;;;;;;;;;
carlist_distributism_desc;Upon the advent of socialism, the Catholic church felt compelled to make a response to the unrest the socialist movement created amongst the poor strata of society, as the Church historically held a highly conservative standpoint and felt that socialist and liberal political activism threatened to upend traditional moral and moral structures, as well as erode Catholic church authority, which had already been declining for some time. The Papal response therefore was to seek the advent of a 'third way' ideology, one that would come to be known as distributism. Characterized by clerical authority, land reform, agrarianism, and extensive preference to small business enterprise over corporations, the ideology would quickly gain traction as the primary economic policy of the Carlist movement. Passing this reform will therefore greatly strengthen resource output and education at the expense of heavy industrial efficieny, and the redistribution of land will undoubtedly come at great cost to the state.;;;;;;;;;;;;;
end_carlist_distributism_title;End Carlist Distributism;;;;;;;;;;;;;
end_carlist_distributism_desc;With the current Spanish government no longer supporting the ideology of distributism, it is now pertinent to end the policy and move towards a more modern economic system.;;;;;;;;;;;;;
constitution_of_1888_title;Constitution of 1888;;;;;;;;;;;;;
constitution_of_1888_desc;Since the succession of Carlos V to the throne of Spain, the issue of a Spanish constitution has been put on hold, due to the deeply traditionalist mindset of the Carlist support base, and fears that caving to liberal ideals would erode the authority of the church and of the Fueros system. With a more liberally-minded monarch in charge, perhaps a middle ground can be met, with the creation of a proper national legislature. The result is the Turnismo system, wherein the legislature is organized under a bicameral system between traditionalists and liberals, members of which are carefully selected before elections begin, and are purposefully rotated in order to ensure neither party maintains absolute control over the Spanish government.;;;;;;;;;;;;;
expand_germanization_1_title;Expand the Germanization Program;;;;;;;;;;;;;
expand_germanization_1_desc;The process of Germanization, thus far, has been rather slow and small in scale. However, with the realm centralized, it is only natural that these policies be expanded, though it will be costly.;;;;;;;;;;;;;
expand_germanization_2_title;Expand the Germanization Program;;;;;;;;;;;;;
expand_germanization_2_desc;As time wears on, the Germanization program must be further expanded so that the Austrian Empire can bring about yet more central control.;;;;;;;;;;;;;
integrate_naples_title;Integrate the Neapolitan Crown;;;;;;;;;;;;;
integrate_naples_desc;In the aftermath of the Spanish War of Succession, the crown of Naples was awarded in the peace deal to the Hapsburg monarchy. A valuable part of the realm, the Hapsburgs ruled over it over the course of the early 1700s, until losing it in the 1730s to the Bourbon dukes of Parma. With Italy placed under Austrian supervision, this unjust loss can finally be reversed, and Naples restored to its rightful place within the empire.;;;;;;;;;;;;;
EVTNAME00001;The Maroto Controversy;;;;;;;;;;;;;
EVTDESC00001;Rafael Maroto was a well-renowned Spanish General in the American Wars of Independence, and a distinct royalist in his loyalties, pledging himself to Don Carlos after resigning from formal military command in 1833 and being subsequently imprisoned by the liberal government for six months. In following years he proved to be a loyal commander, albeit one that remained at great odds with the conduct of Carlist forces, leading to a number of defeats due to infighting and court intrigue. A decree was issued to Don Carlos, proclaiming him a traitor and responsible for the deaths of several high ranking officials in early conflicts with the Liberals. Only a short time later, with the complete noncompliance of the Carlist armed forces surrounding Maroto, and a confrontation between his supporters and Don Carlos, was this decree ultimately reneged. Maroto was later credited as saying 'I have triumphed over the arbitrariness, injustice, and blindness of a prince, and history will judge me in due course.' This has proven to be a substantial humiliation to the Royalist cause in Spain, and a key event in the formation of the Marotist party within its ranks.;;;;;;;;;;;;;
EVTOPTA00001;And division grows even in our own ranks.;;;;;;;;;;;;;
EVTNAME00002;The Death of Carlos of Molina;;;;;;;;;;;;;
