end_ottoman_domination_title;End Ottoman Domination;;;;;;;;;;;;;
EVTDESC00039;With the conclusion of the Spanish intervention in the Italian peninsula, we have been forced out of the city of Rome altogether, and our nation has been split in two. With our nation no longer properly united, and Rome back under Papal rule, we must now choose a new capital.;;;;;;;;;;;;;
EVTOPTA00039;Milan is our capital.;;;;;;;;;;;;;
EVTOPTB00039;Ravenna, the ancient capital of Rome.;;;;;;;;;;;;;
EVTOPTC00039;Venice, the city of the republic.;;;;;;;;;;;;;
EVTNAME00040;The Ecclesiastical War - Papal Italy;;;;;;;;;;;;;
EVTDESC00040;With the Spanish victory against the Italian state secured, the Pope has been placed in charge of the Italian peninsula.;;;;;;;;;;;;;
EVTOPTA00040;A holy throne.;;;;;;;;;;;;;
EVTNAME00041;The Ecclesiastical War - Divided Italy;;;;;;;;;;;;;
EVTDESC00041;In the aftermath of our disastrous defeat in the Ecclesiastical War, Spain has seen fit to destroy the Italian nation in its entirety, breaking the southern half of our nation away from us. In the aftermath, we are forced to choose a new capital.;;;;;;;;;;;;;
EVTOPTA00041;Milan is our capital.;;;;;;;;;;;;;
EVTOPTB00041;Ravenna, the ancient capital of Rome.;;;;;;;;;;;;;
EVTOPTC00041;Venice, the city of the republic.;;;;;;;;;;;;;
EVTNAME00042;The Ecclesiastical War - Italy Victorious;;;;;;;;;;;;;
EVTDESC00042;As expected, the withering Spanish kingdom broke itself upon our shores, and our troops now stand victorious against the dying ancien regime. We will claim what is owed to us.;;;;;;;;;;;;;
EVTOPTA00042;We take what is owed us.;;;;;;;;;;;;;
EVTNAME00043;The Sacrilege Controversy;;;;;;;;;;;;;
EVTDESC00043;In the 1820s, under a royaliste supermajority, the Sacrilege laws were passed, rendering the acts of blasphemy and sacrilege illegal, under penalty of anything from forced labour to death. This highly controversial law has rarely been enforced, but has remained a prominent source of criticism against the highly religious government in Paris. This controversy has recently been reignited with the case of a known liberal agitator, an atheist, who has stolen several items from the local diocese, defaced them, then later returned them in a form of protest against the government. According to the law, he is meant to be executed, although this will undoubtedly anger the liberal population. To refuse to enforce the law in this case will in turn undermine its legitimacy. What shall we do?;;;;;;;;;;;;;
EVTOPTA00043;Enforce the law.;;;;;;;;;;;;;
EVTOPTB00043;Let it slide.;;;;;;;;;;;;;
EVTNAME00044;Belgian Independence - French intervention?;;;;;;;;;;;;;
EVTDESC00044;In the aftermath of the Napoleonic Wars, France was forced to cede the region of Belgium to the Netherlands, in order to turn the latter into a proper balancing power against potentially renewed French expansionism. These culturally French and religiously Catholic lands quickly began to chafe under Dutch rule, and have now risen in revolt against their prior overlords. With their control quickly slipping, the opportunity has come for us to make an offer: we restore order to Belgium, and in return Wallonia is returned to French rule, while Flanders is restored to the Netherlands, a deal the beleagured Dutch are quite likely to accept.;;;;;;;;;;;;;
EVTOPTA00044;Send the offer.;;;;;;;;;;;;;
EVTOPTB00044;Wallonia is lost.;;;;;;;;;;;;;
EVTNAME00045;Belgian Independence - Bourbon Intervention;;;;;;;;;;;;;
EVTDESC00045;In the midst of our catastrophic civil war, an offer has come by the French, opportunistically seeking the return of its lost Belgian territories. Should we accept this offer, the French will doubtlessly restore order to the lost provinces, but it will come at a great cost, that of Wallonia.;;;;;;;;;;;;;
EVTOPTA00045;We have little choice, accept the French offer.;;;;;;;;;;;;;
EVTOPTB00045;The cost is too high.;;;;;;;;;;;;;
EVTNAME00046;Belgian Independence - The Dutch Accept;;;;;;;;;;;;;
EVTDESC00046;The Dutch have wisely accepted our offer to intervene in the Belgian crisis. Let us waste no further time.;;;;;;;;;;;;;
EVTOPTA00046;Finally.;;;;;;;;;;;;;
EVTNAME00047;Belgian Independence - The Dutch Refuse;;;;;;;;;;;;;
EVTDESC00047;The Dutch have refused our generous offer, and we have no choice but to back down.;;;;;;;;;;;;;
EVTOPTA00047;Wallonia is lost.;;;;;;;;;;;;;
EVTOPTB00048;What was that? Hand French territory over?;;;;;;;;;;;;;
EVTNAME00048;Belgian Independence - French victory;;;;;;;;;;;;;
EVTDESC00048;Our armies have marched victoriously into Belgium, as expected. In return, the Dutch will receive Flanders, but renege their cores on Wallonia.;;;;;;;;;;;;;
EVTOPTA00048;Cede to the Dutch what is theirs.;;;;;;;;;;;;;
EVTNAME00049;Instability of the Bourbon Regime;;;;;;;;;;;;;
EVTDESC00049;Despite the great unpopularity of the Bourbon monarchy, it has managed to weather the storm of public opinion, and has secured itself in place as a rightful continuation of the Ancien Regime before it. However, despite this, the liberal sect of the populace remains at great odds with the royalist powers that be, and this does not portend the end of instability within the realm.;;;;;;;;;;;;;
EVTOPTA00049;We will endure.;;;;;;;;;;;;;
EVTNAME00050;Succession of Louis XIX;;;;;;;;;;;;;
EVTDESC00050;The late Charles X's health has been declining rapidly as of late, and with his old age it has become apparent that his end is nigh. As such, it has been decided that Charles X will abdicate in his dying days, leaving the throne to his heir presumptive, who will become known as Louis XIX. His legacy is one of both restoration and rot, the restoration of the old traditions and beliefs of France, but the rot of the very same liberties that the French people attained in the Revolution, his opposition to liberal reforms being the hallmark of his reign. Nevertheless, he will rest with his fathers before him, a king of France.;;;;;;;;;;;;;
EVTOPTA00050;Long live the king!;;;;;;;;;;;;;
EVTNAME00051;Succession of Henri V;;;;;;;;;;;;;
EVTDESC00051;After just a short eight years of rule, Louis XIX has been found dead in his quarters. A man of military stature, he was at the forefront of anti-Bonapartiste sentiment in France, and was a major spearhead of the Bourbon restoration in France when he landed in Bourdeaux, and subsequently led Royaliste forces under the king for many years, even intervening in Spain during its own tumultuous fight against liberal elements. Now, however, aftr such a short reign, and in the midst of ever-increasing liberal agitation, he leaves his throne to Henri V.;;;;;;;;;;;;;
EVTOPTA00051;May his reign last.;;;;;;;;;;;;;
EVTNAME00052;Death of Henri V;;;;;;;;;;;;;
EVTDESC00052;Henri V, king of France, graced by God, has now passed. With him, the legitimate successors to the Bourbon line of Louis XIV has fully died out, and a new king must be selected. Some Legitimistes remain advocates of the absolutist line of the Bourbons, and have thus moved up the line to the Spanish Bourbons, otherwise known as the Carlist claimants to Spain. This is wildly unpopular, even among many monarchists, as this line is blatantly Spanish, and thus foreign to the French people, but selecting it opens the possibility of a power far outstripping that of most European powers, by uniting the Spanish and French thrones into one. Conversely, many Legitimistes have merged with the old Orleaniste movement, backing Philippe II, and thus adopting a more moderate, constitutionalist position. The choice remains ours.;;;;;;;;;;;;;
EVTOPTA00052;The throne shall pass to Jean III, the Spaniard.;;;;;;;;;;;;;
EVTOPTB00052;The throne passes to Philippe II, and the constitution restored.;;;;;;;;;;;;;
EVTNAME00053;Death of Jean III;;;;;;;;;;;;;
EVTDESC00053;Jean III, King of France, rightful king of Spain, has died on this day, after only a short 5 year reign. With him, the line now passes to the next among the Spanish Carlists, a more conservative choice than the prior king. He shall be coronated as Charles XI of France. A military man, it is yet to be seen whether he will enforce the claim inherited by Jean III to the Spanish throne, or whether that eventuality remains little more than a pipe dream to the Bourbon throne.;;;;;;;;;;;;;
EVTOPTA00053;And so the crown passes.;;;;;;;;;;;;;
EVTNAME00054;Death of Charles XI;;;;;;;;;;;;;
EVTDESC00054;On this day, Charles XI, king of France and the rightful heir to the Spanish throne, has died. He shall be followed by Jaime I. His procession is one of controversy, seen to some as a return to proper conservatism and a reaffirming of the noble privileges, and to others as a categorical failure, and a return to the reactionary politics so indicative of the Carlist and Legitimiste causes. Nonetheless, he shall be followed by Jaime, who inherits both the duchy of Madrid and the kingdom of Spain, to be titled Jaime III.;;;;;;;;;;;;;
EVTOPTA00054;Long live Jaime!;;;;;;;;;;;;;
EVTNAME00055;Death of Jaime I;;;;;;;;;;;;;
EVTDESC00055;Jaime I has died, and shall be succeeded by Charles XII. His procession is one of little controversy or event, being one of a moderate, quiet-spoken monarch who will be remembered for little, praised for little, and hated for little. He shall be followed by Alfonso Carlos, Duke of San Jaime, coronated as Alfonso I. A continuation of the Spanish line of Bourbons, it is feared that in the coming era this will hallmark a period of great instability for the French crown, though it remains to be seen whether these fears will come to pass or not.;;;;;;;;;;;;;
EVTOPTA00055;With a Heart of Iron France shall endure.;;;;;;;;;;;;;
EVTNAME00056;The Farmers Controversy;;;;;;;;;;;;;
EVTDESC00056;In the years following the Bourbon Restoration, fears have spiked amongst the peasant populations of the kingdom that the old feudal privelegia amongst the noble elites will be restored, and the rights granted to the people by the French Revolution will be done away with by the Ancien Regime. In recent months this fear has appeared to become quite justified, as a controversy rocks the kingdom regarding a legal dispute between a petty nobleman and a small collective of businessmen whom bought out the territory, albeit from peasants who themselves confiscated it from the nobleman during the Revolution. The nobleman demanded that the land be returned to him, as well as the profits of the unlawful sale, citing his rightful ownership of the land as reason to declare both the land and the profits garnered from it as his, whilst the merchants refused to hand it over, citing free exchange as their right. The courts, staffed with royalist sympathizers, quickly ruled in favor of the nobleman, handing the land back to him. This event has become a fiasco, not just as other noblemen similarly deprived of land and status have begun making demands of a similar caliber, but as liberals have begun agitating once again over such concerns.;;;;;;;;;;;;;
EVTOPTA00056;This does not bode well.;;;;;;;;;;;;;
EVTNAME00057;Nobility in the Army;;;;;;;;;;;;;
EVTDESC00057;Up until recently, France has been reliant on a military structure inherited from the days of the Bonaparte usurpation, promoted via merit rather than social status, and a conscription system that allows for a much larger military than the purely standing armies of days gone past. However, these reforms have come at a great cost to the political stability of the French realm, as many of the officers are no longer loyal to the king, and most have their loyalties placed with the Bonapartes they were hired from. This has caused for the French realm a situation wherein the keys to maintaining government power are largely placed in the hands of those that do not want to see the current government in power to begin with. The current administration has therefore suggested a series of reforms, seeking to dissolve the levy en masse altogether, and initiate a purge of Bonapartiste sympathizers in the military staff. This will undoubtedly weaken the military unduly, but may well save the throne from future insurrection.;;;;;;;;;;;;;
EVTOPTA00057;This is ludicrous!;;;;;;;;;;;;;
EVTOPTB00057;A brilliant plan!;;;;;;;;;;;;;
EVTNAME00058;Attempted Coup!;;;;;;;;;;;;;
EVTDESC00058;The army's loyalties have been held in question for a long time now, and now it has come to pass that these fears be proven justified. A Republican sect of the army has committed mutniy, and now is poised to seize control of the French countryside in the south of the country. While loyalist support in the military flocks north to regroup around Paris, this portends a civil war that could well cripple the French state for years to come.;;;;;;;;;;;;;
EVTOPTA00058;For the king!;;;;;;;;;;;;;
EVTNAME00059;Coup Plot Thwarted!;;;;;;;;;;;;;
EVTDESC00059;The army's loyalties have been held in question for some time, even after the reforms passed by the late Louis XIX to reorganize their structure to better benefit the crown. As of recent, those fears have largely been put to rest, as a planned Republican coup was swiftly foiled by the royal army, having discovered the traitorous plot before it could be enacted. With renewed faith in the armed forces, the station of the Bourbon monarchy is finally secure.;;;;;;;;;;;;;
EVTOPTA00059;Long Live the King!;;;;;;;;;;;;;
EVTNAME00060;Civil war - Bourbon victory!;;;;;;;;;;;;;
EVTDESC00060;With the guns finally going silent across continental France, it has become clear now that the Bourbon realm will be one to last. It has survived the liberal onslaught and the Ancien Regime remains intact.;;;;;;;;;;;;;
EVTOPTA00060;Vive la Bourbon!;;;;;;;;;;;;;
EVTNAME00061;Civil War - Republican Victory!;;;;;;;;;;;;;
EVTDESC00061;As the guns go silent across continental France, the last faction standing has shown itself to be that of the French Republic. Liberalism has finally triumphed, and the Ancien Regime is no more!;;;;;;;;;;;;;
EVTOPTA00061;Vive La France!;;;;;;;;;;;;;
EVTNAME00062;The Arpitan Republic;;;;;;;;;;;;;
EVTDESC00062;One place that the Bourbons did not expect to see resistance upon their return was the region of Arpitania, bordering the Swiss Commonwealth. Yet, as of late, liberal rebels have seized control of a decent part of the countryside, rebelling in the name of a so-called ''Arpitan Republic,'' under the hopes of...joining with Switzerland. These odd demands have left the government baffled, yet we have little choice but to put down this uprising.;;;;;;;;;;;;;
EVTOPTA00062;Put down the uprising!;;;;;;;;;;;;;
EVTOPTB00062;For Liberte!;;;;;;;;;;;;;
EVTNAME00063;France - The Spanish Kings;;;;;;;;;;;;;
EVTDESC00063;While the traditionalist segment of the French population views the Bourbons as the rightful heirs to the Kingdom of France, even so the rise of a royal family blatantly foreign in character is a highly controversial one, and one more than likely to enflame tensions in the kingdom yet again.;;;;;;;;;;;;;
EVTOPTA00063;Unfortunate.;;;;;;;;;;;;;
EVTNAME00064;The Bourbon Realm Secure - Constitution;;;;;;;;;;;;;
EVTDESC00064;With the liberals soundly defeated in France, the Bourbon realm has found itself secure in its position, free to solve its internal disputes however it sees fit. First on the drawing board is how to deal with the liberal rot that has infested the French crown since the first rioters hit the streets in the Revolution. While the most radical of the Legitimiste supporters in the realm see fit to wholly do away with all liberalized reform and bring back the Ancien Regime in full, other more moderate parties see this as a surefire way to simply cause another such crisis again? in the future, and hope to chase a more moderate approach, seeing as how the revolution cannot so easily be undone. Still, some others find it fit to seek complete reconciliation with the liberals of the realm, and remodel the Bourbon monarchy into a truly modern, liberalizing force that the French people can surely back.;;;;;;;;;;;;;
EVTOPTA00064;Le Liberalisme Est Morte!;;;;;;;;;;;;;
EVTOPTB00064;Restauration par la Moderation.;;;;;;;;;;;;;
EVTOPTC00064;La Liberte Par La Restauration!;;;;;;;;;;;;;
EVTNAME00065;The Bourbon Realm Secure - Land Crisis;;;;;;;;;;;;;
EVTDESC00065;The land crisis that began in the 1830s has become an increasingly large pain in the side of the Bourbon administration, torn between the pull of popular opinion and modernization, and the opinions of the aristocracy that make up the backbone of the monarchy's support. With the continuing introduction of more efficient technologies into the French economy, the government finally has an opportunity to bring a definitive end to the agricultural crisis, but the question remains as to whom the remaining outstanding claims will revert to.;;;;;;;;;;;;;
EVTOPTA00065;The land rightfully belongs to the aristocracy.;;;;;;;;;;;;;
EVTOPTB00065;Maybe the Carlists were onto something...;;;;;;;;;;;;;
EVTOPTC00065;We shall simply forbid the reclamation efforts.;;;;;;;;;;;;;
EVTNAME00066;The Bourbon Realm Secure - Military Reform;;;;;;;;;;;;;
EVTDESC00066;As the years have worn on, the purge of the upper staff, followed by extensive investment into the armed forces and modernization of its structure, the upper staff has finally recovered from the purges instituted in years past, and furthermore has become a well-maintained core staff akin to the Prussian model. While the army may never be able to reinstate the levy en masse, for fear of the same political instability coming to light again, the professional army may now prove sufficient to service the crown well enough.;;;;;;;;;;;;;
EVTOPTA00066;Finally, an army to be proud of.;;;;;;;;;;;;;
EVTOPTB00066;We are satisfied with simple loyalty.;;;;;;;;;;;;;
EVTNAME00067;Recognition of the Polish Partition;;;;;;;;;;;;;
EVTDESC00067;With the rule of the Bourbon monarchy in Paris finding a distinct need to regain some measure of international legitimacy in the wake of the catastrophe that was the Napoleonic wars, the decision has been made to eject any pretenses of Polish recognition, at least in official circles, from French government. As such, any Polish committees will be banned from Paris and the kingdom as a whole, maps will be forbidden from including the Polish state on the map so long as it remains partitioned, and overtures will assure that France will never support any attempt at Polish reunification. This will undoubtedly drive a permanent wedge between the French and the Polish, but ultimately it is a sacrifice that must be made in order to cool down the tense relations France unfortunately has had to endure. (THIS REMOVES THE OPTION TO FORM PLC);;;;;;;;;;;;;
EVTOPTA00067;This will help secure peace, for now.;;;;;;;;;;;;;
EVTNAME00068;Reorienting Italian Policies - Reign in Two Sicilies?;;;;;;;;;;;;;
EVTDESC00068;While the Bourbon Realm is seeking to avoid major European conflict, as such an event could only damage it further, the fact remains that to maintain security the monarchy must maintain some degree of dynamism in its foreign policy in order to maintain its status as a major power on the world stage. As it stands, the realm of Two Sicilies has a close relationship with the monarchy, and much like our own realm, struggles to maintain its status in the face of the rising tide of liberalism. As such, it has been posited that the bourbon kingdom come to a closer relationship with our crown. By reigning in this major realm in southern europe, we can ensure that French influence be maintained in Italy.;;;;;;;;;;;;;
EVTOPTA00068;Send the offer. (3 infamy if accepted);;;;;;;;;;;;;
EVTOPTB00068;Dont bother.;;;;;;;;;;;;;
EVTNAME00069;Bourbon Offer;;;;;;;;;;;;;
EVTDESC00069;With the Bourbon realms across Europe becoming increasingly threatened by a rising tide of liberalism, the Bourbon monarchs in France have suggested that we become a vassal - a client state of the Kingdom of France. To accept this offer would be to shirk our own independence in favor of security, but to refuse may raise the ire of Paris.;;;;;;;;;;;;;
EVTOPTA00069;Accept;;;;;;;;;;;;;
EVTOPTB00069;Refuse;;;;;;;;;;;;;
EVTNAME00070;The Sicilians have Accepted!;;;;;;;;;;;;;
EVTDESC00070;The Kingdom of Two Sicilies has accepted our generous offer, and has become a loyal vassal of the French crown. This has secured French influence in the south of Italy for the foreseeable future.;;;;;;;;;;;;;
EVTOPTA00070;A bloodless victory, as intended.;;;;;;;;;;;;;
EVTNAME00071;The Sicilians have refused!;;;;;;;;;;;;;
EVTDESC00071;The Bourbons in Two Sicilies seem more secure in their rule than we presumed, and have rejected our offer of protection. Now, we can simply back down, with a minor loss of prestige, or we can force the issue, and subjugate them unwillingly.;;;;;;;;;;;;;
EVTOPTA00071;Their loss;;;;;;;;;;;;;
EVTOPTB00071;Request? Sorry, we meant demand.;;;;;;;;;;;;;
EVTNAME00072;The Anglo-French War;;;;;;;;;;;;;
EVTDESC00072;While the Bourbon realm may generally seek to avoid conflict on the European mainland, save to maneuver itself favourably to ensure its continued place as a European power, the Bourbons still yet have a bone to pick with the British in particular. With our fleet modernized and prepared for another bout, conflict has now become inevitable.;;;;;;;;;;;;;
EVTOPTA00072;A perfect opportunity.;;;;;;;;;;;;;
EVTOPTB00072;We cannot afford such a war.;;;;;;;;;;;;;
EVTNAME00073;The Anglo-French War - French victory;;;;;;;;;;;;;
EVTDESC00073;Despite great doubt to the contrary, the French kingdom has emerged victorious in its struggle against Perfidious Albion and may now claim the spoils. The only question now is exactly what to claim.;;;;;;;;;;;;;
EVTOPTA00073;We claim India for our own!;;;;;;;;;;;;;
EVTOPTB00073;We will dismantle their dominance of the Isles.;;;;;;;;;;;;;
EVTOPTC00073;We will claim Australie for our trouble.;;;;;;;;;;;;;
EVTOPTD00073;PERFIDIOUS ALBION MUST DIE!;;;;;;;;;;;;;
EVTNAME00074;The Anglo-French War - French Humiliation;;;;;;;;;;;;;
EVTDESC00074;Despite their best efforts, the French have once again proven themselves incapable of challenging the British Empire at sea, and its ambitions have been quelled once again.;;;;;;;;;;;;;
EVTOPTA00074;How many times do we have to teach you this lesson, old man?;;;;;;;;;;;;;
EVTNAME00075;German policy - non-intervention;;;;;;;;;;;;;
EVTDESC00075;The Bourbon realm, always fearing for its continued security, has a unique opportunity in front of it. Prussia and Austria are both coming to blows in Central Europe, and France plays a key role in the region that could decisively shift the balance of power in its favor. The Bourbons, always keen to back a conservative party of interest in Europe to secure its own throne, will place forth an offer to the victorious NGF that it will not intervene in any attempt to form a united German state, and in return, the Germans will not violate its rule over the important Alsace-Lorraine. This could only go well.;;;;;;;;;;;;;
EVTOPTA00075;Forward the offer.;;;;;;;;;;;;;
EVTOPTB00075;Are you insane?;;;;;;;;;;;;;
EVTNAME00076;Bourbon offer of neutrality;;;;;;;;;;;;;
EVTDESC00076;The Bourbon realm to the west has offered to willingly relinquish its stake in Germany for merely a guarantee of remaining neutral on the province of Alsace-Lorraine. While that land may be rightfully German, it may be in our interests to allow the French to keep that territory, if that forgoes a war we could potentially lose.;;;;;;;;;;;;;
EVTOPTA00076;Accept the offer.;;;;;;;;;;;;;
EVTOPTB00076;Refuse, it is ours as well.;;;;;;;;;;;;;
EVTNAME00077;Our offer has been declined.;;;;;;;;;;;;;
EVTDESC00077;The Prussians have refused our offer to remain neutral, and have thus stated their intent to seize Alsace-Lorraine in the near future. This does not bode well.;;;;;;;;;;;;;
EVTOPTA00077;How could it have possibly gone wrong?;;;;;;;;;;;;;
EVTNAME00078;Treaty of Alsace;;;;;;;;;;;;;
EVTDESC00078;The Germans have accepted our deal regarding the status of Alsace-Lorraine and the recognition of a united Germany. While they may reinstate their claims later, this brings peace for now, which is all that matters.;;;;;;;;;;;;;
EVTOPTA00078;Peace in our time!;;;;;;;;;;;;;
EVTNAME00079;The coronation of the Bourbon Monarchy;;;;;;;;;;;;;
EVTDESC00079;A strange tide befalls the peoples of western Europe, as, almost anachronistically, a personal union has come to radically upend the balance of power in the European continent. In the midst of the liberal revolutions, the rise of nationalism and nation-states, and an era where the Ancien Regime was thought to have died with the advent of modern liberalism, it is the forces of traditionalism, of dynastic politics stretching back centuries, that have found themselves in this prime position. Now, the Bourbon King of France and the Carlist king of Spain are one and the same, uniting the two realms of Europe into a single state. This coronation vindicates the eternal beliefs of the traditionalist nobility and upper society, but raises the ire of not only the upstart liberals and nationalists, but falls in brazen violation of the treaty of Utrecht, which forbade the union of the lines of France and Spain. This action poses an existential threat to the balance of power in Europe, and undoubtedly there will be a vitriolic response from the international community. It is doubtless that the coming years will be ones of unmatched turbulence since the days of Napoleon.;;;;;;;;;;;;;
EVTOPTA00079;We will endure the tide.;;;;;;;;;;;;;
EVTNAME00080;Confederazione Italiana;;;;;;;;;;;;;
