end_ottoman_domination_title;End Ottoman Domination;;;;;;;;;;;;;
end_ottoman_domination_desc;The Rhomaion people have done what was long believed impossible, and have wholly routed the Ottoman armies. The city of Constantinople laid bare to the rebellion, the center of Ottoman control has been seized, and the twilight of the Turkish occupation of the holy city is at hand.;;;;;;;;;;;;;
end_countryside_war_title;End the Countryside War;;;;;;;;;;;;;
end_countryside_war_desc;In order to bring order back into the countryside of the empire, the army must be substantially expanded in order to ensure the border regions of the empire do not fall into ruin.;;;;;;;;;;;;;
end_klepht_problem_title;Ending the Klepht Domination;;;;;;;;;;;;;
end_klepht_problem_desc;The Klephts remain a powerful force in the Rhomaion military, and utilize their position to extract bribes from the populace while leaving the army a disorganized mess. A substantial investment must be made into the command structure of the military if we wish to undo this corrupt influence.;;;;;;;;;;;;;
purge_phanariote_corruption_title;Reigning in the Phanariotes;;;;;;;;;;;;;
purge_phanariote_corruption_desc;The Phanariote class serves as a large portion of the administration of the state, and plays a major role in the diplomacy of the empire. Competent administrators, their abilities are better put to work serving the state than their own pockets, but it will take a comprehensive investment to make this become a reality.;;;;;;;;;;;;;
end_church_state_within_state_title;The Church and the State;;;;;;;;;;;;;
end_church_state_within_state_desc;The Orthodox Church remains a dominant institution in the Rhomaion state, holding vast amounts of land titles and holding a great degree of influence in the realm of the secular. The tenuous balance of powers created by this institution must be addressed if the realm is to bring its cultural institutions into the modern realm.;;;;;;;;;;;;;
crack_down_rouspheti_tradition_title;Crack Down on the Rouspheti Tradition;;;;;;;;;;;;;
crack_down_rouspheti_tradition_desc;The Rouspheti tradition, the traditional giving of gifts to keep the wheels of state turning, and the dispensing of favors in exchange for political influence, is little more than another word for corruption. To do away with this practice is necessary if the state is to modernize, but investment must be made into the cultural sector of the nation in order to accomplish this.;;;;;;;;;;;;;
reign_kodjabashi_title;Reign the Kodjabashi;;;;;;;;;;;;;
reign_kodjabashi_desc;The kodjabashi as a noble institution date back to the Ottoman domination of the empire, and their influence in the state has rendered the nation as an industrially backwards state. In order to alter this, their power must first be eroded so as to render them subservient to state interests.;;;;;;;;;;;;;
end_commerce_monopoly_title;End the Commerce Monopoly;;;;;;;;;;;;;
end_commerce_monopoly_desc;The Phanariotes hold a monopoly on virtually all overseas commerce, and as such enforcing Rhomaion control over its own foreign trade is effectively impossible, until such time as the infrastructure is in place to abolish or integrate their control.;;;;;;;;;;;;;;
stop_coastal_piracy_title;Put an End to the Pirates;;;;;;;;;;;;;
stop_coastal_piracy_desc;The piracy along the Aegean coastline has cost many lives and much produce from the peoples of the Rhomaion state. Only with a comprehensive growth of the naval apparatus can these pirates finally be hunted down and eliminated.;;;;;;;;;;;;;
reclaim_anatolia_tur_title;Reclaim Anatolia;;;;;;;;;;;;;;
reclaim_anatolia_tur_desc;The Anatolian coastline in recent years has seen the mass deportation of our Turkish brethren, effectively ousting our claims to the coastline, until we can reclaim enough power for ourselves to take it once again by force.;;;;;;;;;;;;;
undo_byzantine_deportation_title;Undo Byzantine Deportation;;;;;;;;;;;;;
undo_byzantine_deportation_desc;If we can manage to break the Byzantine lines in Anatolia and once again secure its coastline for ourselves, we can undo the unjust deportations our people suffered, and once again secure our homeland from the invaders.;;;;;;;;;;;;;
armenian_integration_title;Integrate the Eastern Christians;;;;;;;;;;;;;
armenian_integration_desc;With the initial stability of the empire secured, one matter that can be addressed is that of the eastern christians present in the realm. With no state to call their own, it would be a simple matter to integrate them as part of the administration.;;;;;;;;;;;;;
rebuild_chios_title;Rebuild Chios;;;;;;;;;;;;;
rebuild_chios_desc;The island of Chios, once one of the greatest mercantile centers of the Aegean, was ransacked and destroyed almost in its totality during the war of independence by the Ottoman government. Over two-thirds of the population was massacred, and the region never regained its prominence in the economic sphere again. With substantial investment, however, we can restore this destroyed infrastructure and bring back at least some of its prominence in the Mediterranean trade.;;;;;;;;;;;;;
rebuild_constantinople_title;Rebuild Constantinople;;;;;;;;;;;;;
rebuild_constantinople_desc;Constantinople has been in utter disrepair since the success of the revolution, brought to ruination both by centuries of mismanagement and by the destruction of the revolution. With substantial funding and technological investment, however, the city can be brought back to functioning order.;;;;;;;;;;;;;
protect_thrace_title;Protect Thrace;;;;;;;;;;;;;
protect_thrace_desc;Thrace has been a vulnerable frontier to the city of Constantinople since long before the Ottoman conquest, an open route to the holy city for any balkan power that seeks to destroy the empire. If the Basileia tos Rhomaion is to recover its standing on the world stage, the first and highest priority must be to reclaim this frontier.;;;;;;;;;;;;;
reclaim_bulgaria_title;Reclaim Bulgaria;;;;;;;;;;;;;
reclaim_bulgaria_desc;Bulgaria has long been the thorn in the empire's side, a powerful rival on the Balkan frontier that has never been quite done away with. If the empire is to ever reclaim its glory, the Bulgarians must be stamped out as a rival in the Balkan sphere.;;;;;;;;;;;;;
reclaim_western_balkans_title;Reclaim the Western Balkans;;;;;;;;;;;;;
reclaim_western_balkans_desc;The western Balkans were the stomping grounds of the ancient Roman Empire well into the Middle ages, and historically comprised its sphere of influence until the 4th Crusade. With Bulgarian resistance stamped out, it is finally time to restore this frontier's integrity once and for all.;;;;;;;;;;;;;
reclaim_anatolia_title;Reclaim Anatolia;;;;;;;;;;;;;
reclaim_anatolia_desc;Finally, the time has come to bring the Anatolian countryside under control once and for all, and to bring the full weight of the Basileia tos Rhomaion to bear against the Turkish threat once and for all, and to undo the disaster of Manzikert all those centuries ago.;;;;;;;;;;;;;
renovate_constantinople_title;Renovate Constantinople;;;;;;;;;;;;;
renovate_constantinople_desc;The city of Constantinople has been recovered and repaired from its ruinous state, but much work still remains to be done. The financial institutions of the city need to be restored, and the infrastructure of the city itself is aged and worn. In order to bring the city to modern standards, much will need to be imported from foreign realms, and the cost will be truly enormous.;;;;;;;;;;;;
renovate_trebizond_title;Restore the Jewel of the Black Sea;;;;;;;;;;;;;
renovate_trebizond_desc;Trebizond, the jewel of the Black Sea, has long languished over the slow decline of the Ottoman presence in the black sea. The city, which once served as the greatest settlement along the coastline, and the key to controlling the Black sea, as well as the capital of the short-lived empire of Trebizond, still holds much value that can be restored, should the right investments be made.;;;;;;;;;;
reclaim_armenia_title;Avenge Manzikert;;;;;;;;;;;;;
reclaim_armenia_desc;The legacy of the battle of Manzikert still haunts the Basileia tos Rhomaion, a stain on its otherwise glorious legacy, the wound that slowly bled the empire to death under the yoke of the Turkish invasions. If the empire is to ever proclaim itself as the true hegemon of the Middle East once more, it must reclaim these distant lands and undo the humiliation it suffered so long ago.;;;;;;;;;;;;;
restore_theme_system_title;Restore the Theme System;;;;;;;;;;;;;
restore_theme_system_desc;The Theme system was a system of bureaucracy wherein the provinces of the empire were managed as landed realms handed in trust to the military officer corps, ruled by the state and appointed based on competence on the field. While restoring the exact specifications of the system would be foolhardy, the system could be used as inspiration to greatly increase assimilation across the realm, by selectively appointing those favorable to our empire to positions of power, slowly displacing local populations in favor of more favorable ones.;;;;;;;;;;;;;
renovate_smyrna_title;Renovate Smyrna;;;;;;;;;;;;;
renovate_smyrna_desc;The city of Smyrna has long been the center of Greek civilization along the Anatolian coastline, ever since the days of the ancient Hellenes, long before the days of Rome. While not as prestigious as Constantinople or Trebizond, the city holds a special place in the history of our nation, and deserves similar treatment, especially since it sits in an advantageous position for Mediterranean trade, and has historically been a major regional trade node.;;;;;;;;;;;;;
reclaim_levant_title;Reclaim the Levant;;;;;;;;;;;;;
reclaim_levant_desc;The Levant was long the financial heartland and eastern frontier of the Basileia tos Rhomaion, and its loss devastated the imperial coffers, leaving the remaining provinces severely depleted. Reclaiming the province, while it may not hold the same value it once did, will demonstrate thoroughly the recovery the empire has made in recent decades.;;;;;;;;;;;;;
reclaim_egypt_title;Reclaim Egypt;;;;;;;;;;;;;
reclaim_egypt_desc;The Egyptian breadbasket was once the heartland of Rhomaion agriculture, the breadbasket from which the empire procured the vast majority of its produce from. With the restoration of the empire to the glory it once enjoyed, for the first time in many centuries, this breadbasket sits open to the empire for the taking.;;;;;;;;;;;;;
expand_constantinople_title;Expand Constantinople;;;;;;;;;;;;;
expand_constantinople_desc;The city of Constantinople has been restored and modernized to the specifications of a modern city, on line with Western models. However, this still is not yet far enough. If the empire is to showcase its splendor to a degree never seen before, its cities must reflect that, and reach a level of development that will cause even the great powers of the West to look to in surprise and adoration.;;;;;;;;;;;;;
seize_ionian_islands_title;Seize the Ionian Islands!;;;;;;;;;;;;;
seize_ionian_islands_desc;The Ionian Islands have been occupied by the British empire ever since the end of the Napoleonic Wars, and serve as a weak western flank to the Rhomaion empire. With the continual downturn of relations between us and the British Empire, the possibility of seizing the islands by force becomes an increasingly prevalent idea in military circles. With the aid of locals whom know the terrain, the sparse English positions can easily be overrun.;;;;;;;;;;;;;
schomburgk_line_title;The Schomburgk Line;;;;;;;;;;;;;
schomburgk_line_desc;Following the dissolution of Gran Colombia, its unsettled and remote eastern frontier in Essequibo has been left unorganized and unprotected. Following our acquisition of Guyana from the Dutch, we inherited a territorial dispute over Essequibo with Gran Colombia which disputed the former Spanish treaty. Thus we have legal justification to seize this patch of jungle without conflict. The Royal Geographical Society of London recommends we send Sir Robert Hermann Schomburgk to explore the region and delineate a proper border with Venezuela, as his work on surveying the Virgin Island of Anegada was quite impressive.;;;;;;;;;;;;;
schomburgkexplained;Abusing flimsy claims of inheritance of responsibilites from treaties between Spain and the Dutch, Great Britain has occupied Essequibo. With our recently nascent country barely posessing an army of note, there is nothing we can do to resist the Brits.;;;;;;;;;;;;;
LIBERTADORDEATH;After resigning from the presidency, Bol var made his way to Cartagena de Indias to board a ship and settle down abroad. However, he rested in the Customs House of Santa Marta as his health made travel difficult. As his condition worsened, he needed a transfer to a quieter place and moved to a farm located in San Pedro Alejandrino on the outskirts of the city, where he entered the full care of his trusted family doctor. Initially optimistic, both he and his doctor eventually recognized the severity of the condition, leading to Bol var writing his will and instructing his entourage how to proceed in the event of his death. \nAfter the passage of morning marked by an increasing decline of vital signs, the silence of the house's main hall, occupied by the aides, military leadership of the Patriot Army and Bol var's closest friends, was interrupted by the words of his doctor inviting them to the next room to witness the great liberator's last moments. Surrounded by his entourage, and after a long but calm agony, Sim n Bol var died at 1 PM, 3 minutes and 55 seconds on Friday, December 17, 1830.;;;;;;;;;;;;;
LIBERTADORSLASTWORDS;'Colombians: You have witnessed my efforts to raise freedom where tyranny once reigned. I have worked with selflessness, abandoning my fortune and even my tranquility. I separated from command when I was persuaded that you distrusted my detachment. My enemies abused your credulity and they trampled on what is most sacred to me, my reputation and my love of freedom. I have been a victim of my persecutors, who have led me to the doors of the tomb. I forgive them. As I disappear from your midst, my affection tells me that I must make a manifestato of my last wishes. I do not aspire to any other glory than the consolidation of Colombia. All of you must work for the inestimable good of the Union: The people obeying the government to be free from anarchy, the ministers of the sanctuary directing their prayers to heaven, and the military using their sword to preserve the peace. Colombians! My last wishes are for the happiness of the country. If my death contributes to the end of the parties and the consolidation of the Union, I shall go to the grave in peace.'   -Sim n Bol var;;;;;;;;;;;;;
apulo_convention_title;The Apulo Convention;;;;;;;;;;;;;
apulo_convention_desc;Gran Colombia is doomed. Without Bol var, no force is strong enough to hold it together. With Ecuador, Venezuela and Panama in open revolt, Perhaps it would be better to face the facts and abandon the dream rather than spill more blood. President Rafael Urdaneta cannot handle the situation and has called for a convention to put an end to Gran Colombia and create a new state with a new constitution to consolidate what remains of our once great nation.;;;;;;;;;;;;;
LIBERTADORRESIGNS;Since 1828, Sim n Bol var has attempted to keep Gran Colombia together by assuming dictatorial powers to deal with the emergencies at hand. He has finally seen that this course of action has kept the union together but divided it ever more severely. He has now arrived at the conclusion that it would be best for Gran Colombia if he, El Libertador, resigned and left the presidency to a less divisive person. This however creates ever more uncertainty. Gran Colombia has always had Bol var at its helm, what will happen now that he has left?;;;;;;;;;;;;;
PANAMASECEDES;Led by traitorous Colonel Juan Eligio Alzuru, Panama has declared its independence following the example of Venezuela and Ecuador. However, many inhabitants of Panama wish to remain as part of Colombia. Several officers have already voiced their opposition to Alzuru. It wouldn't be far-fetched to expect this independence movement to be short-lived unlike those in Venezuela and Ecuador.;;;;;;;;;;;;;
ECUADORSECEDES;Informed of the secession of Venezuela and Bol var's death, the assembly of the district of the South has declared independence, founding the state of Ecuador. The departments of Quito, Azuay and Guayaquil are now under the supreme rule of Juan Jose Flores, the head of government.;;;;;;;;;;;;;
VENEZUELASECEDES;Meeting in the council of Valencia, the assembly of the northern district chose the town for being the residence of hero of the wars against Spain, General Jos  Antonio P ez who has been agitating against the government of Gran Colombia for years. Additionally, the town was the site of the separatist movement La Cosiata that occurred between 1826 and 1829. While the assembly's rhetoric was anti-Bolivarian from the start, once it had been informed of Bol var's death, it took a turn for a worse. The assembly ultimately ceremoniously announced its independence from Gran Colombia as the state of Venezuela under the leadership of General P ez himself.;;;;;;;;;;;;;
PANAMAQUESTION;General Tom s Herrera has lead a counterrevolt against Juan Eligio Alzuru to put an end to Panamanian independence and repatriate to Colombia. While his revolt is seeing a lot of success, he needs the support of the people. The question lies in their loyalty to Colombia. Will they work towards continued self-sovereignty or reintegration to Colombia?;;;;;;;;;;;;;
PANAMAREJOINS;Executed by General Tom s Hererra, Alzuru's revolt is no more. Panama has returned to Colombian rule amid much jubilation. Many hope the same may occur in Venezuela or Ecuador, but those hopes are clearly in vain.;;;;;;;;;;;;;
colonize_galapagos_title;Colonize the Galapagos Islands;;;;;;;;;;;;;
colonize_galapagos_desc;The Galapagos Islands are a hotspot of biodiversity, having been seperate from the mainland for thousands of years. It also serves as an excellent naval base in the Pacific to project our influence. We must settle it before another country acts first!;;;;;;;;;;;;;
AGRESSION_CIVIL_WAR_NAME_DAI_CHA;The Ja Thak Wa Uprising;;;;;;;;;;;;;
NORMAL_CIVIL_WAR_NAME_DAI_CHA;The Ja Thak Wa Uprising;;;;;;;;;;;;;
AGRESSION_CIVIL_WAR_NAME_GCO_VNZ;The Collapse of Gran Colombia;;;;;;;;;;;;;
NORMAL_CIVIL_WAR_NAME_GCO_VNZ;The Collapse of Gran Colombia;;;;;;;;;;;;;
AGRESSION_CIVIL_WAR_NAME_GCO_PNM;The Collapse of Gran Colombia;;;;;;;;;;;;;
NORMAL_CIVIL_WAR_NAME_GCO_PNM;The Collapse of Gran Colombia;;;;;;;;;;;;;
AGRESSION_CIVIL_WAR_NAME_GCO_ECU;The Collapse of Gran Colombia;;;;;;;;;;;;;
NORMAL_CIVIL_WAR_NAME_GCO_ECU;The Collapse of Gran Colombia;;;;;;;;;;;;;
clm_const_1832_title;The Colombian Constitution;;;;;;;;;;;;;
clm_const_1832_desc;Now that the situation has stabilized, the constitutional assembly has finished its deliberations and formulated a constitution. It establishes the seperation of powers, the responsibilities of public officials, the duty to protect the catholic church and the unitary form of government with decentralized local assemblies. Furthermore, it divides congress into an upper and lower house and sets its legislative terms.;;;;;;;;;;;;;
ADMIRABLECONGRESS;Sim n Bol var's years as dictator of Gran Colombia have done the union no good. His unquestioned reign has even been compared by many to that of the kings of Spain. Recognizing what is best for the union, he has called for a new constitutional assembly to create a constitution for Gran Colombia in a last-ditch effort to prevent its dissolution.;;;;;;;;;;;;;
GCNOCOLLAPSE;After much trial and tribulation, Gran Colombia is united once more. El Libertador can rest easy knowing that the Bolivarian legacy shall continue. However, now that the crisis of secession is averted, we must ask ourselves what lies in our future. How will we govern ourselves to ensure that Gran Colombia will survive and not collapse once more?;;;;;;;;;;;;;
MERTHYRRISING;Some days ago riots started in the town of Merthyr Tydfil, north of Cardiff, and today there are already reports of it expanding into all Wales, being an all-out rebellion. It's the first time a red flag is seen in a workers' revolt, being a symbol of the workers. They protest against the lowering of their wages and general unemployment, and among the shouts were cries of "Caws a bara" (cheese and bread), "Annibyniaeth" (independence) and "I lawr gyda'r Brenin" (down with the king), being a clear threat to the monarchy. Do we give them more rights or we protect the monarchy?;;;;;;;;;;;;;
NEWYORKSECONDFIRE;On a night in 1835, a fire broke out in a five-story warehouse at 25 Merchant Street, at the intersection of Hanover Street. As it spread, gale-force winds blowing from the northwest towards the East River spread the fire. It could be seen from Philadelphia, approximately 80 miles away. At the time of the fire, major water sources were frozen in temperatures as low as -17 F, forcing the firefighters to drill holes to access liquid water, which later refroze around the houses and pipes. Efforts were made to deprive the fire of fuel by demolishing surrounding buildings, but there was insufficient gunpowder. Later in the next evening, a detachment of U.S. Marines returned with gunpowder and stopped the fire. During the day and a half that it burned, the fire killed 2 civilians and in total destroyed 660 buildings, resulting in property damage estimated between 20-25 million. How much do we invert on the reconstruction of New York?;;;;;;;;;;;;;
EVTOPTA127846;Fully fund reconstruction efforts.;;;;;;;;;;;;;
EVTOPTB127846;Send the minimum amount to help.;;;;;;;;;;;;;
EVTOPTC127846;We can't afford anything right now.;;;;;;;;;;;;;
HAMBACHFEST1;News has reached us that a supposedly nonpolitical country fair celebrated at Hambach Castle, near Neustadt der Weinstra e in the Palatinate turned into a demonstration in support of German unity. Provoked by liberal intellectuals, they established democratic associations which collide with our reactionary policies. In the crowd shouts could be heard while thousands held up their hands: \n"Wir wollen sein ein einzig Volk von Bruedern, In keiner Noth uns trennen und Gefahr" (We swear to be a nation of true brothers, never to part in danger and in death) and "Wir wollen frei sein wie die Vaeter waren, Eher den Tod, als in der Knechtechaft leben." (We swear we will be free as were our sires, and sooner die than live in slavery). The news are already expanding to nearby towns, and similar "nonpolitical county fairs" are starting to be planned in other parts of the Palatinate, expanding Pan-German ideas to the population, being a threat to our independence and our policies in the topic. Do we silence the news or let the Pan-German ideas expand to bordering regions?;;;;;;;;;;;;;
EVTOPTA127847;German unification wouldn't be that bad...;;;;;;;;;;;;;
EVTOPTB127847;Silence the news.;;;;;;;;;;;;;
HAMBACHFEST2;A week ago, a supposedly nonpolitical country fair celebrated at Hambach Castle, near Neustadt der Weinstra e in the Bavarian Palatinate turned into a demonstration in support of German unity. Provoked by liberal intellectuals, they established democratic associations which collided with Bavaria's reactionary policies. In the crowd shouts could be heard while thousands held up their hands: \n"Wir wollen sein ein einzig Volk von Bruedern, In keiner Noth uns trennen und Gefahr" (We swear to be a nation of true brothers, never to part in danger and in death) and "Wir wollen frei sein wie die Vaeter waren, Eher den Tod, als in der Knechtechaft leben." (We swear we will be free as were our sires, and sooner die than live in slavery). The news are already expanding to nearby towns, and similar "nonpolitical county fairs" are starting to be planned in other parts of the Palatinate. Bavaria has let us know the news, and our population could join the movement if it isn't stopped now. Do we silence the news to our population or let them know the truth?;;;;;;;;;;;;;
EVTOPTA127848;German unification wouldn't be that bad...;;;;;;;;;;;;;
EVTOPTB127848;Silence the news.;;;;;;;;;;;;;
EVTNAME127851;The Polish Uprising of $YEAR$;;;;;;;;;;;;;
EVTDESC127851;After our country came out of the latest war, our subjects in Congress Poland are getting restless. The uprising began as a spontaneous protest when the young Polish officers from the military academy of the Army of Congress Poland revolted, led by lieutenant Piotr Wysocki. Large segments of the peoples of Lithuania, Belarus, and the Right-bank Ukraine soon joined the uprising. Sadly  aren't right now in conditions to fight against them, but we could start preparing to go to war this instance.;;;;;;;;;;;;;
EVTOPT127851A;Prepare for war.;;;;;;;;;;;;;
EVTOPT127851C;Let them be free.;;;;;;;;;;;;;
EVTOPT127851D;Onwards to Poland!  BPlay as Poland W;;;;;;;;;;;;;
EVTDESC127851_NEWS_LONG;A spontaneous protest by young Polish officers from the military academy of the Army of Congress Poland has quickly erupted into a widespread insurrection across $COUNTRY$, supported by high-ranking Polish and Lithuanian officers and politicians. The eyes of all of Europe are upon $COUNTRY$, and if they deal with the insurgents too harshly it may hurt their relations with other European powers. If they do not, however, the uprising will surely spread even further.;;;;;;;;;;;;;
EVTDESC127851_NEWS_MEDIUM;A spontaneous protest by young Polish officers from the military academy of the Army of Congress Poland has quickly erupted into a widespread insurrection across $COUNTRY$, supported by high-ranking Polish and Lithuanian officers and politicians.;;;;;;;;;;;;;
