schomburgk_line_title;The Schomburgk Line;;;;;;;;;;;;;
schomburgk_line_desc;Following the dissolution of Gran Colombia, its unsettled and remote eastern frontier in Essequibo has been left unorganized and unprotected. Following our acquisition of Guyana from the Dutch, we inherited a territorial dispute over Essequibo with Gran Colombia which disputed the former Spanish treaty. Thus we have legal justification to seize this patch of jungle without conflict. The Royal Geographical Society of London recommends we send Sir Robert Hermann Schomburgk to explore the region and delineate a proper border with Venezuela, as his work on surveying the Virgin Island of Anegada was quite impressive.;;;;;;;;;;;;;
schomburgkexplained;Abusing flimsy claims of inheritance of responsibilites from treaties between Spain and the Dutch, Great Britain has occupied Essequibo. With our recently nascent country barely posessing an army of note, there is nothing we can do to resist the Brits.;;;;;;;;;;;;;
LIBERTADORDEATH;After resigning from the presidency, Bolívar made his way to Cartagena de Indias to board a ship and settle down abroad. However, he rested in the Customs House of Santa Marta as his health made travel difficult. As his condition worsened, he needed a transfer to a quieter place and moved to a farm located in San Pedro Alejandrino on the outskirts of the city, where he entered the full care of his trusted family doctor. Initially optimistic, both he and his doctor eventually recognized the severity of the condition, leading to Bolívar writing his will and instructing his entourage how to proceed in the event of his death. \nAfter the passage of morning marked by an increasing decline of vital signs, the silence of the house's main hall, occupied by the aides, military leadership of the Patriot Army and Bolívar's closest friends, was interrupted by the words of his doctor inviting them to the next room to witness the great liberator's last moments. Surrounded by his entourage, and after a long but calm agony, Simón Bolívar died at 1 PM, 3 minutes and 55 seconds on Friday, December 17, 1830.;;;;;;;;;;;;;
LIBERTADORSLASTWORDS;'Colombians: You have witnessed my efforts to raise freedom where tyranny once reigned. I have worked with selflessness, abandoning my fortune and even my tranquility. I separated from command when I was persuaded that you distrusted my detachment. My enemies abused your credulity and they trampled on what is most sacred to me, my reputation and my love of freedom. I have been a victim of my persecutors, who have led me to the doors of the tomb. I forgive them. As I disappear from your midst, my affection tells me that I must make a manifestato of my last wishes. I do not aspire to any other glory than the consolidation of Colombia. All of you must work for the inestimable good of the Union: The people obeying the government to be free from anarchy, the ministers of the sanctuary directing their prayers to heaven, and the military using their sword to preserve the peace. Colombians! My last wishes are for the happiness of the country. If my death contributes to the end of the parties and the consolidation of the Union, I shall go to the grave in peace.'   -Simón Bolívar;;;;;;;;;;;;;
apulo_convention_title;The Apulo Convention;;;;;;;;;;;;;
apulo_convention_desc;Gran Colombia is doomed. Without Bolívar, no force is strong enough to hold it together. With Ecuador, Venezuela and Panama in open revolt, Perhaps it would be better to face the facts and abandon the dream rather than spill more blood. President Rafael Urdaneta cannot handle the situation and has called for a convention to put an end to Gran Colombia and create a new state with a new constitution to consolidate what remains of our once great nation.;;;;;;;;;;;;;
LIBERTADORRESIGNS;Since 1828, Simón Bolívar has attempted to keep Gran Colombia together by assuming dictatorial powers to deal with the emergencies at hand. He has finally seen that this course of action has kept the union together but divided it ever more severely. He has now arrived at the conclusion that it would be best for Gran Colombia if he, El Libertador, resigned and left the presidency to a less divisive person. This however creates ever more uncertainty. Gran Colombia has always had Bolívar at its helm, what will happen now that he has left?;;;;;;;;;;;;;
PANAMASECEDES;Led by traitorous Colonel Juan Eligio Alzuru, Panama has declared its independence following the example of Venezuela and Ecuador. However, many inhabitants of Panama wish to remain as part of Colombia. Several officers have already voiced their opposition to Alzuru. It wouldn't be far-fetched to expect this independence movement to be short-lived unlike those in Venezuela and Ecuador.;;;;;;;;;;;;;
ECUADORSECEDES;Informed of the secession of Venezuela and Bolívar's death, the assembly of the district of the South has declared independence, founding the state of Ecuador. The departments of Quito, Azuay and Guayaquil are now under the supreme rule of Juan Jose Flores, the head of government.;;;;;;;;;;;;;
VENEZUELASECEDES;Meeting in the council of Valencia, the assembly of the northern district chose the town for being the residence of hero of the wars against Spain, General José Antonio Páez who has been agitating against the government of Gran Colombia for years. Additionally, the town was the site of the separatist movement La Cosiata that occurred between 1826 and 1829. While the assembly's rhetoric was anti-Bolivarian from the start, once it had been informed of Bolívar's death, it took a turn for a worse. The assembly ultimately ceremoniously announced its independence from Gran Colombia as the state of Venezuela under the leadership of General Páez himself.;;;;;;;;;;;;;
PANAMAQUESTION;General Tomás Herrera has lead a counterrevolt against Juan Eligio Alzuru to put an end to Panamanian independence and repatriate to Colombia. While his revolt is seeing a lot of success, he needs the support of the people. The question lies in their loyalty to Colombia. Will they work towards continued self-sovereignty or reintegration to Colombia?;;;;;;;;;;;;;
PANAMAREJOINS;Executed by General Tomás Hererra, Alzuru's revolt is no more. Panama has returned to Colombian rule amid much jubilation. Many hope the same may occur in Venezuela or Ecuador, but those hopes are clearly in vain.;;;;;;;;;;;;;
colonize_galapagos_title;Colonize the Galapagos Islands;;;;;;;;;;;;;
colonize_galapagos_desc;The Galapagos Islands are a hotspot of biodiversity, having been seperate from the mainland for thousands of years. It also serves as an excellent naval base in the Pacific to project our influence. We must settle it before another country acts first!;;;;;;;;;;;;;
AGRESSION_CIVIL_WAR_NAME_GCO_VNZ;The Collapse of Gran Colombia;;;;;;;;;;;;;
NORMAL_CIVL_WAR_NAME_GCO_VNZ;The Collapse of Gran Colombia;;;;;;;;;;;;;
AGRESSION_CIVIL_WAR_NAME_GCO_PNM;The Collapse of Gran Colombia;;;;;;;;;;;;;
NORMAL_CIVL_WAR_NAME_GCO_PNM;The Collapse of Gran Colombia;;;;;;;;;;;;;
AGRESSION_CIVIL_WAR_NAME_GCO_ECU;The Collapse of Gran Colombia;;;;;;;;;;;;;
NORMAL_CIVL_WAR_NAME_GCO_ECU;The Collapse of Gran Colombia;;;;;;;;;;;;;
clm_const_1832_title;The Colombian Constitution;;;;;;;;;;;;;
clm_const_1832_desc;Now that the situation has stabilized, the constitutional assembly has finished its deliberations and formulated a constitution. It establishes the seperation of powers, the responsibilities of public officials, the duty to protect the catholic church and the unitary form of government with decentralized local assemblies. Furthermore, it divides congress into an upper and lower house and sets its legislative terms.;;;;;;;;;;;;;
ADMIRABLECONGRESS;Simón Bolívar's years as dictator of Gran Colombia have done the union no good. His unquestioned reign has even been compared by many to that of the kings of Spain. Recognizing what is best for the union, he has called for a new constitutional assembly to create a constitution for Gran Colombia in a last-ditch effort to prevent its dissolution.;;;;;;;;;;;;;
GCNOCOLLAPSE;After much trial and tribulation, Gran Colombia is united once more. El Libertador can rest easy knowing that the Bolivarian legacy shall continue. However, now that the crisis of secession is averted, we must ask ourselves what lies in our future. How will we govern ourselves to ensure that Gran Colombia will survive and not collapse once more?;;;;;;;;;;;;;
DUKECZACABINDA;In 1827, our great navy built a naval base in Cabinda, being the only rightyfully owned territory outside of our homeland. The Europeans, wanting to limit our power, want to force us into giving up Cabinda to the Portuguese-allied Kingdom of the Kongo, as it's in a strategic position in Africa.;;;;;;;;;;;;;
MERTHYRRISING;Some days ago riots started in the town of Merthyr Tydfil, north of Cardiff, and today there are already reports of it expanding into all Wales, being an all-out rebellion. It's the first time a red flag is seen in a workers' revolt, being a symbol of the workers. They protest against the lowering of their wages and general unemployment, and among the shouts were cries of "Caws a bara" (cheese and bread), "Annibyniaeth" (independence) and "I lawr gyda'r Brenin" (down with the king), being a clear threat to the monarchy. Do we give them more rights or we protect the monarchy?;;;;;;;;;;;;;
NEWYORKSECONDFIRE;On a night in 1835, a fire broke out in a five-story warehouse at 25 Merchant Street, at the intersection of Hanover Street. As it spread, gale-force winds blowing from the northwest towards the East River spread the fire. It could be seen from Philadelphia, approximately 80 miles away. At the time of the fire, major water sources were frozen in temperatures as low as -17°F, forcing the firefighters to drill holes to access liquid water, which later refroze around the houses and pipes. Efforts were made to deprive the fire of fuel by demolishing surrounding buildings, but there was insufficient gunpowder. Later in the next evening, a detachment of U.S. Marines returned with gunpowder and stopped the fire. During the day and a half that it burned, the fire killed 2 civilians and in total destroyed 660 buildings, resulting in property damage estimated between 20-25 million. How much do we invert on the reconstruction of New York?;;;;;;;;;;;;;
EVTOPTA127846;Fully fund reconstruction efforts.;;;;;;;;;;;;;
EVTOPTB127846;Send the minimum amount to help.;;;;;;;;;;;;;
EVTOPTC127846;We can't afford anything right now.;;;;;;;;;;;;;
HAMBACHFEST1;Yesterday a suposedly nonpolitical county fair, which became a public demonstration in support of German unity, freedom and democracy, was celebrated at Hambach Castle, near Neustadt an der Weinstraße, in Palatinate, being provoked by liberal intellectuals, which established a democratic association that collided with our policies. In the crowd there could be heard shouts while thousands held up their hands: \n"Wir wollen sein ein einzig Volk von Bruedern, In keiner Noth uns trennen und Gefahr" (We swear to be a nation of true brothers, never to part in danger and in death) and "Wir wollen frei sein wie die Vaeter waren, Eher den Tod, als in der Knechtechaft leben." (We swear we will be free as were our sires, and sooner die than live in slavery). The news are already expanding to nearby towns, and similar "nonpolitical county fairs" are starting to be planned in other parts of the Palatinate, expanding Pan-German ideas to the population, being a threat to our independence and our policies in the topic. Do we silence the news or let the Pan-German ideas expand to bordering regions?;;;;;;;;;;;;;
EVTOPTA127847;German unification wouldn't be that bad...;;;;;;;;;;;;;
EVTOPTB127847;Silence the news.;;;;;;;;;;;;;
HAMBACHFEST2;A week ago a suposedly nonpolitical county fair, which became a public demonstration in support of German unity, freedom and democracy, was celebrated at Hambach Castle, near Neustadt an der Weinstraße, in the Bavarian Palatinate, being provoked by liberal intellectuals, which established a democratic association that collided with Bavaria's reactionary policies. In the crowd there could be heard shouts while thousands held up their hands: \n"Wir wollen sein ein einzig Volk von Bruedern, In keiner Noth uns trennen und Gefahr" (We swear to be a nation of true brothers, never to part in danger and in death) and "Wir wollen frei sein wie die Vaeter waren, Eher den Tod, als in der Knechtechaft leben." (We swear we will be free as were our sires, and sooner die than live in slavery). The news are already expanding to nearby towns, and similar "nonpolitical county fairs" are starting to be planned in other parts of the Palatinate. Bavaria has let us know the news, and our population could join the movement if it isn't stopped now. Do we silence the news to our population or let them know the truth?;;;;;;;;;;;;;
EVTOPTA127848;German unification wouldn't be that bad...;;;;;;;;;;;;;
EVTOPTB127848;Silence the news.;;;;;;;;;;;;;
EVTNAME127851;The Polish Uprising of $YEAR$;;;;;;;;;;;;;
EVTDESC127851;After our country came out of the latest war, our subjects in Congress Poland are getting restless. The uprising began as a spontaneous protest when the young Polish officers from the military academy of the Army of Congress Poland revolted, led by lieutenant Piotr Wysocki. Large segments of the peoples of Lithuania, Belarus, and the Right-bank Ukraine soon joined the uprising. Sadly  aren't right now in conditions to fight against them, but we could start preparing to go to war this instance.;;;;;;;;;;;;;
EVTOPT127851A;Prepare for war.;;;;;;;;;;;;;
EVTOPT127851C;Let them be free.;;;;;;;;;;;;;
EVTOPT127851D;Onwards to Poland!;;;;;;;;;;;;;
EVTDESC127851_NEWS_LONG;A spontaneous protest by young Polish officers from the military academy of the Army of Congress Poland has quickly erupted into a widespread insurrection across $COUNTRY$, supported by high-ranking Polish and Lithuanian officers and politicians. The eyes of all of Europe are upon $COUNTRY$, and if they deal with the insurgents too harshly it may hurt their relations with other European powers. If they do not, however, the uprising will surely spread even further.;;;;;;;;;;;;;
EVTDESC127851_NEWS_MEDIUM;A spontaneous protest by young Polish officers from the military academy of the Army of Congress Poland has quickly erupted into a widespread insurrection across $COUNTRY$, supported by high-ranking Polish and Lithuanian officers and politicians.;;;;;;;;;;;;;
EVTDESC127851_NEWS_SHORT;A spontaneous protest by young Polish officers from the military academy of the Army of Congress Poland has quickly erupted into a widespread insurrection across $COUNTRY$.;;;;;;;;;;;;;
EVTNAME127852;The Polish Uprising of $YEAR$;;;;;;;;;;;;;
EVTDESC127852;4 months ago, a spontaneous protest by young Polish officers from the military academy of the Army of Congress Poland had quickly erupted into a widespread insurrection across Poland, supported by high-ranking Polish and Lithuanian officers and politicians. Now our Tzar demands the complete and unconditional surrender of Poland and announces that the Poles should surrender to the grace of their Emperor. This can only made by war.;;;;;;;;;;;;;
EVTOPT127852A;To arms!.;;;;;;;;;;;;;
EVTOPT127852C;Let them be free.;;;;;;;;;;;;;
EVTOPT127852D;Onwards to Poland!;;;;;;;;;;;;;
EVTNAME127853;The Rebellion is Crushed;;;;;;;;;;;;;
EVTDESC127853;Today, the remainder of the Polish army of over 20,000 men crossed the Russian frontier and laid down their arms at Brodnica in preference to submission to Russia, being the last resistance in Poland. The war in the course of which 120 battles and skirmishes were fought and forty thousand Polish killed, came to a speedy end in $YEAR$. The tzar passed laws and edicts to make the land an integral part of Russia's territory and decided how to deal with the rebels.;;;;;;;;;;;;;
EVTOPT127853A;There will be harsh reprisals.;;;;;;;;;;;;;
EVTOPT127853B;Be lenient with them.;;;;;;;;;;;;;
AGRESSION_WAR_CONQUEST_NAME_RUS_CPL;The November Uprising;;;;;;;;;;;;;
NORMAL_WAR_CONQUEST_NAME_RUS_CPL;The November Uprising;;;;;;;;;;;;; 
bahawalpur_treaty_title;Subsidiary Alliance with Bahawalpur;;;;;;;;;;;;;
bahawalpur_treaty_desc;Bahawalpur has been continually threatened by the Sikh Empire on its western border. To the Nawab, British suzerainty seems a better alternative than conquest by the Sikhs. Therefore we should sign a treaty of protection with Bahawalpur to extend our rule in India.;;;;;;;;;;;;;
male_desc;The Malês, groups of Muslim African slaves from West Africa, planned a revolt against the townspeople and their masters. For years these men have been transformed into mere objects, used for nothing but tiring work, their freedom? Nothing but a fragment of a distant past. But today is the day they fight to regain such freedom. Today their arms will break the shackles chaining them to the Pelourinho for another round of whips. Or so they claim.;;;;;;;;;;;;;
male_win_desc;The Malês are victorious in this conflict, we have nothing to do but accept their terms..;;;;;;;;;;;;;
EVTDESC127854;3 days ago Nat Turner, an enslaved African-American preacher, had organizad a rebellion of enslaved and free Black people in Southampton County, Virginia. Turner was recorded as "Nat" by Benjamin Turner, the man who enslaved him and his family. When Benjamin Turner died in 1810, under then-current laws which made slavery legal, Nat was inherited as property by Benjamin's son Samuel Turner. On February 12, 1831, he witnessed a solar eclipse that was visible from much of the southeastern United States, and was convinced that it was the sign for which he was waiting. He began preparations for an uprising against the enslavers in Southampton County by purchasing muskets. The last 3 days they have been waging terror in Southampton, but have been stopped today by local militias and detachments of men from the USS Natchez and USS Warren. Approximately 120 black people died today, and around 60 white people.;;;;;;;;;;;;;
EVTDESC127855;Turner eluded capture for six weeks, but remained in Southampton County. On October 30, a White farmer named Benjamin Phipps discovered him hidden among the local Nottoway people, in a depression in the earth, created by a large, fallen tree that was covered with fence rails. While awaiting trial, Turner confessed his knowledge of the rebellion to attorney Thomas Ruffin Gray, who compiled what he claimed was Turner's confession. Today he got sentenced to death and hanged for "conspiring to rebel and making insurrection".;;;;;;;;;;;;;
rumor_rgs_desc;There have been several rumors in the province of São Pedro do Rio Grande do sul surrounding the 28th Batallion of Cavalry and its German mercenaries, these rumors cannot be confirmed. Should these supposed conspirators be arrested?;;;;;;;;;;;;;
early_farrapos_desc;The rumors have been confimed today as the 28th Batallion of Cavalry invades the capital of São Pedro do Rio grande do Sul, Porto Alegre, declaring themselves the "Riograndeser Republik". We must send troops to detain these traitors now!;;;;;;;;;;;;;
farrapos_revolt_start;The turmoil in the São Pedro do Rio Grande do Sul province has exploded into a full blown revolt! The "Farrapos" have reached and conquered Porto Alegre and several towns in the province of São Pedro do Rio Grande do Sul. We must act now, otherwise who knows what these rebels can get up to if they ever manage to beat our Imperial armies.;;;;;;;;;;;;;
declare_rgs_republic_desc;Several Generals in our country have toied with the idea of declaring a separate Republic known as the "Republica Rio-Grandense", Bento Gonçalves is still pondering weather or not to declare the Republic, but the time has come to make a final choice.;;;;;;;;;;;;;
rgs_federal_askpls_desc;Liberal politicians in the province of São Pedro do Rio Grande do Sul have demanded more and more Federalisation of the Empire, repeating that currently they have small to no representation within the Monarchy.;;;;;;;;;;;;;
EVTDESC127857;Today slaves in Jamaica have risen up on a revolt to demand more freedom and a working wage of "half the going wage rate", which we can't provide. The enslaved laborers believe that the work stoppage could achieve their ends alone - a resort to force was only envisaged if violence was used against them. Led by Samuel Sharpe, a Baptist preacher, 60,000 slaves have risen up.;;;;;;;;;;;;;
EVTDESC127858;Today slaves in Jamaica have risen up on a revolt to demand more freedom and a working wage of "half the going wage rate", which the British won't provide. The enslaved laborers believe that the work stoppage could achieve their ends alone - a resort to force was only envisaged if violence was used against them. Led by Samuel Sharpe, a Baptist preacher, 60,000 slaves have risen up, and they asked us help.;;;;;;;;;;;;;
male_core_desc;We have conquered even more lands from those heretic Brazilians!;;;;;;;;;;;;;
males_expand_title;Jihad against Brazil;;;;;;;;;;;;;
males_expand_desc;These heretic Brazilians should pay for what they made our people go through! We should expand all the way up to São Francisco!;;;;;;;;;;;;;
paa_cabanagem_desc;The Cabanos have captured Belém! The rebelious forces in the north of Brazil have captured the provincial capital of Belém and have declared the Republic of Pará and are now at war with the Imperial government seeking independence.;;;;;;;;;;;;;
EVTDESC18351836;The Great Trek has begun! From 1652 to 1806, the Cape Colony was a part of the Netherlands under the name "Kaapkolonie". Under this period, tons of Dutch people migrated down there for trading reasons. The Cape Colony was an important re-supply station for all trade coming from europe and further on to Asia. The Afrikaners (Dutch-Africans) still has the vast majority of the european population in the Cape Colony and during the last years the Afrikaners feel that they've been treated unfairly, especially when we declared in 1828 that the native Africans were to have human rights, when we declared English as the official language of the region when most Afrikaners spoke no English and just now, when we abolished slavery (Historically in 1834). In some places, 94% of the Afrikaners owned slaves, so this was a huge hit to their livelyhood. 12000 Afrikaners are now on their way to become refugees in the vast wildernness of southern Africa! What should be do?;;;;;;;;;;;;;
brest_litovsk_fort_title;Build the Brest-Litovsk Fortress;;;;;;;;;;;;;
brest_litovsk_fort_desc;It is time for our government to comission a fortress in the key strategic city of Brest-Litovsk, covering an intersection of the Bug and Mukhavets rivers. It is to be constructed in a star shape, with barracks lining its banks on three sides and a citadel on an island in the center. The fort will accommodate 12,000 soldiers in total.;;;;;;;;;;;;; 
half_research_startup;1830 Research Balancing;;;;;;;;;;;;;
DEATHSUCRE;Antonio José de Sucre y Alcalá or the 'Gran Mariscal de Ayacucho' has been found dead on a a trail leading South. Sucre, a brilliant general and tactician who led the pro-independence forces to victory against the Spanish royalists in the decisive battles of Pichincha and Ayacucho, was perhaps Simón Bolívar's greatest ally. After vanquishing the Spaniards, he served as president of Bolivia until a strong anti-Bolívarian movement led to his resignation. In face of the imminent collapse of Gran Colombia, he headed South to discourage the secession of Ecuador. Seeing the danger that a beloved hero of the war of independence poses to their plot, the pro-Ecuadorian elements under Juan José Flores hired an assassin to murder Sucre, preventing his interference.;;;;;;;;;;;;;
osterreichische_lloyd_title;Österreichischer Lloyd;;;;;;;;;;;;;
osterreichische_lloyd_desc;Several sea transport insurance companies, banking houses and numerous individual shareholders, among them the Austrian politician Karl Ludwig von Bruck, have come together to form a shipping company. Based in Trieste, it would begin constructing new steamers to transports passengers and goods and bring news from overseas. With this much backing, the company would be sure to become the prime shipping company in the Austrian Empire.;;;;;;;;;;;;;
EVTDESC16051839;The Palace of Westminster has burned down today in a sudden conflagration. According to the investigation on the ground, a bundle of tally sticks used for accounting by the Exchequer was disposed of in two underfloor stoves under the House Floors, which caused a chimney fire. The fire then seeped through the building and caused the walls to catch fire as well. Before it was put out, flames engulfed all of Westminster Palace and left intact only five of its buildings. Reconstruction will have to begin immediately.;;;;;;;;;;;;;
EVTDESC160518411;After the loss of Central America by the Mexican Empire, secessionist movements both by Hispanic and indigenous nationalists have plagued our fledgling state of $COUNTRY$. Anastasio Aquino, a leader of the Nahualco indigenous people, has staged a rebellion in the department of La Paz after his brother was arrested by the owner of the hacienda the two worked on. He soon amassed an army of over 2,000 men and attacked towns across La Paz. His army will require the mobilization of our troops the way all-out war would.;;;;;;;;;;;;;
antoine_clot_title;Establish a School of Medicine for Women;;;;;;;;;;;;;
