 Key;English;French;German;Polish;Spanish;Italian;Swedish;Czech;Hungarian;
KENESARYDEATH;\n\nKenesary Kasimov has been killed! Despite his skill and bravery in the battlefield, Russian forces with their advanced weapons and tactics have reduced our numbers to a meager fraction of what it once was. It had been decided to retreat our remaining forces to the mountainous region near Lake Balkhash to continue the struggle against the Russians in more favourable terrain when our troops were ambushed and captured by a Kyrgyz force who had defected to the Russians, their location having been given away by the Kyrgyz Omron Khan. After their capture, Kenesary Khan, along with Nauryzbai were swiftly executed. With the Khan dead, we are divided and leaderless...;;;;;;;;;;;;;
SENIORZHUZ;\n\nWith the fall of the Middle Jüz, the remaining parts of the Kazakh Khanate, the Senior Jüz fell into decadence and wars with the Kyrgyz of the South, weakening further and increasingly seeking protection from us. While the various tribes of the Senior Jüz have always been more accepting of Russian influence in their lands, their distance from the Siberian frontiers had always made any type of formal annexation of their people unfeasible. Now that we have managed to extend our frontier south with the supprestion and integration of the Middle Jüz, we may now properly incorporate the Senior Jüz into the Russian Empire and end the sovereignty of the remaining Kazakh Jüzes once and for all!;;;;;;;;;;;;;
SENIORZHUZ2;\n\nOur increasing dependence on Russian protection has lead to them suggesting our formal annexation into the Russian Empire. The many tribes of the Senior Jüz have slowly warmed up to Russian influence throughout these past decades and many feel it is now the opportune time to apply for formal Russian citizenship, although this would undoubtably compromise our sovereignty.;;;;;;;;;;;;;
SENIORZHUZ3;\n\nIn an unexpected turn of events, the Senior Jüz have recinded their petition of annexation! How should we proceed?;;;;;;;;;;;;;
QINGNAYMAN;\n\nTroubles in the west between the Kazakhs and Russians have lead to the Nayman tribe of the Middle Jüz Kazakhs to seek protection from the Russians in our Empire. Who are we to deny sanctuary to those who are willing to bow before the true Son of Heaven?;;;;;;;;;;;;;
BABAJAN;\n\nBanbajan Fortress, built on our northernmost frontier on the left bank of the Syr Darya, has been captured and razed by the Kazakh warlord Zhankozha Nurmukhameduly! The fortress, dating to the past two decades, had been used as a staging point for exerting our influence and collecting tribute from the local Kazakhs as well as acting as a shield preventing incursions into the Syr Darya delta by the Khanate of Kokand. With the loss of this key fortress, our already shakey hold on our northern frontier has been completely shattered.;;;;;;;;;;;;;
BABAJAN2;\n\nIn a daring land grab, the Khanate of Khiva has sent an army of 2000 soldiers to the Zhanaqala Fortress on the left bank of the Syr Darya across the river. Part of this detachment crossed to the right bank of the Syr Darya and ravaged the nomadic camps of Zhankozha Nurmukhamedov, plundering about 1000 families, capturing women and killing old people and children. Zhankozha and his detachment of 250 fled and swam across the Syr Darya and now petition S.E. Erofeev and Lieutenant P.S. Mertvago on-board the Schooner "Nikolai", one of the first Russian ships to sail the Aral Sea, to strike back against the Khivan forces who threaten to march and take Raimsk.;;;;;;;;;;;;;
BABAJAN3;\n\nVictory has been achieved! Our strike against Zhankozha Nurmukhameduly's camp was not initially successful in capturing him, but luck was on our side as a small Russian have captured and delivered him to us! Apparently, he had approached the Russians and begged them to join him and his forces in attacking Zhanaqala Fortress. Thankfully the Russian garrison were not only reasonable in ignoring and delivering this nuisance to us, but have also evacuated the Raimsk Fortress in turn, showing their acceptance of our lordship over the whole of the Syr Darya delta. Things could not have gone any smoother for us! /nWith our control over the Syr Darya delta all but cemented, we can now look to expanding our horizons across the Aral Sea and up the Syr Darya!;;;;;;;;;;;;;
BABAJAN4;\n\nCurses! While our raid of Zhankozha Nurmukhameduly's camp was successful, we were unable to capture or kill him. A day after his escape he and his host of 250 had returned along with a Russian warship that proceeded to fire on the Zhanaqala Fortress. While most of the garrison was able to flee, the majority of the loot and captives captured were taken back and the Fortress itself was completely destroyed! The destruction of Zhanaqala has emboldened the Russians to expand their influence into the left bank of the Syr Darya, the local Kazakhs fully accepting their rule without much resistance. Unfortunately, with the other troubles currently facing our nation, this loss spells the end of our dreams to dominate the coastal Aral Sea...;;;;;;;;;;;;;
ZHANKOZHA;\n\nThe colonization of the Aral Sea region by us had already started by 1845, but mass discontent with our newly established regime has only just recently begun. The Syr Darya Kazakhs have rebelled! the reason for which was the confiscation of some land from the local population. The uprising is led by Zhankozha Nurmukhamedov, who expressed his unwillingness to submit to the protege of the imperial court, Sultan Arslan Dzhantorin. The resistance of the Syr Darya Kazakhs under the leadership of Zhankozha is also joined by the surviving participants of the Kenesary uprising who are still bitter about their defeat a decade prior. The rebels are centered in the Zhanakala fortress.;;;;;;;;;;;;;
KYRGYZCLEANUP;\n\nWe have managed to push back the Kokandi army back to the Ferghana Valley and retain our independence! This calls for celebration! A new Kyrgyz Khanate can now be established!;;;;;;;;;;;;;
KOKQNGTREATY;\n\nOutnumbered and outplanned, our righteous Holy War against the Chinese was perhaps doomed from the start. Following the barbaric execution of Jahangir Khoja, many of his followers in Kashgaria dispersed, making a prolonged war against the Qing impossible to sustain.\n\nDespite this, our courage and prowess seems to have frightened the Dragon Throne to the core, and they have approached us with the intent of establishing cordial relations between our states. Their offer includes pardoning those who fought alongside us in Kashgaria, and most importantly, the position of being their preferred trade partner in Central Asia. While wary of rubbing shoulders with infidels, Madali Khan graciously accepted the agreement, aware of the riches it would bring to his Khanate.;;;;;;;;;;;;;
QINGZHETYSU;\n\nAs we have managed to extend our control west over the entirety of the Generalship of Ili, we are in a position to formalize a border with the Kazakhs of the Middle Jüz. In exchange for the far west grazinglands of the lower Shu River, we gain control over our traditional claims over Lebushi and its surrounding territory.;;;;;;;;;;;;;
QINGZHETYSU2;\n\nAfter a period of rapid expansion into the Zhetysu region, an envoy from China has arrived detailing the establishment of a formal border between our two peoples. The resulting border would have us lose control over the grazing lands currently inhabited by the Eastern Nayman tribe, but would also grant us a claim over the tribes of the Senior Jüz not under Chinese rule.;;;;;;;;;;;;;
KYRGYZRAIDS;The continued existence of the Kara-Kyrgyz Khanate has lead to an increase of hostile raids on our borders.;;;;;;;;;;;;;
KYRGYZRAIDS2;Recent raids against our neighbours have brought back a great deal of wealth and prestige for the Khanate.;;;;;;;;;;;;;
kaz_conquer_kokand_title;Conquer the Khanate of Kokand;;;;;;;;;;;;;
kaz_conquer_kokand_desc;Unite the Kazakh Steppe;;;;;;;;;;;;;
kaz_conquer_kyrgyz_title;Put an end to Kyrgyz raids;;;;;;;;;;;;;
kaz_conquer_kyrgyz_desc;Unite the Kazakh Steppe;;;;;;;;;;;;;
great_tartaria1_title;Reclaim the Former Tatar Homeland;;;;;;;;;;;;;
great_tartaria1_desc;Epic Tartaria Larp Stage 1;;;;;;;;;;;;;
great_tartaria2_title;Proclaim the Empire of Great Tartaria;;;;;;;;;;;;;
great_tartaria2_desc;Epic Tartaria Larp Stage 2;;;;;;;;;;;;;
junior_colonize_steppe_title;Consolidate the Syr Darya delta;;;;;;;;;;;;;
junior_colonize_steppe_desc;With the Junior Jüz Kazakhs a free and independent people once again, we can consolidate the remaining disorganized territories in the Syr Darya delta and bring the Kazakhs living there into the fold.;;;;;;;;;;;;;
unite_kazakhstan_title;Unite the Kazakh Steppe;;;;;;;;;;;;;
unite_kazakhstan_desc;The Kazakh people are divide. No longer! We have established dominance over the disparate tribes of the Kazakh steppe and can claim the mantle of Shah-i Turan and Khan of All-Kazakhs. May our people remain united, may our people remain strong!;;;;;;;;;;;;;
build_zhanqala_title;Build the Zhanaqala Fortress;;;;;;;;;;;;;
build_zhanqala_desc;The situation in the Syr Darya delta has improved since the capture and destruction of the Babajan Fortress in 1835 at the hands of Zhankozha Batyr enough so that we may attempt to construct a second fortress in the area to extend our influence along the Aral coast once more.;;;;;;;;;;;;;
invade_the_steppe_khi_title;Invade the Kazakh Steppe;;;;;;;;;;;;;
invade_the_steppe_khi_desc;With the Zhanaqala Fortess built over the ruins of the old Babajan Fortress, we have regained a stable enough footing to once again start projecting power into the Kazakh Steppe. While the recently arrived Russians may be powerful, their hold on these lands is still loose enough for us to attempt an incursion into the right bank of the Syr Darya. May God be with us!;;;;;;;;;;;;;
found_kopal_khi_title;Establish the Bailiff of the Senior Horde Kazakhs in Kopal;;;;;;;;;;;;;
found_kopal_desc;In order to exercise more control over our southern frontier in the Kazakh Steppe, we can establish the position of The Bailiff of the Senior Horde Kazakhs centered on the new Kopal fortification in the northeastern part of Semirechye. The Bailiff System, as a transitional stage, will become the first administrative body of imperial authorities in the territory of Semirechye, §Bexpanding our influence in the Senior Jüz§W;;;;;;;;;;;;;
SKEAKYQUOTE;Abbas Mirza's irrevocable losses have affected him severely and his health began to suffer (LOC FOR ABBAS MIRZA);;;;;;;;;;;;;
