Key;English;French;German;Polish;Spanish;Italian;Swedish;Czech;Hungarian;Dutch;Portuguese;Russian;Finnish;
core_loango_title;Claim Loango;;;;Reclamar Loango;;;;;;;;
core_loango_desc;Loango has been a nuisance for all of our existance, always helping insurgences in the north and blocking trade with our brothers further North. They don't deserve a country for theirselvesand must be brought under our control else they continue to be a pest to the region and the world. Now that its former territory is ours, it's time to formally proclaim them a state of ours.;;;;Loango ha sido una molestia para toda nuestra existencia, siempre ayudando a las insurgencias en el norte y bloqueando el comercio con nuestros hermanos más al norte. No merecen un país para sí mismos y deben estar bajo nuestro control, de lo contrario siguen siendo una plaga para la región y el mundo. Ahora que su antiguo territorio es nuestro, es hora de proclamarlos formalmente un estado nuestro.;;;;;;;;
core_north_title;Conquer the North;;;;Conquistar el Norte;;;;;;;;
core_north_desc;Now that Loango is firmly under our empire and we have the European technology needed to do so, it's time to reign over the North. Our brothers and sisters have been unorganized for ages, and will probably be pleased to be under our rule. To the North!;;;;Ahora que Loango está firmemente bajo nuestro imperio y tenemos la tecnología europea necesaria para hacerlo, es hora de reinar sobre el Norte. Nuestros hermanos y hermanas han estado desorganizados durante años, y probablemente estarán encantados de estar bajo nuestro gobierno. ¡Al norte!;;;;;;;;
kongowar_portugal_title;Free the Bantu in Angola;;;;Liberar a los Bantú en Angola;;;;;;;;
kongowar_portugal_desc;Now that we are catching on technologically and militarily to our neighbour Portugal, it's time to free ourselves from their influence and free our cousins to the South from the colonizers that have oppressed them for now centuries. God bless our great Empire! God bless Kongo! To arms! §RSTART A WAR WITH PORTUGAL§W;;;;Ahora que nos estamos acercando tecnológica y militarmente a nuestro vecino Portugal, es hora de liberarnos de su influencia y liberar a nuestros primos del Sur de los colonizadores que los han oprimido durante siglos. ¡Dios bendiga a nuestro gran Imperio! ¡Dios bendiga al Congo! ¡A las armas! §REMPEZAR UNA GUERRA CONTRA PORTUGAL§W;;;;;;;;
kongowar_won_title;Victory in Angola!;;;;¡Victoria en Angola!;;;;;;;;
kongowar_won_desc;After a bloody war, we have freed our cousins and established our reign over the region. We are now the greatest kingdom in Africa. God bless our greater kingdom! God bless Kongo!;;;;Después de una guerra sangrienta, hemos liberado a nuestros primos y establecido nuestro reinado sobre la región. Ahora somos el reino más grande de África. ¡Dios bendiga nuestro gran reino! ¡Dios salve al Congo!;;;;;;;;
african_ports_rename_title;Rename our African Port;;;;Renombrar nuestro Puerto Africano;;;;;;;;;
african_ports_rename_desc;Now that our newly aquired port is under our control, we should name it to its new exonym.;;;;Ahora que nuestro recientemente adquirido puerto está bajo nuestro control, deberíamos nombrarlo con su nuevo exónimo.;;;;;;;;;;;;;;;;;;;;;;