Key;English;French;German;Polish;Spanish;Italian;Swedish;Czech;Hungarian;Dutch;Portuguese;Russian;Finnish;
sanmen_treaty_port_ita_desc;Sanmen Bay is very large, 390 square kilometers and 9 meters deep even at low tide, thus perfectly suitable for a harbor that can house dozens of ships at a time. The coast on both sides of the bay is very steep, making it very defensible. Therefore our ministers have suggested that we send an ultimatum to the Qing threatening armed action if they don't lease us the concession. If Britain and Portugal own ports in China, we too have a right to a place in the sun.;;;;;;;;;;;;;
tsushima_incident_title;Forcibly lease Tsushima;;;;;;;;;;;;;
tsushima_incident_desc;The island of Tsushima holds an extremely strategic position. Mountainous and located in the middle of the straight between Korea and Japan, it would make a perfect outpost and coaling station for us to extend our influence. However, perfidious Albion may attempt to foil our ambitions.;;;;;;;;;;;;;
stralsund;Farmlands;;;;;;;;;;;;;
barcelona_rail_title;The Barcelona-Mataro railroad;;;;;;;;;;;;;
barcelona_rail_desc;For too long has our country been lagging behind industrially. We must invest in railroads if we are to progress! A businessman has proposed constructing a line from Barcelona to Mataro. While unambitious, this will set the precedent for a veritable railway boom throughout our entire nation.;;;;;;;;;;;;;
sulfur_contract_title;Renegotiate the Sulfur Contract;;;;;;;;;;;;;
sulfur_contract_desc;In 1814, as Britain liberated us from Napoleonic occupation, they signed a contract granting them trade rights on the masses of sulfur extracted daily from the island of Sicily. This contract however greatly favors the British in terms of profits, and Franch businessmen have proposed a more favorable contract that would give France a monopoly on Sicilian sulfur exports. This would however unquestionably anger the Brits.;;;;;;;;;;;;;
british_blockade;British blockade;;;;;;;;;;;;;
british_blockade_desc;In the so-called 'Sulfur War', Britain is blockading our coast to prevent outflow of sulfur.;;;;;;;;;;;;;
wilkes_expedition_title;The Wilkes Expedition;;;;;;;;;;;;;
wilkes_expedition_desc;The United States House of Representatives passed a resolution on May 21, 1828, requesting President John Quincy Adams to send a ship to explore the Pacific. Adams was keen on the resolution and ordered his Secretary of the Navy to ready a ship, however the bill stalled in the US Senate in February 1829. Now Congress has finally voted to dispatch a squadron of ships with botanists, geologists, botanists and philologists on board to map parts of the Pacific, visit the islanders and plan possible colonization.;;;;;;;;;;;;;
claim_samoa_title;Lay claim to Samoa;;;;;;;;;;;;;
claim_samoa_desc;Samoa lies South of the equator, about halfway between Hawaii and New Zealand, in the Polynesian region of the Pacific Ocean. It consists of two large islands, Upolu and Savai'i and a cluster of 7 smaller islands to the Southeast with minor outliers of little significance. With a tropical climate year-round and covered in large part by jungles, these islands are truly magnificient and would make a perfect strategic outpost in the South Pacific, however other countries may be interested in laying competing claims.;;;;;;;;;;;;;
mckinley_tariff_title;The McKinley Tariff;;;;;;;;;;;;;
mckinley_tariff_desc;Representative William McKinley has proposed modifying our tariffs by duty on imports to almost fifty percent to protect domestic industries from foreign competition.;;;;;;;;;;;;;
mckinley_tariffs;The McKinley Tariff;;;;;;;;;;;;;
mckinley_tariffs_desc;Framed by representative William McKinley, the tariff of 1890 raises our duties on imports to protect domstic industries from foreign competition.;;;;;;;;;;;;;
vnz_crisis_title;Demand Essequibo;;;;;;;;;;;;;
vnz_crisis_desc;Guyana Essequiba is the area of Guyana West of the Essequibo river. Owned for decades by Gran Colombia, Britain seized it during its collapse. Recent gold mining in the area has increased tensions, with the audacious Brits even claiming a small amount of land on our side of the current line of control.;;;;;;;;;;;;;
NAPOLEONEXPLAINED;As France, you begin as a constitutional monarchy under king Louis Philippe. If you get 3 militancy in the revolutions of 1848, you'll get an event for the French Revolution installing the 2nd Republic. If you then get the conservatives to win the election either via event that lets you choose between Napoleon III and Cavaignac or by normal election and you keep the conservatives in power until 1851, you will get an event for Napoleon III's coup in the election. This sets you to an absolute empire, allowing you to appoint your ruling party and giving you more expansion paths, such as the Luxemburg Purchase, claiming Catalonia, the Second French Intervention in Mexico and more.;;;;;;;;;;;;;
peu_const_one_title;The Constitution of Huancayo;;;;;;;;;;;;;
peu_const_one_desc;With our nation once again independent of the Confederation, we need to write a new constitution to prevent such events from repeating. The constitutions of 1823, 1828 and 1834 were liberal-minded and decentralized our country, leading to the entrance into the confederation. This shows that we need a unitary government to remain strong.;;;;;;;;;;;;;
peu_const_two_title;The Constitution of $YEAR$;;;;;;;;;;;;;
peu_const_two_desc;With the conservatives out of power, we must undo their injustices and return liberty to the people. Proposed reforms include strengthening the parliament and weakening the executive, abolishing the death penalty, allowing suffrage to all Peruvians over the age of 21 who can read and write and reducing the power of the clergy.;;;;;;;;;;;;;
peu_const_three_title;The Constitution of $YEAR$;;;;;;;;;;;;;
peu_const_three_desc;Our last constitution was clearly too liberal for our conservative populace. We have no choice but to roll back some reforms such as the death penalty to appease them and avoid further conflict.;;;;;;;;;;;;;
vivanco_pareja_title;The Vivanco-Pareja Treaty;;;;;;;;;;;;;
vivanco_pareja_desc;Our war with Spain has been dragging on for a while now with no end in sight while our economy suffers due to the occupation of the valuable Chincha Islands. Perhaps a treaty would help smooth things over?;;;;;;;;;;;;;
peu_const_prado_title;The Pradista Constitution;;;;;;;;;;;;;
peu_const_prado_desc;To solidify Prado's regime, we must gain popularity among the people. Our only chance is to commit to new reforms such as freedom of press and the final abolition of the death penalty and hope to acquire supporters among the middle class.;;;;;;;;;;;;;
CHRISTIANDEATH;After ruling for 8 years, King Christian VIII has died today at age 61. His demise was caused by blood poisoning inflicted accidentally by medicinal bloodletting. Before his passing, he was long faced with a dilemma: His son, Frederick VII, was without heirs and had two divorces behind him, bringing danger to the family line, but due to differing succession laws, passing the monarchy to his niece Louise von Hessen would have split the Duchies of Schleswig and Holstein from the Danish crown. Christian could not fulfill his last ambition, namely a new united constitution for both Denmark and the duchies that would guarantee safe inheritance to Louise, and so the crown has passed to Frederick. Amid the chaos of 1848 erupting in Europe however, the demand for a new constitution continues.;;;;;;;;;;;;;
MARCHREVLOC;With the insecurity of the government following the late King Christian's passing, much confusion has spread among the populace. Fearing centralization efforts by the government, representatives from Schleswig and Holstein have gathered in Rendsburg to discuss the government's alleged plans regarding a new constitution. A messenger informing the residents of Copenhagen of the gathering, but the news quickly spun out of control, making people think a rebellion had begun in the duchies. Furious citizens marched to the royal palace to demand a new constitution to assert dominance over the supposed revolt.;;;;;;;;;;;;;
NAPOLEONEPICFAIL;Louis-Napoleon Bonaparte, Emperor Napoleon's nephew, became next in the Bonapartist line when his cousin Napoleon II died. Attempting to reclaim what he sees as his rightful throne, he walked from the German border into a garrison in Strasburg with nothing to back him up but his excellence, grandeur and wry wit to sway the garrison to his cause and march to Paris to end the July Monarchy and become emperor. Naturally, he was immediately arrested and sent back into exile.;;;;;;;;;;;;;
MAXNMORITZ;A new illustrated story from author Wilhelm Busch by the name of 'Max und Moritz' has appeared. This highly inventive, blackly humorous tale, told entirely in rhymed couplets, describes two mischieveous youths who play several pranks on grownups. In the end, they get what's coming to them.;;;;;;;;;;;;;
ecu_epn_title;Found the EPN;;;;;;;;;;;;;
ecu_epn_desc;To progress as a nation, we need to invest in research, however our people are largely not educated enough to engineer new inventions. To educate them in that regard, a new school has been proposed in Quito: The Escuela Politecnica Nacional or National Polytechnic School.;;;;;;;;;;;;;
cos_const_one_title;The Constitution of Costa Rica;;;;;;;;;;;;;
cos_const_one_desc;Our country is newly independent from the Republic of Central America, leaving us in disarray. We need a new constitution to guide us and modernize.;;;;;;;;;;;;;
GWALIORCAMPAIGN;Seeing a chance in the disaster following the Anglo-Afghan War, the Maratha elite has assassinated the young sultan of the Princely State of Gwalior, a British puppet, and began a revolt against the colonial government. Their position was improved signficantly by the British unpreparedness to fight a war within the Indian interior, long thought to be pacified and subjugated.;;;;;;;;;;;;;
REBRIOT;A series of protests by farmers and agricultural workers in response to taxation increases has begun in western and central Wales. The rioters, often men dressed as women, inspired by their icon 'Rebecca', a fictional Welsh housewife, take their actions against toll-gates, as they are tangible representations of taxes and tolls.;;;;;;;;;;;;;
SUPREMOWAR;Sidelined general Jose Obando and several liberal regional governors from Socorro, Mariquita, Sogamoso, Tunja, Vélez, Casanare, Antioquia, Ciénaga, Santa Marta, Cartagena, Mompós and Panama, the 'Supremes', have joined the revolt in Pasto to overthrow the conservative government of president José Ignacio de Márquez. This civil war is especially precarious due to the army being in the South to deal with the Pasto conflict while Bogotá lies open to invasion.;;;;;;;;;;;;;
WSCANALDONE;141 miles long and 36m wide, outfitted with 19 locks, the White Sea Canal has finally joined Lake Onega to the White Sea. Years of hard work, thousands of tons of cement, hundreds of deaths and many more injuries have been the price, but the reward is much greater. Connecting Lake Onega to the White Sea enables shipping to connect over Lake Ladoga to the Gulf of Finland and the Baltic Sea, enabling ships to sail straight to the White Sea instead of having to go North of Norway. The region will surely experience an economic upturn with the sudden increase in trade.;;;;;;;;;;;;;
HECKER;Revolutionary leaders Friedrich Hecker, Gustav von Struve, and others tried to overthrow the monarchy and begin a republic. Setting out to march on Freiburg from Konstanz, they didn't get enough recruits and were crushed. Despite the failure of Hecker's forces, the populace in Freiburg itself rose up to defend against the incoming Badner national guards only to be bloodily beaten down. Hecker himself went into exile in the United States, while other leaders fled to Switzerland.;;;;;;;;;;;;;
AVAEARTHQUAKE;This morning, Mandalay was struck by a devastating earthquake. So strong was the shaking of the ground that it could be felt in both Rangoon and Bhamo, incredibly even temporarily reversing the flow of the Irrawady River to go upstream and cause flooding. Damage to the capital in Inwa is so severe that the Burmese government is currently relocating to Amarapura. About 200-300 people died, mostly in villages wiped out by liquefaction.;;;;;;;;;;;;;
AVEZZANOQUAKE;A large earthquake with the epicenter in the village of Avezzano has struck the province of L'Avila. It was so strong that it could be felt in Rome: Saint John's Basilica reported a fallen statue. However the damage in L'Avila was much more severe: Avezzano itself was completely leveled and 96% of its population died. In total, he earthquake caused around 30.000 deaths.;;;;;;;;;;;;;
HAIYUANQUAKE;An immense earthquake has struck the area around the epicenter in Haiyuan seeing the largest recorded death toll out of any earthquake in history. Entire villages were buried in landslides, and nearly all the houses collapsed in a large radius around Haiyuan. Even the cities of Xi'an, Taiyuan, Xining and Lanzhou in the next state over sustained disastrous damage. It could be felt as far away as Qinghai and the Yellow Sea. In total, around 250.000 people died in the tragedy.;;;;;;;;;;;;;
KRALINCIDENT;Following our revolt against Austria, Slovaks have been fearing magyarization. Amid rising tensions, a pair of Slovaks, Janko Král and Jan Rotarides, made demands for the liquidation of serfdom and recognition of the Slovak language in schools and the government. These demands soon landed the pair in jail.;;;;;;;;;;;;;
SLOVAKMANIFESTO;A new manifesto has been issued by Slovak nationalists, dubbed 'Demands of the Slovak Nation'. It was made up of fourteen points, including but not limited to equality and fraternal coexistance of all people in Hungary, adoption of the Slovak language as an official language in government offices and schools, establishment of a Slovak national guard, introduction of full voting rights for adult males, official recognition of Slovak symbols, abolition of laws limiting the freedoms of the press, of assembly and of association, reformation of land ownership by restoring the land that had been seized from the peasants by the Hungarian aristocracy and transformation of Hungary into a decentralised state consisting of equal nationsm each with its own parliament and equal representation in the Diet of Hungary.;;;;;;;;;;;;;
POTATOANGER;The Potato Decrees have begun taking effect in the Volga-Ural area, however the inhabitants are very paranoid and fearful of this new crop. Largely caused by eschatological rumours associating potato planting with the service to the antichrist, around 500.000 angry peasants have more than 500,000 peasants risen up, destroying sowings of potatoes, and thrashing officials. We could either end the potato cultivation enforcement measures or fight the revolt.;;;;;;;;;;;;;
potatoes_introduced;Forced introduction of potatoes;;;;;;;;;;;;;
potatoes_introduced_desc;The Potato Decrees have begun a local government effort to enforce potato cultivation, increasing agricultural output but angering the locals and natives.;;;;;;;;;;;;;
forced_potatoes_dec_title;The Potato Decrees;;;;;;;;;;;;;
forced_potatoes_dec_desc;Potatoes are much more efficient than the traditional grains of the Ural-Volga area, however unlike much of Western Russia they refuse to invest in potato crop, the main reason being their association of potatoes with the antichrist. Forcing people to grow potatoes will surely anger them, but it may be worth it due to the increase in output.;;;;;;;;;;;;;
kisilevs_reforms;Kiselev's Reforms;;;;;;;;;;;;;
kisilevs_reforms_desc;Pavel Dmitrievich Kiselev has passed a number of reforms improving our administration and the situation of the serfs.;;;;;;;;;;;;;
kisilev_reforms_title;Kiselev's Reforms;;;;;;;;;;;;;
kisilev_reforms_desc;Leader of the 5th department of His Imperial Majesty's Chancellery, Pavel Dmitrievich Kiselev has proposed a number of reforms aimed at the eventual abolition of serfdom and improvement of the Russian administration. These include creating chambers of state property with a state property district each, split into departments of forestry and general economic departments with district chiefs at the head of both. Depending on the local population, these districts could cover one or more counties, with subdivisions into volosts with a local government elected for three years and parishes within the volosts which in turn would consist of villages, each with its own local gathering that would elect a village elder for three years, assign policemen and decide on local sentences for misdemeanors. Another proposal is giving landowners the right to free their serfs at their will, concluding an agreement with them on the provision of land allotments to them in hereditary possession.;;;;;;;;;;;;;
integrate_asm_title;Integrate Assam;;;;;;;;;;;;;
integrate_asm_desc;In 1833, we imposed Purandar Singha, the last king of the Ahom dynasty as ruler of the Princely State of Upper Assam, however his administration has been a hotbed of corruption and misfeasance. His subjects are oppressed and misgoverned and his rule is very distasteful to the bulk of the population. Purandar Singha is himself found guilty of gathering personal fortune rather than concentrating on good governance for his people.;;;;;;;;;;;;;
MAYASSEMBLY;Following the Hungarian war of independence against Austria, Serbians have grown increasingly uneasy about Magyar rule. Political leaders of the Serbs have decided to hold an assembly demanding a separate Serb voivodeship within the areas of Syrmia, Baranja, Backa, the Becej District, Banat and the Kikinda District. Secondary demands include sending a delegation to the slavic congress in Prague and recognizing Romanian ethnic sovereignty. If we do not recognize the voivodeship of Vojvodina, there will be a revolt threatening our war effort.;;;;;;;;;;;;;
SERBUPRISING;A wave of volunteers has entered Vojvodina from the Principality of Serbia. Together with irregular peasants, they have organized an impromptu army and begun attacking our garrisons. We are left with no choice but to combat this threat by force of arms.;;;;;;;;;;;;;
POORBIRD;The Great Auk, a species of bird long dwindling in population long confined to a small island off the coast of Iceland, has gone extinct. The Great Auks numbered no more than fifty individuals on their last habitat on the island of Eldey where they were slowly killed due to museums desiring their skins for preservation and display. The last pair, found incubating an egg, was killed there on June 1844, on request from a merchant who wanted specimens, with locals Jón Brandsson and Sigurður Ísleifsson strangling the adults and Ketill Ketilsson smashing the egg with his boot.;;;;;;;;;;;;;
ORSINIATTACK;Disgruntled Italian nationalist Felice Orsini attempted to assassinate Emperor Napoleon III last night. He believed that by killing him, he would cause a social revolution in France that would spread to Italy and lead to the unification of the Italian peninsula. At 8:30 PM, as Napoléon and his wife Eugénie were taking a carriage to the opera, Orsini struck with his accomplices. Three bombs were tossed next to the royal carriage, however its special armoring saved the royal couples' lives. Pedestrians were not so lucky, for 12 died that same night and 156 more were injured. Orsini and his co-conspirators were arrested on the spot, tried and sentenced to death.;;;;;;;;;;;;;
CRUSENSTOLP;A series of riots has taken place in Stockholm, caused by the Swedish Court of Appeals' decision to sentence the publicist Magnus Jacob Crusenstolpe to three years' imprisonment for lèse-majesté for insulting King Karl XIV Johan. The action of the king that Crusenstolpe criticized was having promoted a noble two military ranks at once instead of the usual single rank who, in addition, did not prove himself deserving of a promotion. This perceived unjust punishment of the fair criticism given by Crusenstolpe led to several riotous crowds gathering in Stockholm to demand his release and, in one case, even attempt to storm his prison. In the end, 2 people died and 5 were seriously injured.;;;;;;;;;;;;;
ASTORPLACE;Tensions in New York have boiled over in a nativist riot against British actor William Charles Macready as his feud with the American actor Edwin Forrest came to a head. The two had long been friends, both doing tours of each others countries, however in recent years they have developed a rivalry that galvanized the lower, anti-British class against the upper, pro-British class in New York. Macready's performance at Astor Place Theater was interrupted by a crowd breaking down the doors. As Macready escaped through the back exit, cops began beating the rioters with their batons to get a hold on the situation. This had the opposite effect: More and more people joined the mob and drove back the police, leading to state troopers having to be deployed to restore order. 25 rioters died and over 120 were injured, and Astor Place Theater will forever be known as "DisAstor Place".;;;;;;;;;;;;;
BLOODYSUNDAY;This Sunday, some 10,000 people gathered in Trafalgar Square, London, to protest against unemployment and coercion in Ireland. 2,000 police and 400 soldiers were deployed to forcibly disperse the crowd with batons, arresting 400 and injuring 75. Many protestors were armed with iron bars, knives, pokers and gas pipes to defend their protest, escalating the ensuing conflict.;;;;;;;;;;;;;
GAVAZZIRIOT;Riots have occured in Quebec City and Montreal by mobs which attacked halls in which ex-Catholic monk Alessandro Gavazzi was lecturing. The principal participants were Irish Catholics who were angered by Gavazzi's sentiments. Gavazzi attributed the failure of the Italian national movement of 1848-49 to the defection of Pope Pius IX from the cause, and therefore rejected Catholicism. In both cases, strong bodies of police had been stationed nearby in anticipation of disturbances and shot into the crowds indiscriminately, dispersing them with ease. 5 people died and many more were injured, while Gavazzi arrived back in Italy safe and sound.;;;;;;;;;;;;;
rebellion_losses_bill_title;The Rebellion Losses Bill;;;;;;;;;;;;;
rebellion_losses_bill_desc;The residents of Upper Canada have received compensation for the damages inflicted by the Rebellions of 1837, however Lower Canada has gotten no such help. The Canadian parliament has suggested we pass a bill entitling them to the same aid. The only concern is that it may cause outcry among the Canadian conservatives because it may be seem as 'giving money to the rebels' since the rebellions were much more severe in Lower Canada.;;;;;;;;;;;;;
MONTREALPARLIAMENTBURN;Last night, following a series of riots by conservatives in Canada in response to the Rebellion Losses Bill, an angry mob of about 1,500 gathered in Montreal and burned down the parliament buildings. Over 22,000 books were lost, but nobody was seriously injured. Soon after, police began rounding up people under suspicion of having participated in the torching while the parliament temporarily moved into a church to be safe in its sanctity.;;;;;;;;;;;;;
BELGIANSTRIKEONE;Last week, about 200,000 workers participated in a strike to pressure the government into introducing universal voting rights inspired by the strike of 1886. Between 13 and 20 protestors died in the resulting conflicts with police. Now it is in our hands: Will we introduce universal suffrage or will we stick to the tried and true system we have used so far?;;;;;;;;;;;;;
BELGIANSTRIKETWO;A small gathering organised by anarchists in Liège met with unexpected support, partly as a result of the ongoing economic downturn and harsh winter. Between 800-900 workers, many from the city's metal works, attended the initial demonstration. Rather than abating, the strike spread like a wildfire through the industrial areas where bloody clashes with police ensued. Several dozen people gave their lives to the cause that, in the end, yielded no results.;;;;;;;;;;;;;
vuk_karadzic_reform_title;Vuk Karadic's language reforms;;;;;;;;;;;;;
vuk_karadzic_reform_desc;Vuk Stefanovic Karadic has reformed the Serbian literary language and standardized the Serbian Cyrillic alphabet by following strict phonemic principles on the Johann Christoph Adelung model and Jan Hus Czech alphabet. Karadic's reforms of the Serbian literary language modernized it and distanced it from Serbian and Russian Church Slavonic and brought it closer to common folk speech. However, he has a eastern Bosnian accent which many in northern Serbia and Vojvodina have difficulty adapting to. Officially recognizing it will help us more efficiently run our schools, however it will also require a short period of adaptation to the dialect.;;;;;;;;;;;;; 
karadzic_reforms;Vuk Karadic's language reforms;;;;;;;;;;;;;
karadzic_reforms_desc;The Serbian language has been reformed by Vuk Stefanovic Karadic to have a standardized Cyrillic alphabet and distanced Serbian from Church Slavonic and brought it closer to folk speech.;;;;;;;;;;;;;
BLOODYMONDAY;Religious tensions against Catholic immigrants have spiked in Louisville, Kentucky, where on election day, mobs of Irish and German immigrants clashed with crowds of shotgun-armed nativist Kentuckians. Twenty-two people died and five were arrested. Several city blocks were burnt to the ground by the fire formed in the ensuing chaos. The mayor, despite himself being a nativist, called to end the fighting and form a bucket line to quell the flames, thereby saving the church and many other homes within Louisville.;;;;;;;;;;;;;
mannheim_water_tower_title;Construct the Mannheim Water Tower;;;;;;;;;;;;;
