Key;English;French;German;Polish;Spanish;Italian;Swedish;Czech;Hungarian;Dutch;Portuguese;Russian;Finnish;
GILDEDLOC;The Gilded Age is an era occurring during the late 19th century, from the 1870s to about 1900. It is a time of rapid economic growth, especially in the Northern and Western United States. As American wages soar above those in Europe, especially for skilled workers, we are is seeing an influx of millions of immigrants. The rapid expansion of industrialization is leading to a real wage growth of 60% between 1860 and 1890 and spreading across the growing labor force. The average annual wage per industrial worker (including men, women, and children) will rise 48% between 1880 and 1890. Conversely, the Gilded Age is also an era of abject poverty and inequality, as millions of immigrants pour into the United States, and the high concentration of wealth becomes more visible and contentious. Politically, the gilded age is introducing more and more influence of business, with tycoons such as John D. Rockefeller, Andrew W. Mellon, Andrew Carnegie, J. P. Morgan, Meyer Guggenheim and Cornelius Vanderbilt, so-called 'robber barrons' lobbying congress to follow their will.;;;;;;;;;;;;;
STANOILLOC;Established in 1870 by John D. Rockefeller and Henry Flagler as a corporation in Ohio, it is the largest oil refiner in the world. Its history as one of the world's first and largest multinational corporations will end in 1911, when the U.S. Supreme Court will rule, in a landmark case, that Standard Oil is an illegal monopoly, controlling 91% of oil refinement and 85% of final sales in the United States in 1904. John D. Rockefeller's Standard Oil stocks made him the richest man of all time.;;;;;;;;;;;;;
rename_nebraska_mex_title;Rename Iturbide;;;;;;;;;;;;;
rename_sdakota_mex_title;Rename Dakota del Sur;;;;;;;;;;;;;
rename_ndakota_mex_title;Rename Dakota del Norte;;;;;;;;;;;;;
rename_minnesota_mex_title;Rename La Punta;;;;;;;;;;;;;
rename_kansas_mex_title;Rename Resurgimiento;;;;;;;;;;;;;
rename_wyoming_mex_title;Rename Fuentes;;;;;;;;;;;;;
rename_kansas_mex_title;Rename Reserva;;;;;;;;;;;;;
rename_kansas_mex_desc;Now that Nieves is under our control, we should name it to its Mexican exonym.;;;;;;;;;;;;;;;;;;;;;;;;;;
rename_wyoming_mex_desc;Now that Nieves is under our control, we should name it to its Mexican exonym.;;;;;;;;;;;;;;;;;;;;;;;;;;
rename_kansas_mex_desc;Mow that Nieves is under our control, we should name it to its Mexican exonym.;;;;;;;;;;;;;;;;;;;;;;;;;;
rename_iowa_mex_title;Rename Los Altos;;;;;;;;;;;;;
rename_missouri_mex_title;Rename Liberacion;;;;;;;;;;;;;
rename_arkansas_mex_title;Rename Terminal;;;;;;;;;;;;;
rename_louisianna_mex_title;Rename Luisiana;;;;;;;;;;;;;
rename_idaho_mex_title;Rename Bosques;;;;;;;;;;;;;
florida_rename_mex_title;Rename Florida;;;;;;;;;;;;;
florida_rename_usa_title;Rename Florida;;;;;;;;;;;;;
e_washington_rename_mex_title;Rename East Colombia;;;;;;;;;;;;;
w_washington_rename_mex_title;Rename West Colombia;;;;;;;;;;;;;
oregon_rename_mex_title;Rename Oregon;;;;;;;;;;;;;
montana_rename_mex_title;Rename Nieves;;;;;;;;;;;;;
montana_rename_mex_desc;Now that Nieves is under our control, we should name it to its Mexican exonym.;;;;;;;;;;;;;
denver_rename_mex_title;Rename Cumbres;;;;;;;;;;;;;
denver_rename_mex_desc;Now that Cumbres is under our control, we should name it to its Mexican exonym.;;;;;;;;;;;;;
e_washington_rename_mex_desc;Now that East Colombia is under our control, we should name it to its Mexican exonym.;;;;;;;;;;;;;
w_washington_rename_mex_desc;Now that West Colombia is under our control, we should name it to its Mexican exonym.;;;;;;;;;;;;;
oregon_rename_mex_desc;Now that Oregon is under our control, we should name it to its Mexican exonym.;;;;;;;;;;;;;
rename_nebraska_mex_desc;Now that Iturbide is under our control, we should name it to its Mexican exonym.;;;;;;;;;;;;;
rename_sdakota_mex_desc;Now that Dakota del Sur is under our control, we should name it to its Mexican exonym.;;;;;;;;;;;;;
rename_ndakota_mex_desc;Now that Dakota del Norte is under our control, we should name it to its Mexican exonym.;;;;;;;;;;;;;
rename_minnesota_mex_desc;Now that La Punta is under our control, we should name it to its Mexican exonym.;;;;;;;;;;;;;
rename_iowa_mex_desc;Now that Los Altos is under our control, we should name it to its Mexican exonym.;;;;;;;;;;;;;
rename_missouri_mex_desc;Now that Liberacion is under our control, we should name it to its Mexican exonym.;;;;;;;;;;;;;
rename_arkansas_mex_desc;Now that Terminal is under our control, we should name it to its Mexican exonym.;;;;;;;;;;;;;
rename_louisianna_mex_desc;Now that Luisiana is under our control, we should name it to its Mexican exonym.;;;;;;;;;;;;;
rename_idaho_mex_desc;Now that Bosques is under our control, we should name it to its Mexican exonym.;;;;;;;;;;;;;
florida_rename_mex_desc;Now that Florida is under our control, we should name it to its Mexican exonym.;;;;;;;;;;;;;
florida_rename_usa_desc;Now that Florida is back under our control, we should rename it to its proper yankee endonym.;;;;;;;;;;;;;
denver_rename_usa_desc;Now that Denver is back under our control, we should rename it to its proper yankee endonym.;;;;;;;;;;;;;
denver_rename_usa_title;Rename Denver;;;;;;;;;;;;;
MOBYLOC;Moby-Dick, or, The Whale, is an 1851 novel by American writer Herman Melville. The book is the sailor Ishmael's narrative of the obsessive quest of Ahab, captain of the whaling ship Pequod, for revenge on Moby Dick, the giant white sperm whale that on the ship's previous voyage bit off Ahab's leg at the knee. A contribution to the literature of the American Renaissance, Moby-Dick was published to mixed reviews, was a commercial failure, and was out of print at the time of the author's death in 1891.;;;;;;;;;;;;;
the_white_fleet_title;The White Fleet;;;;;;;;;;;;;
the_white_fleet_desc;The Great White Fleet is the popular nickname for the group of 16 United States Navy battleships which will complete a journey around the globe from December 16, 1907 to February 22, 1909 by order of United States President Theodore Roosevelt. Its mission is to make friendly courtesy visits to numerous countries while displaying new U.S. naval power to the world. The hulls of these ships are painted a stark white, giving the armada its nickname.;;;;;;;;;;;;;
lower_infamy;Lower Infamy;;;;;;;;;;;;;
lower_infamy_desc;An infamy reduction increase.;;;;;;;;;;;;;
send_a_boat_to_tokugawa_title;Send the Kanko Maru;;;;;;;;;;;;;
send_a_boat_to_tokugawa_desc;Japan is a rapidly progressing nation. It will be a great investment to send them a warship as a gift now and have good relations in future, though it will be costly. The Soembing, a barque built in 1850, would be the ideal gift.;;;;;;;;;;;;;
ecuador_colombia_treaty_title;Muñoz Vernaza-Suárez Treaty;;;;;;;;;;;;;
ecuador_colombia_treaty_desc;The time has come to put an end to our border dispute over Pasto and El Encanto.;;;;;;;;;;;;;
peru_colombia_treaty_title;Salomón-Lozano Treaty;;;;;;;;;;;;;
peru_colombia_treaty_desc;The time has come to put an end to our border dispute over Pasto and El Encanto.;;;;;;;;;;;;;
HOLMESLOC;Created by author Sir Arthur Conan Doyle, famed fictional detective Sherlock Holmes first appeared in print in 'A Study in Scarlet' in $YEAR$. His stories were usually told from the perspective of Dr. John H. Watson, who accompanies Holmes on his investigations.;;;;;;;;;;;;;
EMUWARLOC;The Emu War, also known as the Great Emu War, was a nuisance wildlife management military operation undertaken in Australia over the later part of 1932 to address public concern over the number of emus said to be running amok in the Campion district of Western Australia. The unsuccessful attempts to curb the population of emus, a large flightless bird indigenous to Australia, employed soldiers armed with Lewis gunsleading the media to adopt the name 'Emu War' when referring to the incident. While a number of the birds were killed, the emu population persisted and continued to cause crop destruction.;;;;;;;;;;;;;
MISERABLELOC;Les Misérables is a French historical novel by Victor Hugo, first published in 1862, that is considered one of the greatest novels of the 19th century. It elaborates upon the history of France, the architecture and urban design of Paris, politics, moral philosophy, antimonarchism, justice, religion, and the types and nature of romantic and familial love.;;;;;;;;;;;;;
DOROTHYLOC;The Wonderful Wizard of Oz is an American children's novel written by author L. Frank Baum and illustrated by W. W. Denslow, published by the George M. Hill Company in May 1900. In 1902, it will receive a Broadway musical adaptation as well as a iconic live-action film in 1939. The story chronicles the adventures of a young farm girl named Dorothy in the magical Land of Oz after she and her pet dog Toto are swept away from their home in Kansas by a cyclone. The book is one of the best-known stories in American literature and has been widely translated. The Library of Congress has declared it 'America's greatest and best-loved homegrown fairytale'. Its groundbreaking success, and that of the Broadway musical adapted from the novel led Baum to write thirteen additional Oz books that serve as official sequels to the first story.;;;;;;;;;;;;;
first_choshu_expedition_title;The First Choshu Expedition;;;;;;;;;;;;;
first_choshu_expedition_desc;After Choshu's attempt to capture the emperor and use him to topple the Shogunate, we must decisively act to punish them. However, declaring all-out war would be unwise as Satsuma may come to their aid. If we simply send them a demand that they turn over their leaders to us, we may yet avoid bloodshed.;;;;;;;;;;;;;
take_libya_title;Claim Libya;;;;;;;;;;;;;
take_libya_desc;The Ottoman Empire is at its weakest, and we lack African colonies. They will be unable to defend Libya if we demand it from them.;;;;;;;;;;;;;
nav_treaty_brz_vnz_title;A navigation treaty with Venezuela;;;;;;;;;;;;;
nav_treaty_brz_vnz_desc;Our northern border is undefined, with a growing dispute over the area around Forte Sao Joaquim. To resolve this dispute and end smuggling along the northern river, we should propose this treaty to Venezuela.;;;;;;;;;;;;;
clm_const_three_title;The Colombian Constitution of $YEAR$;;;;;;;;;;;;;
clm_const_three_desc;The Regeneracion movement has agitated for a conservative replacement for the constitution of Rionegro, calling for exile to Ecuador and Venezuela of liberal politicians, professionals public employees, censorship by the church of professors and public employees who favor secularism and making divorce illegal by passing marriage from a the civil sphere to that of the catholic church.;;;;;;;;;;;;;
clm_const_two_title;The Constitution of Rionegro;;;;;;;;;;;;;
clm_const_two_desc;There has been significant opposition to the last constitution, leading to support for a new one, transforming Colombia into a federation, guaranteeing individual freedoms of commerce, opinion, printing, teaching and association, abolishing the death penalty and consolidating the separation of church and state.;;;;;;;;;;;;;
clm_const_one_title;Constitution of the Granadina Confederation;;;;;;;;;;;;;
clm_const_one_desc;After a great deal of backlash against the last constitution, the conservatives are pushing for the imposition of confederalism, the organization, direction and maintenance of public forces, the creation of new states, and the arrangement of official weights, weights and measures.;;;;;;;;;;;;;
clm_const_zero_title;The Constitution of $YEAR$;;;;;;;;;;;;;
clm_const_zero_desc;Calls for reform have led to the proposition of a new liberal constitution to finally purge slavery from our lands, make ballots secret, seperate the legislative branches in twain and allow for freedom of press.;;;;;;;;;;;;;
clm_const_neg_one_title;The New Granada Constitution;;;;;;;;;;;;;
clm_const_neg_one_desc;The proposed new constitution extolls the control of the catholic clergy over Colombia and places the provinces under totalitarian rule of the central government. The election of the office of president, senators and representatives would be promulgated for a period of 4 years in each parish district.;;;;;;;;;;;;;
french_outside_italy_title;Organize Italy under strict French supervision.;;;;;;;;;;;;;
french_outside_italy_desc;Italy may be but a geographical expression, but it's an expression of strategic importance to $COUNTRY$. With the peninsula under our thumb, it might be time to reorganize the duchies and republics of Italy into more manageable kingdoms. We will also be able to take lands in Piedmont with a French minority, such as Savoia, Nice and Aosta in return for Parma and Modena, thereby appeasing expansionists.;;;;;;;;;;;;;
ironclad_commision;Ironclad Commission;;;;;;;;;;;;;
inherit_sgf;SGF Inherited;;;;;;;;;;;;;
austrian_destiny;Austrian destiny;;;;;;;;;;;;;
ai_demand_sigmaringen;Sigmaringen taken;;;;;;;;;;;;;
ems_dispatch_sent;Ems Dispatch sent;;;;;;;;;;;;;
finnish_assimilation;Finnish assimilation;;;;;;;;;;;;;
owed_steamers;Owed Steamers;;;;;;;;;;;;;
owed_artillery; Owed artillery;;;;;;;;;;;;;
owed_canned_food;Owed canned food;;;;;;;;;;;;;
i_have_gotten_bogota_event;Has gotten the Bogota event;;;;;;;;;;;;;
i_no_longer_have_cores_in_tonantins;No longer has cores in Tonantins;;;;;;;;;;;;;
equal_rule_title;Equal Rule;;;;;;;;;;;;;
equal_rule;Equal Rule;;;;;;;;;;;;;
equal_rule;Equal rule of all races will lead us to prosperity.;;;;;;;;;;;;;
declare_caliphate_title;Declare a Caliphate;;;;;;;;;;;;;
declare_caliphate_desc;Following our conquest of Meccah, many in our court think we should take this opportunity to declare ourselves a Caliphate, a protector of all muslims. However, the Ottomans have held this position for centuries, so no doubt they won't take fondly to us usurping the title.;;;;;;;;;;;;;
VNRCONGRESSLOC;President José Tadeo Monagas has been becoming ever friendlier with the liberals recently, which is why the conservative congress attempted to prosecute him with accusations of treason. This enraged the liberal mobs outside the congress who rushed in to Monagas' aid, thus granting the liberals power.;;;;;;;;;;;;;
arosemena_treaty_title;The Arosemena-Guzmán Treaty;;;;;;;;;;;;;
arosemena_treaty_desc;The time has come to settle our long and bitter border dispute with Venezuela over Inrída. The proposed treaty has already been approved by our foreign minister Justo Arosemena and Venezuelan foreign minister Antonio Guzmán, hence the name.;;;;;;;;;;;;;
FWTHREEDEATHLOC;Born in 1770 and crowned King of Prussia and Margrave of Brandenburg in 1797, Frederick William III died of a fever today at the age of 69. His steady and confident rule saw Prussia through the Napoleonic Wars and the collapse of the Holy Roman Empire. He was seen as a homely and down-to-earth ruler due to his purely love-motivated marriage to Luise of Mecklenburg-Strelitz, a member of the low nobility. Under his leadership, Prussia progressed from an absolutist, agrarian caste society to an enlightened and industrial nation.;;;;;;;;;;;;;
FWFOURDEATHLOC;Born in 1795 and crowned King of Prussia in 1840, Frederick William IV passed away today at the age of 65 due to a stroke. He had already suffered several strokes in 1857 that slurred his speech, signing the official regency of his brother William I and effectively resigning from power. Another stroke in 1859 paralyzed his left side, and a further one permanently robbed him of consciousness in Novemeber of 1860. His last stroke ended the suffering. His legacy includes his handling of the revolutions of 1848 and the many castles and monuments he had constructed.;;;;;;;;;;;;;
WILONEDEATHLOC;Born in 1797 and crowned King of Prussia in 1860 having held the regency for the incapacitated Frederick William IV since 1858, Wilhelm I left us today at the age of 90 after a short period of illness. His last words were 'Ich habe keine Zeit müde zu sein.' or 'I have no time to be tired.'. A man of great vigor and tenacity even in his high age, he survived 4 assassination attempts, one only because of the protection of his Pickelhaube. Deeply loved by the people for his dignity, friendliness and compassion, he will have the most memorials of any German monarch.;;;;;;;;;;;;;
FTHREEDEATHLOC;Born in 1831 and crowned King of Prussia in 1888, Frederick II only wore the crown for 99 days. A strong smoker, he had been suffering from hoarseness since 1887, when in May a carcinoma in his throat was identified. He initially refused being operated on and instead went to a mountain resort in Italy, hoping the climate would improve his condition. Meanwhile his doctors were hiding the fact that the carcinoma was increasingly growing. Shortly before William I's death, he could barely breathe, leading to a tracheotomy which robbed him of his voice. His 3-month reign was severely limited, his plans for limiting monarchical power and strengthening the constitution never coming to fruition. His last diary entry was: 'What's happening to me? I must get well again, I have so much to do!'.;;;;;;;;;;;;;
wilhelm_denkmal_title;Kaiser-Wilhelm-Nationaldenkmal;;;;;;;;;;;;;
wilhelm_denkmal_desc;A memorial has been proposed to our dear recently deceased monarch William I. It would consist of a massive bronze equestrian statue in front of the Berlin Palace on a raised base of polished red granite from Sweden surrounded by statues of lions, eagles and four Goddesses of Victory at the corners. The front the pedestal would bare the inscription 'William the Great, German Emperor, King of Prussia 1861-1888' and on the back 'in gratitude and true love, the German people.'.;;;;;;;;;;;;;
GUTPRESSLOC;Süße heilige Censur /n lass uns gehn auf deiner Spur /n Leite uns an deiner Hand /n Kinder gleich am Gängelband! /n Agitation for free press has been a key demand of the revolutionaries. The censored press has become increasingly reactionary, causing even more rebel anger.;;;;;;;;;;;;;
mar_chiquita_tourism_boom_title;The Mar Chiquita Tourism Boom;;;;;;;;;;;;;
mar_chiquita_tourism_boom_desc;The Mar Chiquita lake, known since colonial times, has never had any real population around it's coast, with the only nearby settlements being the town of Morteros. During recent times, a large quantity of immigrants have been establishing towns in the area, seeing large quantities of tourism, settlement, and even a small fishing industry.;;;;;;;;;;;;;
murwik_school;Marineschule Mürwik;;;;;;;;;;;;;
murwik_school_desc;The naval academy in Mürwik is an excellent place for our growing admirality corps.;;;;;;;;;;;;;
marine_murwik_title;Marineschule Mürwik;;;;;;;;;;;;;
marine_murwik_desc;State secretary of the Reichsmarineamt Admiral Alfred von Tirpitz has proposed we construct a new naval academy for officers in Mürwik-Flensburg since our growing need isn't covered by the old naval academy in Hamburg.;;;;;;;;;;;;;
form_provence_title;Form Provence;;;;;;;;;;;;;
form_provence_desc;The Provencial people have long been opressed, torn between Italy and France. We are the only country that truly gives them the rights they deserve. Therefore, we might as well gain legitimacy by proclaiming ourselves a provencial nation.;;;;;;;;;;;;;
unite_occitania_title;Unite Occitania;;;;;;;;;;;;;
unite_occitania_desc;The Occitan people have long been opressed by the French northerners. Our position of owning their core lands enables us to gain legitimacy by proclaiming ourselves an Occitan nation.;;;;;;;;;;;;;
gfm_imperial_college_title;Establish the Imperial College of Engineering;;;;;;;;;;;;;
gfm_imperial_college_desc;In support of Japan's rapid industrialisation it is time we establish an institution to help train young Japanese engineers.;;;;;;;;;;;;;
imperial_college_modifier;The Imperial College;;;;;;;;;;;;;
WILLIAMTWOINTERVIEW;In a recent interview of Kaiser Wilhelm II by the Daily Telegraph, our monarch had several emotional outbursts. These scandalous remarks have now been published, greatly diminishing our foreign relations. Especially the British were enraged by the quote: 'You English are mad, mad, mad as March hares. What has come over you that you are so completely given over to suspicions quite unworthy of a great nation? What more can I do than I have done?';;;;;;;;;;;;;
ABEISDEAD;Abraham Lincoln, the 16th president of the United States, was assassinated by well-known stage actor John Wilkes Booth, while attending the play Our American Cousin at Ford's Theater in Washington, D.C. Shot in the head as he watched the play, Lincoln died the following day at 7:22 AM, in the Petersen House opposite the theater. He was the first U.S. president to be assassinated, with his funeral and burial marking an extended period of national mourning.;;;;;;;;;;;;;
colonize_chatham_title;Colonize the Chatham Islands;;;;;;;;;;;;;
colonize_chatham_desc;The New Zealand Company has seen much success in settling and exploiting New Zealand. 650km East, another smaller island lies undisturbed: Rekohu, or the Chatham Islands. This is our chance for colonial glory!;;;;;;;;;;;;;
inherit_zaf;Za'faranlu is ready for integration;;;;;;;;;;;;;
remove_bismarck_title;Dropping the pilot;;;;;;;;;;;;;
remove_bismarck_desc;Von Bismarck, whilst a competent diplomat and administrator, has come to blows with Kaiser William II over foreign policy. His days as prime minister are numbered, we must pressure him to resign.;;;;;;;;;;;;;
wilhelminism;Wilhelminism;;;;;;;;;;;;;
wilhelminism_desc;Wilhelminism is the ideology proclaimed by William II: It's main tenets are the desire for a 'place in the sun' as a world power and rigidly conservative attitudes relying on the Prussian Junker landowners;;;;;;;;;;;;;
februar_erlasse_title;The Februarerlasse;;;;;;;;;;;;;
februar_erlasse_desc;To show his 'Social Monarchy', kaiser William II has made several decrees relating to workers' safety conditions. This follows a massive miner's strike in the Ruhrgebiet.;;;;;;;;;;;;;
BANCAROMANALOC;The Banca Romana, one of the six national banks authorised to issue currency has gone bankrupt. The scandal revealed much deep-rooted corruption in our government administration and discredited both ministers and parliamentarians, in particular those of the historical left, threatening the constitutional order. The crisis prompts a new banking law, tarnishes the prestige of the prime ministers Francesco Crispi and Giovanni Giolitti, the latter of whom has resigned.;;;;;;;;;;;;;
NAMAMUGILOC;Charles Lennox Richardson, a British merchant, has been killed by the armed retinue of Shimazu Hisamitsu, the regent of the Satsuma Domain, on a road in Namamugi near Kawasaki. Shimazu was heading in the opposite direction to Lennox and his party, who continued to ride along the side of the road without dismounting until they reached the main body of the procession, which occupied the entire width of the road. Richardson, leading his party rode close to Shimazu's procession and did not dismount despite being gestured repeatedly to do so. Richardson had disrespected Shimazu and was justifiably killed under the Kiri-sute gomen rule, the right of Samurai to kill any commoner who disrespects him.;;;;;;;;;;;;;
fort_ross_rename_title;Rename Fort Ross;;;;;;;;;;;;;
fort_ross_rename_desc;Fort Ross has been successfully brought under our control, hence we should name it according to our language instead of keeping an exonym.;;;;;;;;;;;;;
france_wadai_title;The Wadai War;;;;;;;;;;;;;
france_wadai_desc;If we are to link French West Africa and our holdings in the Congo, we must move establish a protectorate on the Wadai Empire to connect North and South. Its armies are unorganized and its monarchy unstable, so the war will be a piece of cake.;;;;;;;;;;;;;
french_bagirmi_title;Establish a protectorate over Baguirmi;;;;;;;;;;;;;
french_bagirmi_desc;Seeing the conquest of its neighbors, the Sultan of Baguirmi has sought to be peacefully protected by France to avoid bloodshed and be shielded from raiders.;;;;;;;;;;;;;
invade_nye_title;The Yemeni Expedition;;;;;;;;;;;;;
invade_nye_desc;Local Zaidi nobles who are irritated by the alleged incompetence of the Zaidi imam have invited us to depose him and integrate the Imamate of Zaydi into the Ottoman Empire.;;;;;;;;;;;;;
PROV2165;San Juan Bautista;San Juan Bautista;San Juan Bautista;;San Juan Bautista;;;;;;;;;
sudeten_treaty_title;The Sudeten Treaty;;;;;;;;;;;;;
sudeten_treaty_desc;Our recent acquisition of the Sudetenland has brought a dispute with the former owners and an unadministrable and undefendable panhandle into their territory. Our ministers propose we return said panhandle to them with a mutual agreement on those borders as final.;;;;;;;;;;;;;
form_bnf_title;Reunite with the Dutch;;;;;;;;;;;;;
form_bnf_desc;With our reconquest of the Netherlands, Lucien Jottrand, a politician, has proposed we reunite, this time under Belgian leadership. This way we can gain our legitimacy in our occupation of the Netherlands and justify an intervention to end the Dutch rump state in Indonesia.;;;;;;;;;;;;;
sanmen_treaty_port_title;The Sanmen Bay Treaty Port;;;;;;;;;;;;;
sanmen_treaty_port_desc;Sanmen Bay is very large, 390 square kilometers and 9 meters deep even at low tide, thus perfectly suitable for a harbor that can house dozens of ships at a time. The coast on both sides of the bay is very steep, making it very defensible. Up the Fuchun River, it gives excellent access to Qiandao Lake and further trading within China. The strategic advantages are self-evident.;;;;;;;;;;;;;
sanmen_treaty_port_ita_title;Demand Sanmen Bay;;;;;;;;;;;;;
