Key;English;French;German;Polish;Spanish;Italian;Swedish;Czech;Hungarian;Dutch;Portuguese;Russian;Finnish;
los_rurales_desc;Our rural militia, Los Rurales is guarding the rurla zones throughout our nation, improving the security of our farmers.;;;;;;;;;;;;;
EVTDESC4207002;The so-called Chatino Rebellion is a military conflict that has been started by the chatinos, indigenous peoples from Oaxaca whose lands were taken away by the government. After the governor of Oaxaca, Martín González, imposed a new law in Oaxaca in which taxes were increased, the chatinos of San Juan Quiahije, Tepenixtlahuaca, Panixtlahuaca, Teotepec and around Nopala organized to rebel against the government. This rebellion is also known as the War of the Pants since the chatinos identify their enemies with them, because chatinos wear worn fabric trousers.;;;;;;;;;;;;;
EVTDESC4207003;The new railroads in México allow for tequila to be easily distributed throughout the country, increasing the overall interest in tequila. Tequila Herradura is a new tequila destillery in Amatitán, Jalisco, founded by Félix López, who, alongside his wife Carmen Rosales, modernized the production of tequila: "La Herradura" tequila is made entirely out of agave. The name "Tequila Herradura" supposedly comes from the old Hacienda San José del Refugio in which López used to collect the horseshoes from his horses for their luck.;;;;;;;;;;;;;
EVTDESC4207004;An armed uprising against our new laws for the return of The 1824 Constitution has taken place throughout the nation. These rebels are against Valentín Gómez Farías and are trying to gain the support of Antonio López de Santa Anna for his popularity in the army. They recieved the name Polkos from an author as a lot of the generals of Miguel de la Peña Barragán used to dance polka, but the popular rumor is that they sympathized with the intentions of James K. Polk to not only take over the Texan territory but also the entire Mexican territory.;;;;;;;;;;;;;
finalize_the_expansion_title;Finalize the Expansion;;;;;;;;;;;;;
finalize_the_expansion_desc;With our claims against the Americans achieved, it's time to finally settle in and disolve the American claims in OUR land.;;;;;;;;;;;;;
special_administrative_zone;Special Administrative Zone;;;;;;;;;;;;;
special_administrative_zone_desc;This area in our country is considered as an special zone, with higher autonomy for the people living in it, but overall, still part of our active territory.;;;;;;;;;;;;;
EVTDESC4207005;Juan Bautista Valentín Alvarado y Vallejo, a Californio Ranchero has staged a coup against the governor of Alta California, captured the town of Monterey and declared the independence of the entirety of Alta California. This is in response to the removal of the Federal Constitution. We can either crush the rebels with the army, negotiate with them and give them autonomy, or let secede peacefully.;;;;;;;;;;;;;
mex_aranda_line_title;Claim the Aranda Line;;;;;;;;;;;;;
mex_aranda_line_desc;The Aranda Line was border proposal that Spain made to the United States at the end of the American War of Independence. Today, we can enforce this proposal and push the Americans further East, although this will greatly damage our international view.;;;;;;;;;;;;;
rename_arandaline_mex_title;Rename The Aranda Line Territories;;;;;;;;;;;;;
rename_arandaline_mex_desc;The territories claimed witin the Aranda Line are under our control now. It's time for these places to officially be given their $COUNTRY_ADJ$ exonyms.;;;;;;;;;;;;;
prov_american_integration;American Integration;;;;;;;;;;;;;
prov_american_integration_desc;If Mexicans outnumber the Americans in our newly annexed territories, our claim to the land will become indisputable.;;;;;;;;;;;;;
EVTDESC4207006;California as a nation was born due to our government being ultra-centralized at the time, this situation gave birth to several national identities such as the Texans, the Californios, Rio Grandenses, etcetera. Nowadays, we are a federation again, this means we are more appealing to the Californian eyes now, thus, unification is only natural.;;;;;;;;;;;;;
EVTDESC4207007;Our claims in the Mississippi River and its watershed give us a key strategic foothold: a small strip of land in mid-southern Canada. With the Canadians defeated and the Nutka Territory under our control, it's only fair if we ask for this land too and make our borders look more natural.;;;;;;;;;;;;;
integrate_arandaline_title;Integrate the Aranda Line Territories;;;;;;;;;;;;;
integrate_arandaline_desc;Our lands East of the Mississippi still hold American claims which we cannot remove. However, if we encourage immigration to these lands, we can achieve an acceptable amount of our people living on it, creating a decent foothold for us in the area.;;;;;;;;;;;;;
cleanup_hsa_cores_title;Cleanuo HSA CoresThis decision gives HSA cores on Hispanic American Cores that DO NOT have HSA cores for some reason.;;;;;;;;;;;;;
cleanup_hsa_cores_desc;This decision gives HSA cores on Hispanic American Cores that DO NOT have HSA cores for some reason.;;;;;;;;;;;;;
EVTDESC4207008;GFM has added a mechanic for straits that prevents passing them if both sides are controlled by a country you are at war with. For example, here's the Strait of Gibraltar. Movement from sea tile A to sea tile B and vice versa is impossible if both control tiles, Tetouan and Gibraltar, are controlled by an enemy country. These control tiles have a province modifier labeling them so that their function is clear. However, a side effect of this system is that ships will, unless the strait is blocked by enemy control tiles, not actually pass through the province in the middle of the strait, in this case B. So, if you want to place a navy to engage enemy fleets who want to pass through the strait in battle, do so in front of or behind the strait, in this case on tile A or C.;;;;;;;;;;;;;
strait_control_tile;§BStrait Control Tile§!;;;;;;;;;;;;;
EVTDESC4207009;Fundidora de Fierro y Acero de Monterrey, S.A. or La Maestranza is a new company for iron and steel works founded in Monterrey by industrial entrepreneur Vicente Ferrara, American and French businessmen Eugenio Kelly and León Signoret, and Spanish banker Antonio Basagoiti Arteta. The foundry is dedicated to the production of non-flat iron and steel items, such as rails, wire rod, corrugated rod, structures, railway wheels and others.;;;;;;;;;;;;;
fundidora;La Maestranza;;;;;;;;;;;;;
fundidora_desc;La Maestranza is the local iron and steel foundry in Monterrey, which is being attached to the regiomontano culture of the city. This foundry for the people represents progress, industrialization and a symbol of northern pride.;;;;;;;;;;;;;
colonization_law_mex;General Colonization Law;;;;;;;;;;;;;
colonization_law_mex_desc;The General Colonization Law allows foreigners to gain titles to any land they wish to settle that isn't within 20 leagues of the border of another country or within 10 leagues of the coast. Settlers are be exempt from taxes for ten years. Most individuals are restricted to a total of 11 square leagues of land. Of them, 6 square leagues can be for grazing animals, 1 square league can be irrigable land and 4 square leagues can be non-irrigable. New towns are given an additional 4 square leagues of land for public use. Empresarios are granted more personal land. For every 100 families settled, the empresario can receive 5 sitios of grazing land and 5 labores of farmland. The law doesn't require settlers to be Mexican citizens or catholic although citizens are given preference in land grants and federal laws prohibit all religions except Catholicism. Land grants are made from available public land.;;;;;;;;;;;;;
colonization_law_mex_prov;General Law of Colonization;;;;;;;;;;;;;
zollverein_mod;The Zollverein;;;;;;;;;;;;;
zollverein_mod_desc;Our customs union with our fellow german states makes our economy more versatile, allowing us to make the German states of Europe more and more united by making trade easier.;;;;;;;;;;;;;
zollverein_title;The Zollverein;;;;;;;;;;;;;
zollverein_desc;The Zollverein is a proposed organization of German States managing tariffs and economic policies in unison inspired by the creation of a variety of custom unions among some German states in 1818. The foundation of the Zollverein would be the first instance in history in which independent states form a full economic union without the simultaneous creation of a political federation or union. This could help our nation to assert our influence above the accepting German states and make the economy of the German people more dynamic.;;;;;;;;;;;;;
EVTDESC4207013;The Prussian government has approached us requesting our integration into the Zollverein, a customs union among the German states of Europe. The Zollverein is purely a customs union and does not involve in any way the sovereignty of the nation. However, it could also mean that we are kneeling to Prussian influence. What shall we do?;;;;;;;;;;;;;
integrate_chile_pbc_outside_title;Integrate Chile into the Peru-Bolivia;;;;;;;;;;;;;
integrate_chile_pbc_outside_desc;§RGain 2 infamy§! Chile is culturally similar to the Peru-Bolivians and the key to mastering control of the Andes mountains. Integrating them into the union will boost the strenght of the union and serve as a stronger ally for us in South America.;;;;;;;;;;;;;
soconusco_joins_mexico_title;Occupy Soconusco;;;;;;;;;;;;;
soconusco_joins_mexico_desc;§RGain 1 infamy§! Soconusco is home for many Mexicans which seem themselves under Guatemalan rule now. With losses in the North, General and President Santa Anna demands a military occupation of the Soconusco.;;;;;;;;;;;;;
EVTDESC4207014;Mexico, under General Santa Anna has occupied our territories in Soconusco and made a de facto annexation of the land. They demand Guatemalan forces to not intervene or it will be an act of war. It's time for us to decide if going to war against the Mexican government or simply allow them to occupy the land.;;;;;;;;;;;;;
EVTDESC4207015;The Definitive Restoration Plan has been proposed by the Conservative party in order to restore the monarchy in Mexico, and creating a constitutional empire following 4 important principles:\n1. The Mexican Nation is and will be independent, sovereign, and will take for the third time the heroic denomination of 'Imperio de Anáhuac'.\n2. The Empire's religion is and will be the apostolic and roman catholicism, without any public tolerance for other religions.\n3. The nation's form of government will be the one of a Constitutional Monarchy, hereditary, according to the habits or cultures and necessities of the country.\n4. The nation proclaims Agustín Jerónimo de Iturbide as the Emperor of Mexico. In case he does not accept, the crown will be for Antonio de Hero y Tamaríz. In case he also does not accept, the Emperor will be elected by the courts.\nWhat should we do? This may be an opportunity to appease the conservative opposition.;;;;;;;;;;;;;
EVTDESC4207016;'Slavery and caste distinctions are outlawed for ever, and may everyone be equal.' -José María Morelos y Pavón. Mexican officer during the Mexican War for Independence and national hero.\n\nThe Underground Railway to Mexico is a network that helps thousands of slaves to escape into Mexico. Because of our constitution, every slave that sets foot in Mexican soil is considered free, and for many afro-american slaves in the American South, escaping to Mexico has been their salvation. Although there have been considerably more slaves crossing the Mason-Dixon line, some others even escaping into Canada, with the USA declaring the Fugitive Slave Act, it's clear that nowehere in the United States are slaves safe and sound. An approximate of 10,000 slaves have escaped into Mexico throughout this period, data is unclear as some of the convoys tend to be spotted and some don't even make it into Mexico.;;;;;;;;;;;;;
EVTDESC4207017;The Tordesillas Treaty had several modifications throughout history, we could decide on these two options, one claiming the entirety of the Amazons and one for claiming only the Western part of the Amazons.;;;;;;;;;;;;;
EVTDESC4207018;With the General Colonization Law back, we can make sure to enforce these policies on every province in the North. This includes possible new lands.;;;;;;;;;;;;;
iturbide_house;House of Iturbide;;;;;;;;;;;;;
iturbide_house_desc;La Casa Real de Iturbide or the Royal House of Iturbide is a noble royal house founded by Agustin I on May 19th, 1822. Although dismissed in 1823, Iturbide did have an heir to the crown, and now his legacy is back in power on the Mexican Throne.;;;;;;;;;;;;;
EVTDESC4207019;Economic and territorial issues related to the land between the Nueces and Rio Grande rivers along with the Dawson Massacre give us the perfect pretext for sending an expedition into northern Mexico to conquer the land we claim. However, this may not go too well and would risk war with the Mexicans.;;;;;;;;;;;;;
EVTDESC4207020;Texas has launched an raid into the land it claims between the Nueces and Rio Grande rivers in the North of our country dubbed the 'Mier Expedition'. They apparently justify the attack as revenge for the 'Dawson Massacre', although its primary purpose is clearly gaining control of the land they claim. The expedition is rather small and its members undisciplined, so it should be a matter of ease to send them scurrying back across the border. The question is whether we should follow them, escalating the raid into a full-scale war...;;;;;;;;;;;;;
claim_panama_mex_title;Claim Panama;;;;;;;;;;;;;
porfiriato;Porfiriato;;;;;;;;;;;;;
porfiriato_desc;The Porfiriato is the name of the Diaz's presidency and it's effects in the nation. Our presidency is known for our focus on education, industrialization but also our aggressive approach towards natives and the poor in out country.;;;;;;;;;;;;;
claim_panama_mex_desc;§RGain 3 infamy§! With our holdings in Central America finally back into our control, we could even push a little further and conquer Panama, which was never formally under the Viceroyalty of New Spain, but shares cultural links with our Central American citizens. This will of course come with a heavy toll in our nation's image to the world.;;;;;;;;;;;;;
EVTDESC4207021;Hundreds of Irish, German and American have been deserting from the American forces to join the Mexican army, this is due to the constant punishments to catholic soldiers in the American army which, by religious meanings, were considered closer to Rome than Washington and thus, closer to the Mexican cause as they shared the same religion. They formed an accountable battalion to serve our army under general John O' Riley and took the name of Saint Patrick for their battalion's name. They have raised their flag, with a green background, the golden harp and the words "Erin Go Bragh" ("Ireland for ever") on the other side, there is Saint Patrick with the words "San Patricio" alongside various other flags which include harps, Saint Patrick and clovers.;;;;;;;;;;;;;
accept_caribeno_mex_title;Equality for the Caribeños;;;;;;;;;;;;;
accept_caribeno_mex_desc;During the Mexican War of Independence, the Mexican forces made their effort to liberate the island of Cuba among other Spanish possesions in the Caribbean. Now, with a strong Mexican foot in the Caribbean, we can integrate it's citizens further into our nation by granting them equality in our nation.;;;;;;;;;;;;;
accept_centralamerican_mex_title;Grant Equal Rights to the Central Americans;;;;;;;;;;;;;
accept_centralamerican_mex_desc;Mexicans and Central Americans share multiple cultural links due to proximity, indigenous and spanish heritage as well as being united in the First Mexican Empire. It's only fair to give the Central American equal rights just as the Mexicans and integrate them entirely in our nation.;;;;;;;;;;;;;
bad_mexican_army;Negligent and Incompetent Army;;;;;;;;;;;;;
bad_mexican_army_desc;The Mexican Army is hardly an organization. It's a weak and divided force, and not everyone is committed to the army. The army has no motivation, no training, no practice. On top of this, the army itself is divided between the permanent forces and the active militiamen. There's hardly any organization in the Mexican military.;;;;;;;;;;;;;
american_army_debuff;Demoralized War Spirit;;;;;;;;;;;;;
american_army_debuff_desc;The American public view in our unjustified war towards the Mexicans has a big impact in our war capacities. Soldiers deserting, some states hesitating into sending troops and with the fear that we might extend slavery even more cause a great demoralization in our army, but us Americans will not let this be our downfall.;;;;;;;;;;;;;
EVTDESC4207022;A linguist by the name of Joaquín García Icazbalceta has compiled a dictionary named 'El Vocabulario de Mexicanísmos' (The 'Mexicanisms' Vocabulary) published by his son Luís García Pimentel. The dictionary gathers a collection of 'mexicanisms', regionalisms of Mexican Spanish, determined by a certain criteria used to differentiate. For his work, García Icazbalceta used a several old and contemporary Spanish dictionaries to confirm potential mexicanisms.;;;;;;;;;;;;;
EVTDESC4207023;The San Andres Explosion is an accident that has recently occurred in San Andrés Chalchicomula, Puebla. In the accident, 1017 soldiers lost their life along with 25 officers, 40 civilian passerby and an unknown number of women and children accompanying the soldiers. The accident occurred when local authorities decided to move gunpowder and other gun supplies to the Guadalupe temple on the edge of the city so that the San Andrés cellar could supply the First Oaxaca Brigade. Some swear to have seen a spark coming out of the deposit of gunpowder which caused the explosion. The explosion occurred at 8:12PM. While the gunpowder store held its own due to its massive 3-meter-wide walls, nearby houses were instantly destroyed and many houses in a larger radius were sometimes often damaged.;;;;;;;;;;;;;
EVTDESC4207024;Although railroad concessions have been made since 1837, only now has the megaproject of building a railroad network to connect our capital to the port of Veracruz come to fruition. Going through various cities like Tulancingo, Querétaro, Córdoba, Jalapa and others, the railroad advances our nation's industry and makes the transportation of goods shipped in from overseas cheaper.;;;;;;;;;;;;;
religioneros_modifier;Religioneros;;;;;;;;;;;;;
EVTDESC4207025;In its recent decision to reform the constitution through a recent decree called the 'Leyes de Reforma', the federal government has decided on the official tolerance of protestantism while also prohibiting religious acts outside its temples. This reform has provoked a catholic uprising in Morelia, Zinacantepec, Hidalgo, León, Jonacatepec, Temascaltepec and Tejupilco. Thankfully, these revolts have failed to gather enough forces and can be suppressed quickly, but the populace is in turmoil, especially in conservative, catholic, rural communities.;;;;;;;;;;;;;
EVTDESC4207026;The newly established 'Orquesta Sinfónica Nacional' (National Symphony Orchestra) is the largest orchestral assembly in Mexico and the second of its kind in the American continent after the Boston Symphony Orchestra. It was originally founded as an orchestra for director Alfredo Bablot's music conservatory. Now, as the orchestra's reputation and influence have steadily increased, it has taken on the mantle of a national symphonic orchestra.;;;;;;;;;;;;;