Key;English;French;German;Polish;Spanish;Italian;Swedish;Czech;Hungarian;Dutch;Portuguese;Russian;Finnish;
general_colonization_law_title;Ley General de Colonización;;;;;;;;;;;;;
general_colonization_law_desc;The General Colonization Law was a political reform imposed in 1824. Its purpose was to attract immigrants to the least populated areas of our nation. This law was the main cause behind the immigration of American settlers to Texas. This law, although not officially discontinued, has been de facto out of commission due to recent conflicts. Now that we are at peace, we can instate the law once again to attract more immigrants.;;;;;;;;;;;;;
claim_oregon_territory_title;Claim the Oregon Country!;;;;;;;;;;;;;
claim_oregon_territory_desc;§RGain 5 infamy§! The Oregon Country territory was first explored by spanish explorers, which later discussed the territoryin the Nutka conventions. This is a solid claim for the Mexican state to take it back.;;;;;;;;;;;;;
claim_luisiana_title;Claim the Luisiana Territory!;;;;;;;;;;;;;
claim_luisiana_desc;§RGain 10 infamy§! On 1764, the formal adquisition of the Louisiana territory was announced by Spain and attached as a spanish gobernance to the general cuban capitany, which was part of the Viceroyalty of New Spain, later Mexico. This lays a solid claim on this vast territory for the mexican people.;;;;;;;;;;;;;
claim_florida_title;Claim the Florida Peninsula!;;;;;;;;;;;;;
claim_florida_desc;§RGain 5 infamy§! The Florida peninsula was the first important european settlement in North America, it formed part of the general cuban capitany, which was part of the Viceroyalty of New Spain just like the Louisiana Territory, this naturally also gives us claim on the territory and it's corridor.;;;;;;;;;;;;;
EVTNAME4206969;Shall we join $FROMCOUNTRY$?;;;;;;;;;;;;;
EVTDESC4206969;Not that $FROMCOUNTRY$ has formed, our role as spherelings is being questioned, as well as our sovereignty, $FROMCOUNTRY$ demands annexation. Now we have to choose between joining the union or staying independent, even if it might mean through war.;;;;;;;;;;;;;
EVTNAME4206970;$FROMCOUNTRY$ demands territory from us!;;;;;;;;;;;;;
EVTDESC4206970;The foreign minister from $FROMCOUNTRY$ has sent an ultimatum to our country, demanding us to give parts from our land that supposedly "belongs" to them. This is an insult to our sovereignty, but it may also mean war if we decline.;;;;;;;;;;;;;
hsa_capital_stuff_title;Select Capital;;;;;;;;;;;;;
hsa_capital_stuff_desc;We need to decide what our new capital will be.;;;;;;;;;;;;;
claim_patria_grande_title;Claim Patria Grande;;;;;;;;;;;;;
claim_patria_grande_desc;The dream of uniting all of the hispanic-american people's from the former spanish colonies in America into a single entity has been a concept most people often thought as impossible, but with our current position, we can take the first step.;;;;;;;;;;;;;
form_patria_grande_title;Form Patria Grande;;;;;;;;;;;;;
form_patria_grande_desc;Now we have all the land of Patria Grande under our control, it's time to celebrate the birth of our new nation!;;;;;;;;;;;;;
claim_tordesillas_title;Claim Tordesillas;;;;;;;;;;;;;
claim_tordesillas_desc;In 1494 the Iberian powers agreed to split the world in half between themselves, however, our interest is in how this treaty organized the portuguese claims in South America. The nation of Brazil which gained independence from Portugal went far away from the lines established in the treaty, it's in our right to claim those lands!;;;;;;;;;;;;;
claim_hsa_caribbean_title;Claim the Hispanic Caribbean!;;;;;;;;;;;;;
claim_hsa_caribbean_desc;The islands of Cuba, Puerto Rico and Hispaniola were under spanish control as colonies, it's our will to integrate these people's with our same language and religion to our nation!;;;;;;;;;;;;;
EVTDESC111025;Benito Pablo Juárez García became president as a result of the Reform War after a self-inflicted coup d'etát from Ignacio Comonfort. He was also the very first indigenous president, with zapotec as his first language. He was esential in keeping the Mexican Republic alive in the north during the Second French Intervention as well as implementing several educational reforms and substracting power from the church.;;;;;;;;;;;;;
EVTOPTA111025;Let's hope this brings peace and stability to our nation.;;;;;;;;;;;;;
benito_juarez;Benito Juárez;;;;;;;;;;;;;
benito_juarez_desc;President Juárez's presidency could be described by some as ilegitimate, but a fact is that his government marked early mexican history with more pros than cons, such as educational reforms.;;;;;;;;;;;;;
EVTNAME4206976;$FROMCOUNTRY$ calls for Hispanic American Union!;;;;;;;;;;;;;
EVTDESC4206976;$FROMCOUNTRY$ has called for a union of all hispanic american nations, but it is clear their current government would be ruling above all, even in a federation. An interesting idea indeed, but it threatens our sovereignty directly.;;;;;;;;;;;;;
EVTOPTA4206976;Interesting concept, but it is our government who should dominate!;;;;;;;;;;;;;
EVTNAME4206977;$FROMCOUNTRY$ demands annexation of hispanic vassals!;;;;;;;;;;;;;
EVTDESC4206977;As members of the comitee for hispanic union and direct vassals from the proclaimed Patria Grande, it is only natural for us to obey to our overlords and accept annexation into the new union.;;;;;;;;;;;;;
EVTDESC4206978;The rice riots of 1918 were a series of popular disturbances that erupted throughout Japan from July to September 1918, which brought about the collapse of the Terauchi Masatake administration. A precipitous rise in the price of rice caused extreme economic hardship, particularly in rural areas where rice was the main staple of life. Farmers, who compared the low prices they were receiving from government regulation with the high market prices, had tremendous hostility to rice merchants and government officials, who had allowed the consumer price to spiral out of control.;;;;;;;;;;;;;
EVTDESC4206979;Percy Harrison Fawcett was a was a british officer, cartographer, and explorer of South America. He disappeared in 1925 with his eldest son, Jack, and one of Jack's friends, Raleigh Rimell, during an expedition to find The Lost City of "Z".;;;;;;;;;;;;;
monterrey_boom_title;La Sultana del Norte;;;;;;;;;;;;;
monterrey_boom_desc;Founded in 1596, Monterrey was a small town often forgot about. After the Mexican-American War the town saw itself closer to the american frontier, serving as a popular meeting point for trade, business and even retirement for americans. The city experienced a colosal growth in population, economy, human development, everything. It even recieved a new nickname "The Sultan of the North".;;;;;;;;;;;;;
city_boom;Developing the City;;;;;;;;;;;;;
city_boom_desc;This city is experiencing rapid growth and development due to recent events.;;;;;;;;;;;;;
EVTDESC4206980;The Serbian Liberation Committee of the Sanjak of Niš, known as the Niš Committee, is a new Serbian national liberation movement based in Niš. Established in $YEAR$, its aim is not only targeting Niš and its immediate surroundings, but liberating the whole of the Sanjak of Niš including Leskovac, Pirot, Vranje, Breznica and Tran from the hands of the Ottoman Empire.;;;;;;;;;;;;;
EVTDESC4206981;Vasil Levski was a Bulgarian revolutionary who is, today, a national hero of Bulgaria. Dubbed the Apostle of Freedom, he ideologised and strategised a revolutionary movement to liberate Bulgaria from Ottoman rule. Levski founded the Internal Revolutionary Organisation, and sought to foment a nationwide uprising through a network of regional committees. Ottoman authorities, however, captured him at an inn near Lovech and executed him by hanging in Sofia.;;;;;;;;;;;;;
EVTDESC4206982;The Huaxinghui, commonly translated as the China Revival Society, has been founded by Huang Xing and Zhang Shizhao in $YEAR$ with the election of Huang Xing as its president, for the explicit political goal of overthrowing the Qing dynasty and establishing a democratic and free China. Many of its members are certain to become key figures of the democratic movement.;;;;;;;;;;;;;
EVTDESC111026;The implementation of secularist and anticlerical articles of the constitution has caused uproar among catholic conservatives. The so-called Cristeros have begun an armed conflict in central and western Mexico in response. The rebellion is in response to an executive decree by Mexican President Plutarco Elías Calles to draconianly enforce Article 130 of the Constitution, a decision known as Calles Law. Calles seeks to eliminate the power of the Catholic Church, its affiliated organizations and suppress popular religiosity.;;;;;;;;;;;;;
EVTDESC111027;Years have passed since the revolts from the decades of 1830 and 1840, one of which was the Republic of Rio Grande, which was succesfully supressed and went back under our control. Nowadays the sentiments of rebellion in the people living in the northeastern part of $COUNTRY$ are happy with the current mexican government, and willing to be loyal to it now.;;;;;;;;;;;;;
EVTDESC4206983;Our nation has been engulfed in a massive labor movement, dubbed the Great Railroad Strike of $YEAR$, commonly known as the Railway Shopmen's Strike. The strike has spread to railroad workers on a national scale. Launched on $DATE$ by seven of the sixteen railroad labor organizations in existence, the strike will surely not be short-lived. At least ten people, most of them strikers or family members, have been killed in sporadic outbreaks of violence. This collective action of some 400,000 workers is the largest railroad work stoppage we have ever witnessed.;;;;;;;;;;;;;
naples_portici_railway_title;The Naples–Portici Railway;;;;;;;;;;;;;
naples_portici_railway_desc;The Naples–Portici Railway proposed by the Bayard Company would be the first Italian railway line. It would connect the city of Naples to the nearby coastal town of Portici. The project is not ambitious, but we have to start somewhere.;;;;;;;;;;;;;
EVTDESC4206984;The Great Southwest railroad strike is a labor union strike involving more than 200,000 workers. On March 1, $YEAR$, railroad workers in five states struck against the Union Pacific and Missouri Pacific railroads, owned by Jay Gould. Reports inform that atleast 10 people have been killed.;;;;;;;;;;;;;
EVTDESC4206985;The Anthracite Coal Strike is a strike by the United Mine Workers of America in the anthracite coalfields of eastern Pennsylvania. Miners are striking for higher wages, shorter workdays, and the recognition of their union. The strike is threatening to shut down the winter fuel supply to major American cities.;;;;;;;;;;;;;
EVTDESC4206986;The Steel Strike of $YEAR$ is an attempt by the weakened Amalgamated Association of Iron, Steel and Tin Workers (AA) to organize the United States steel industry in the wake of World War I. The strike has begun on September 22, $YEAR$. The AA which formed in 1876. Is a union of skilled steel and ironworkers which is deeply committed to craft unionism. However, technological advances have slashed the number of skilled workers in both industries.;;;;;;;;;;;;;
EVTDESC4206987;A already heated demonstration in Warsaw's Castle Square on the anniversary of the Battle of Grochów took a turn for the worse today when the army fired into the crowd, killing five. Unrest is spreading quickly throughout Poland, and many advisors fear a general uprising may soon occur.;;;;;;;;;;;;;
EVTOPTA4206987;Refuse to grant any reforms.;;;;;;;;;;;;;
EVTOPTB4206987;Appoint a commission to 'look into' more autonomy for Poland.;;;;;;;;;;;;;
banamex_title;Banco Nacional de México;;;;;;;;;;;;;
banamex_desc;After the Second French intervention, Mexico recieved a major flux of direct foreign investment in it's banking sector, mostly of french origins. The idea of a great national bank for the mexican people has been popular from the poor ones, to the wealthy ones.;;;;;;;;;;;;;
banamex_modifier;Banamex;;;;;;;;;;;;;
banamex_modifier_desc;The national bank serves as an agent from the federal government in managing the national deblt; as well as payments from tax obligations. It also makes paper money emissions as well as granting financing and savings to the public.;;;;;;;;;;;;;
return_federalism_mex_1847_title;Return of the 1824 Constitution;;;;;;;;;;;;;
return_federalism_mex_1847_desc;Now that we are at war with the americans, the government has to act in order to pacify the country. we could re-instaurate the 1824 Constitution in order to bring federalism back and unite the country in these hard times...;;;;;;;;;;;;;
treaty_of_peace_and_friendship_spain_mex_title;Treaty of Peace and Friendship between Spain and Mexico;;;;;;;;;;;;;
treaty_of_peace_and_friendship_spain_mex_desc;With Spain in crisis due to the death of Ferdinand VII, and us struggling with rebellions, it would be of great benefit for both the both of us to oficially begin diplomatic relations as two separate, free and independent nations, friendly to each other. Spain has previously refused to recognize us, hoping to reconquer their former American holdings.;;;;;;;;;;;;;
EVTDESC4206988;Potosinian poet Francisco González Bocanegra wrote his version of a national anthem for Mexico. This anthem refered to famous battles, the defence of the nation, the virtues of it's people and the sacrifice it involves. It would be a great idea to take this lyrics and make them official, using the music made by the spanish musician Jaime Nunó.;;;;;;;;;;;;;
constancia_mexicana_title;La Constancia Mexicana;;;;;;;;;;;;;
constancia_mexicana_desc;La Constancia Mexicana is the proposed name for a fabric factory in the city of Puebla. It would be the very first mechanized factory in Mexico to use hydraulic energy.;;;;;;;;;;;;;
zacatecas_university_title;Universidad Autónoma de Zacatecas;;;;;;;;;;;;;
zacatecas_university_desc;The governor of Zacatecas, Francisco García Salinas, has proposed the foundation of a new university in the state. Education is one of the most important aspects of national development: it's only natural for us to support this proposal.;;;;;;;;;;;;;
new_university_mex;Regional University;;;;;;;;;;;;;
new_university_mex_desc;The presence of a regional university, supported by the government, boosts the general education of the region, at least at some extend.;;;;;;;;;;;;;
EVTDESC4206989;Following the Battle of Refugio and the Battle of Coleto, around 425 to 445 prisoners of war from the Texian Army of the Republic of Texas were executed by the Mexican Army in the town of Goliad, Texas. Among those killed were their commanders Colonel James Fannin and Lieutenant Colonel William Ward. The killing was carried out under orders from General and President of Mexico Antonio Lopez de Santa Anna. Despite the appeals for clemency by General José de Urrea, the massacre was carried out by Lieutenant Colonel José Nicolás de la Portilla.;;;;;;;;;;;;;
EVTDESC4206990;The Battle of the Alamo has been the result of a 13-day siege of the Alamo Mission, Mexican troops under President General Antonio López de Santa Anna reclaimed the Alamo Mission near San Antonio de Béxar, killing most of the Texians and Tejanos inside.;;;;;;;;;;;;;
teatro_nacional_title;El Gran Teatro Nacional;;;;;;;;;;;;;
teatro_nacional_desc;The architect Lorenzo de la Hidalga has proposed to us a plan for a national theater in Mexico City, with enough space for around 2,400 spectators. This project, if completed, would be the biggest and greatest architectual project in Mexican history.;;;;;;;;;;;;;
EVTDESC4206992;El Periquillo Sarniento ("The Mangy Parrot" in English), by Mexican author José Joaquín Fernández de Lizardi, is generally considered the first novel written and published in Latin America. El Periquillo was written in 1816, though due to government censorship the last of four volumes was not published until 1831. The novel has been continuously in print for more than twenty volumes total since then. Nowadays, it is an icon of Mexican literature and will probably continue being one for a significant amount of time.;;;;;;;;;;;;;
EVTDESC4206993;México a través de los siglos (Mexico across the centuries in english) is the title for an encyclopedia about the history of Mexico. The encyclopedia is being published by the editorials of Espasa y Compañía and J.Ballescá y Compañía. Advertised as a unique creation in it's genre, the book talks about the complete and general history of the social, political, religious, artistic, scientific, literary and military development in Mexico, from the pre-colonial era to this day.;;;;;;;;;;;;;
london_mexico_bank_title;Build The London Bank of Mexico and South America;;;;;;;;;;;;;
london_mexico_bank_desc;William Newbold and Robert Geddes arrived to Mexico with the intentions of building a branch of the London Bank of Mexico and South America. This could be a great opportunity to open our country's market and to slightly improve our diplomatic relations with the British.;;;;;;;;;;;;;
london_mex_bank;London Bank of Mexico and South America;;;;;;;;;;;;;
london_mex_bank_desc;The London Bank of Mexico and South America is the first foreign bank created in Mexico. Being a branch of the original London Bank of Mexico and South America in The United Kingdom, it certainly marks the involvement of the British in our economy.;;;;;;;;;;;;;
juarez_cdmx_hospital_title;Build the San Pablo Hospital;;;;;;;;;;;;;
juarez_cdmx_hospital_desc;Being at war requires medical aid for those who survive in the battlefield but might end up dying for their wounds, we need to build a new hospital in the mexican capital, granting it with the newest medical equipment, introducing surgery to the mexican medical service.;;;;;;;;;;;;;
mex_hospital_prov;Local Great Hospital;;;;;;;;;;;;;
mex_hospital_prov_desc;The presence of a great local hospital, supported by the government, boosts the life expectancy of the region, at least at some extend.;;;;;;;;;;;;;
EVTDESC4206994;Clemencia is a mexican novel written by the journalist, teacher and mexican politician Ignacio Manuel Altamirano. Set in Guadalajara during the Second French Intervention, the story revolves around a man romantically involved with a woman named Clemencia. The story is thightly related to the events of the war, with some parts of the story being suspected as autobiographic from the author.;;;;;;;;;;;;;
EVTDESC4206995;Grutas de Cacahuamilpa is an oil painting on canvas by Jean-Baptiste Louis, known as Barón Gros. The painting represents the Cacahuamilpa grottoes, in Guerrero. This naturalist piece shows a contrast between the small figures and the big rocky figures. The characters in the painting are potrayed sitting and standing, using stone formations as tables in which we can see their exploration equipment.;;;;;;;;;;;;;
EVTDESC4206996;$FROMCOUNTRY_ADJ$ ambassadors are proposing the signature of a treaty between $COUNTRY$ and $FROMCOUNTRY$ to set our differences apart. They will respect our overseas territories in Cuba, Puerto Rico, The Philippines and we will respect their sovereignty. Shall we accept?;;;;;;;;;;;;;
EVTDESC4206997;$FROMCOUNTRY$ has accepted the Definitive Treaty of Peace and Friendship between Spain and Mexico, this serves our country eliminating one possible hostile neighbor.;;;;;;;;;;;;;
EVTDESC4206998;$FROMCOUNTRY$ has rejected our treaty offer. Hostile relations between us will continue for the foreseeable future.;;;;;;;;;;;;;
hsa_mexico_reconquest_title;Reclaim the Mexican North!;;;;;;;;;;;;;
hsa_mexico_reconquest_desc;The time has come for the $COUNTRY_ADJ$ people to reclaim the land stolen from Mexico during the Mexican-American War. Our military's sheer might will provide us with an excellent chance at undoing the Treaty of Guadalupe-Hidalgo and restoring our old northern borders.;;;;;;;;;;;;;
rename_bcalifornia_mex_title;Rename Baja California;;;;;;;;;;;;;
rename_bcalifornia_mex_desc;Baja California is now firmly in $COUNTRY_ADJ$ hands, and should use $COUNTRY_ADJ$ names.;;;;;;;;;;;;;
rename_acalifornia_mex_title;Rename Alta California;;;;;;;;;;;;;
rename_acalifornia_mex_desc;Alta California is now firmly in $COUNTRY_ADJ$ hands, and should use $COUNTRY_ADJ$ names.;;;;;;;;;;;;;
rename_nmexico_mex_title;Rename Nuevo México;;;;;;;;;;;;;
rename_nmexico_mex_desc;Nuevo México is now firmly in $COUNTRY_ADJ$ hands, and should use $COUNTRY_ADJ$ names.;;;;;;;;;;;;;
rename_arizona_mex_title;Rename Arizona;;;;;;;;;;;;;
rename_arizona_mex_desc;Nuevo México is now firmly in $COUNTRY_ADJ$ hands, and should use $COUNTRY_ADJ$ names.;;;;;;;;;;;;;
rename_nevada_mex_title;Rename Nevada;;;;;;;;;;;;;
rename_nevada_mex_desc;Nevada is now firmly in $COUNTRY_ADJ$ hands, and should use $COUNTRY_ADJ$ names.;;;;;;;;;;;;;
rename_utah_mex_title;Rename Yuta;;;;;;;;;;;;;
rename_utah_mex_desc;Yuta is now firmly in $COUNTRY_ADJ$ hands, and should use $COUNTRY_ADJ$ names.;;;;;;;;;;;;;
rename_hispaniola_title;Rename Hispaniola;;;;;;;;;;;;;
rename_hispaniola_desc;Hispaniola is now firmly in $COUNTRY_ADJ$ hands, and should use $COUNTRY_ADJ$ names.;;;;;;;;;;;;;
enable_dismantlement_cb_testing_title;Enable Dismantlement Testing;;;;;;;;;;;;;
enable_dismantlement_cb_testing_desc;This enables the dismantlement casus belli from the beginning, for testing purposes only.;;;;;;;;;;;;;
small_research_bonus;Small Research Bonus;;;;;;;;;;;;;
small_research_bonus_desc;Slightly more research points at the beginning.;;;;;;;;;;;;;
big_research_bonus;Big Research Bonus;;;;;;;;;;;;;
big_research_bonus_desc;More research points at the beginning.;;;;;;;;;;;;;
puerto_vallarta_foundation_title;Found Puerto Vallarta;;;;;;;;;;;;;
puerto_vallarta_foundation_desc;The small town of Las Peñas has the necessity of a maritime port to transport the iron from the nearby mines. It is our oportunity to build another great pacific port as well as a new touristic destination for our nation.;;;;;;;;;;;;;
ny_wetdream_title;The New Yorkers Dream;;;;;;;;;;;;;
ny_wetdream_desc;§RGain 5 infamy§! With the United States losing it's industrial heartland, light shines upon the New Yorkian people. An opportunity for expansion opens. The goal: The states in which the Delaware River flows through. Pennsylvania and New Jersey have been rivals to the New Yorkers since the American nation identity was born, it's time to bring them down under New Yorkian yoke, with any help being welcome.;;;;;;;;;;;;;
create_pbc_outside_title;Create the Peru-Bolivian Confederation;;;;;;;;;;;;;
create_pbc_outside_desc;§RGain 2 infamy§! The nations in the Southern Andines were once reunited under one flag, but the flag burned as quickly as it was raised. Although the Peru-Bolivian Confederation was not the most stable country, it is not any better for it to separated into small and bickering countries. With $COUNTRY_ADJ$ supervision and support, the Confederation can be reborn.;;;;;;;;;;;;;
create_gran_colombia_outside_title;Unite Gran Colombia;;;;;;;;;;;;;
create_gran_colombia_outside_desc;§RGain 4 infamy§! The nations in the Northern Andines were once reunited under one flag, but the flag burned as quickly as it was raised. Although Gran Colombia was not the most stable country, it is not any better for it to separated into small and bickering countries. With $COUNTRY_ADJ$ supervision and support, the Union can be reborn.;;;;;;;;;;;;;
create_la_plata_outside_title;Unite La Plata;;;;;;;;;;;;;
create_la_plata_outside_desc;§RGain 6 infamy§! The nations in the Southern Cone were once reunited under one viceroyalty, but the flag burned as quickly as the libertadores expelled the spanish rule from America. It is not any better for it to separated into small and bickering countries. With $COUNTRY_ADJ$ supervision and support, the Union can be re-achieved.;;;;;;;;;;;;;
EVTDESC4206999;The city of El Paso del Norte served as an auxiliary capital for the republican government during the Second French Intervention in México. From here, Juárez lead the resistance against the french aggressors and managed to keep the repulic alive. The mayor of the city and the state governor have proposed to us that we rename the city to Ciudad Juárez to remember the hero who saved Mexico.;;;;;;;;;;;;;
mex_phl_integration_title;Integrate the Filipinos;;;;;;;;;;;;;
mex_phl_integration_desc;The Philippines and Mexico were both part of the Viceroyalty of New Spain at some point. Filipinos and Mexicans could be considered distant brothers. Now that we own the Philippines, it's time to integrate the Filipinos into our nation, even if some may disagree.;;;;;;;;;;;;;
vnr_creates_gco_title;Reform Gran Colombia;;;;;;;;;;;;;
vnr_creates_gco_desc;§RGain 5 infamy§! Now our glorious movement has been victorious, it's time to take the first step. Glory to the new federation of Gran Colombia!;;;;;;;;;;;;;
EVTDESC4207000;"Puente de Panzacola" is a new painting made by the landscape painter José María Velasco. In the painting, we can see the Panzacola bridge which is next to the Carmelita chapel. This place used to be called Teopanzolco in the pre-hispanic era. Details relating to daily life can be seen in form of the women washing clothes in the Magdalena River and the presence of a travelling horseman. The transit of water in the river is a metaphor for the passage of time.;;;;;;;;;;;;;
EVTDESC4207001;"El Cuerpo de Defensas Rurales" or "Los Rurales" has been formed by Benito Juárez to protect rural areas throughout our country. This is due to the results of the Reform War which made the countryside very dangerous due to outlaws raiding farms, assaulting carriages generally committing crimes. Los Rurales are a league of armed horsemen whose mission is to defend rural areas of throughout all of Mexico.\n\n§BThis event is intended to fire multiple times if you gain more core land with rural RGOs.;;;;;;;;;;;;;
los_rurales;Los Rurales;;;;;;;;;;;;;
