Key;English;French;German;Polish;Spanish;Italian;Swedish;Czech;Hungarian;Dutch;Portuguese;Russian;Finnish;
EVTNAME2037107;Cheating;;;;;;;;;;;;;
EVTDESC2037107;One of the other players has been cheating, $FROMCOUNTRY$ has a bonus he shouldn't have.;;;;;;;;;;;;;
EVTOPTA2037107;But since only hosts can change the saves you should probably find a new one;;;;;;;;;;;;;
EVTDESC36898_NEWS_LONG;Princess Alexandrina Victoria of House Hanover has ascended to the throne of The United Kingdom of Great Britain and Ireland as 'Queen Victoria'. Today a jubilant London crowd has escorted her to her residence in the newly built Buckingham Palace. People of all classes and creeds are delighted to see the new Monarch take her place as sovereign of the UK, and the Queen herself is reportedly looking forward to the tasks and challenges which accompany this onerous office. Her uncle, King William IV, will be greatly missed and fondly remembered by the British people.;;Prinzessin Alexandrina Victoria von Hannover hat den Thron des Vereinigten Königreichs von Großbritannien und Irland als 'Königin Victoria' bestiegen. Die jubelnde Londoner Menge eskortierte sie zu ihrer Residenz im neuen Buckingham Palace. Menschen aller Klassen und jeden Glaubens freuen sich über die neue Monarchin auf dem Thron Großbritanniens und die Königin sieht lt. Berichten den Aufgaben und Herausforderungen dieses ehrbaren Amtes freudig entgegen. Ihr Vater, König George III. wird sehr vermisst werden und dem britischen Volk in guter Erinnerung bleiben.;;;;;;;;;;;
EVTDESC36898_NEWS_MEDIUM;Princess Alexandrina Victoria has ascended the throne of The United Kingdom of Great Britain & Ireland. Today a jubilant crowd has escorted her to Buckingham Palace. People of all classes and creeds are delighted and she is looking forward to the tasks which accompany the office.;;Prinzessin Alexandrina Victoria hat den Thron des Vereinigten Königreichs von Großbritannien und Irland bestiegen. Eine jubelnde Menge begleitete sie heute zum Buckingham Palace. Sie sieht den Aufgaben dieses ehrbaren Amtes freudig entgegen.;;;;;;;;;;;
EVTDESC36898_NEWS_SHORT;Princess Victoria of House Hanover has ascended the throne of The United Kingdom of Great Britain & Ireland. People of all classes and creeds are delighted. King Willian IV will be greatly missed.;;Prinzessin Victoria von Hannover hat den Thron des Vereinigten Königreichs von Großbritannien und Irland bestiegen. Menschen aller Gruppierungen jubeln. König George wird vermisst werden.;;;;;;;;;;;
EVTNAME44360;Louis Riel Gains Public Notice;;;;;;;;;;;;;
EVTDESC44360;The noted Louis Riel has become a figurehead amongst his people. He calls for increased rights for Metis people across Canada. Unique among his number, the young Riel has quickly risen to prominence due to his eloquent speech, his education, and his earnest beliefs. Leaving him alive would be a great example of Canada's freedom of speech, but the government can pull a few strings in order to effect a policy beneficial to the status quo.;;;;;;;;;;;;;
EVTOPTA44360;We are a free country!;;;;;;;;;;;;;
EVTOPTB44360;Ensure his silence.;;;;;;;;;;;;;
EVTNAME44361;William McDougall;;;;;;;;;;;;;
EVTDESC44361;The Anglo-Canadian gentleman William McDougall has been proposed to be the Lieutenant Governor of the troubled Rupert's Land/North West Territories. His invaluable service and experience in the past puts him in a prime position to manage the territories, but some believe his anti-French and Anti-Metis policies to be too heavy-handed for the troubled territories.;;;;;;;;;;;;;
EVTOPTA44361;He will do nicely.;;;;;;;;;;;;;
EVTOPTB44361;The climate calls for a lighter hand.;;;;;;;;;;;;;
EVTNAME44362;The Red River Rebellion;;;;;;;;;;;;;
EVTDESC44362;The Red River Rebellion, later referred to as the First Riel Rebellion, was a rebellion that occurred soon after Canadian Confederation. The Canadian Government had installed an anti-French and anti-Metis lieutenant governor, William McDougall, in the newly-bought North West Territory. When McDougall sent surveyors into what would eventually be the province of Manitoba, the restless Metis inhabitants sent their own delegation to intercept these surveyors and proclaimed the existence of the Metis Confederation. Historically, they established a provisional government in the new Confederation, which the Canadian Government tolerated while the situation developed.;;;;;;;;;;;;;
EVTOPTA44362;Let the situation develop.;;;;;;;;;;;;;
EVTOPTB44362;Acknowledge their sovereignty.;;;;;;;;;;;;;
EVTNAME44363;The Execution of Thomas Scott;;;;;;;;;;;;;
EVTDESC44363;Thomas Scott, an Orangeman of Irish descent, was executed by Louis Riel during the Red River Rebellion for conspiring against the self-proclaimed Metis provisional government. Historically, Riel wished to show the world that the Metis peoples were demanding to be taken seriously, but the Canadian Government viewed this action by Riel as a step too far and outfitted the Wolseley Expedition to quell the Rebellion. After conflicts with the Metis, Louis Riel was captured and exiled to the United States. With this, the Red River Rebellion was crushed, but the Metis and Native peoples would not soon forget this act.;;;;;;;;;;;;;
EVTOPTA44363;Our hands are tied. Outfit the expedition!;;;;;;;;;;;;;
EVTNAME44364;The Return of Louis Riel and the Second Riel Rebellion;;;;;;;;;;;;;
EVTDESC44364;After being elected to parliament three times in absentia after his exile, Louis Riel returned to Canada in 1884. Using increased Metis and Native cohesion, the ailing Riel managed to assemble a loose coalition to reattempt his rebellion for Metis independence in 1885. Historically, this rebellion was a failure due to internal strife amongst Rebellion leaders, an increasingly ill and megalomaniacal Riel, and increased Federal cohesion. Canada was no longer a fledgling nation just getting on its feet, and quickly moved to wipe out Riel and his rebellion.;;;;;;;;;;;;;
EVTOPTA44364;We have no time for this. Let them be independent.;;;;;;;;;;;;;
EVTOPTB44364;A United Canada is best for all.;;;;;;;;;;;;;
EVTOPTC44364;The Metis have gone too far and must know their place.;;;;;;;;;;;;;
EVTNAME44365;Louis Riel's Fate;;;;;;;;;;;;;
EVTDESC44365;Historically, after surrendering to the Canadian forces after his failed rebellion, the Canadian Government held a quick trial in what can be best called a kangaroo court. Held in a hostile city before a jury of purely Anglo-Canadian Protestant jurors, the Catholic Metis Louis Riel was found guilty of treason and sentenced to death after a trial lasting only five days. Louis Riel refused to plea insanity, instead delivering two heartfelt speeches to the court, and later asserting to his lawyer that "Life, without the dignity of an intelligent being, is not worth having." Louis Riel was hanged on the 18th of September, 1885. His rebellions and the spirit of the Metis would largely die with him, but in due time he would be remembered as a folk hero amongst White, Metis, and Native people alike.;;;;;;;;;;;;;
EVTOPTA44365;Remerciez, Madame Forget.;;;;;;;;;;;;;
EVTOPTB44365;He is old and infirm. Let him die in peace.;;;;;;;;;;;;;
EVTNAME44366;Quebec Presses for Release!;;;;;;;;;;;;;
EVTDESC44366;Following the precedent of a recent secession, the Quebecois peoples are pressing the Canadian Government for independence!;;;;;;;;;;;;;
EVTOPTA44366;50.6 percent!;;;;;;;;;;;;;
EVTOPTB44366;Foutez le camp!;;;;;;;;;;;;;
EVTNAME44367;Columbia Presses for Release!;;;;;;;;;;;;;
EVTDESC44367;Following the precedent of a recent secession, the Columbian peoples are pressing the Canadian Government for independence!;;;;;;;;;;;;;
EVTOPTA44367;The Confederation must remain united!;;;;;;;;;;;;;
EVTOPTB44367;Get out of my sight!;;;;;;;;;;;;;
EVTNAME44368;The Metis Confederation is beyond our grasp!;;;;;;;;;;;;;
EVTDESC44368;The Metis Confederation has managed to gain independence, either through rebellion or external means.;;;;;;;;;;;;;
EVTOPTA44368;This does not bode well.;;;;;;;;;;;;;
EVTNAME44369;Quebec is beyond our grasp!;;;;;;;;;;;;;
EVTDESC44369;Quebec has managed to gain independence, either through rebellion or external means.;;;;;;;;;;;;;
EVTNAME44370;Columbia is beyond our grasp!;;;;;;;;;;;;;
EVTDESC44370;Columbia has managed to gain independence, either through rebellion or external means.;;;;;;;;;;;;;
EVTNAME203770;Slavery Continues In Our Nation;;;;;;;;;;;;;
EVTDESC203770;Slavery, that ever-controversial policy, has continued on in our nation.;;;;;;;;;;;;;
EVTOPTA203770;Profit, ho!;;;;;;;;;;;;;
EVTNAME203800;Anti-Terrorism Coalition Proposed;;;;;;;;;;;;;
EVTDESC203800;A group of wealthy capitalists from your country has come to you after the recent attack on the Statue of Liberty. They propose an anti-terrorism coalition force to protect our country from any possible terrorist attacks. They are all upstanding capitalists and the core of your economy, but they also propose a different option: technological progress and ethical flexibility. All you need is to give your executive order.;;;;;;;;;;;;;
EVTOPTA203800;U... UNATCO?;;;;;;;;;;;;;
EVTOPTB203800;No, Savage.;;;;;;;;;;;;;
EVTOPTC203800;I never asked for this.;;;;;;;;;;;;;
EVTNAME203801;Secret Conspiracies uncovered!;;;;;;;;;;;;;
EVTDESC203801;After poking around with your secret police, it has come to your attention that the anti-terrorism force is just a front for a conspiracy of capitalists who seek to take control of the nation and the world. When you confront them, they very tactfully invite you to join their secret organization and gain a place in the world, so long as you help them with their devious plans.;;;;;;;;;;;;;
EVTOPTA203801;Why contain it?;;;;;;;;;;;;;
EVTOPTB203801;They seem desperate. Keep an eye on them.;;;;;;;;;;;;;
EVTOPTC203801;A bunch of pretentious old men running the world.;;;;;;;;;;;;;
EVTNAME203802;The Conspiracy reaches fruition;;;;;;;;;;;;;
EVTDESC203802;We've had to endure much, but soon there will be order again. A new age! Aquinas spoke of the mythical city on the hill. Soon that city will be a reality.;;;;;;;;;;;;;
EVTOPTA203802;We will be crowned its kings.;;;;;;;;;;;;;
EVTOPTB203802;No, better than kings. Gods.;;;;;;;;;;;;;
EVTNAME203771;Fascist Takeover of Government!;;;;;;;;;;;;;
EVTDESC203771;\n\nThe recently-elected Fascist party has used its position of superiority to maneuver around the country. Their plans have come to fruition, and through legalistic means, they have turned the country into a dictatorship headed by their Leader. Although they promise to bring the nation to a new era of prosperity and strength, their brutal methods and recent disregard for the law is seen by some as an affront to humanity itself. The supporters of the left will, of course, be mad about this, but only time will tell whether or not this new regime will be successful.;;;;;;;;;;;;;
EVTOPTA203771;The world moves on.;;;;;;;;;;;;;
EVTNAME203772;Communist Takeover of Government!;;;;;;;;;;;;;
EVTDESC203772;\n\nThe recently-elected Communist party has used its position of superiority to maneuver around the country. Their plans have come to fruition, and through legalistic means, they have turned the country into a dictatorship nominally headed by their council. Although they promise to bring the nation to a new era of equality and prosperity for all, their inflammatory rhetoric and alleged deeds is seen by some as an affront to individualism and humanity itself. The supporters of the right will, of course, be mad about this, but only time will tell whether or not this new regime will be successful.;;;;;;;;;;;;;
EVTNAME203700;The Republican Coup;;;;;;;;;;;;;
EVTDESC203700;The end of slavery had resulted in an explicit shift of support to republicanism by rich and powerful coffee farmers who held great political, economic and social power in the country. To avert a republican backlash, the government adopted a series of credit and military policies and reforms to appease the land owners. The measures made by the government alarmed the civilian republicans and the Positivists in the military corps. They saw that it would undercut support for their own aims, and were emboldened to further action. For them, it had become a case of "now or never". Although there was no desire in Brazil among the majority of the population to change the form of government, the civilian republicans began pressuring the Positivist officers to overthrow the monarchy. The Positivists launched a coup d'etat and tried to institute a republic on November 15, 1889. During the whole ordeal Pedro II showed no emotion, as if unconcerned about the outcome. He only commented:;;;;;;;;;;;;;
EVTOPTA203700;If this is how it is, I will retire.;;;;;;;;;;;;;
EVTOPTB203700;Crush the rebellion!;;;;;;;;;;;;;
EVTNAME203701;The Golden Law;;;;;;;;;;;;;
EVTDESC203701;The Lei Áurea (Golden Law) was sanctioned by Isabel, Imperial Princess of Brazil, who was regent at the time while her father, Emperor Dom Pedro II, was in Europe. It was signed on May 13, 1888 and was the law that abolished slavery in Brazil. It had only two articles. The succinctness of the law was intended to make clear that there were no conditions of any kind to the freeing of all slaves. Aside from the activities of abolitionists, there were a number of reasons for the signing of the law: slavery was no longer profitable, as the wages of European immigrants, whose working conditions were poor, cost less than the upkeep of slaves, and the decline in the arrival of new slaves - Brazil was the last country in the Western world to abolish slavery. The Brazilian government was also under pressure from Britain, who sought to end the slave trade in order to expand production in its own colonies.;;;;;;;;;;;;;
EVTOPTA203701;From this date, slavery is declared abolished in Brazil.;;;;;;;;;;;;;
EVTOPTB203701;Free slaves? Revoke this useless law!;;;;;;;;;;;;;
EVTNAME203702;The Rise of Getulio Vargas;;;;;;;;;;;;;
EVTDESC203702;Vargas was born in the state of Rio Grande do Sul, into a family prominent in state politics. By 1922 he had risen rapidly in state politics and was elected to the National Congress, in which he served for four years. In 1926 Vargas became minister of finance in the Cabinet of President Washington Luís Pereira de Sousa, a post he retained until his election as governor of Rio Grande do Sul in 1928. From his position as state governor, Vargas campaigned unsuccessfully as reform candidate for the presidency of Brazil in 1930. While appearing to accept defeat, Vargas in October of that year led the revolution, organized by his friends, that overthrew the oligarchical republic. For the next 15 years Vargas assumed largely dictatorial powers, ruling most of that time without a congress. He held sole power as provisional president from Nov. 3, 1930, until July 17, 1934, when he was elected president by the constituent assembly.;;;;;;;;;;;;;
EVTOPTA203702;Today you are with the government. Tomorrow you will be the government.;;;;;;;;;;;;;
EVTOPTB203702;The coffee policy will prevail! Suppress this outrageous coup!;;;;;;;;;;;;;
EVTNAME203775;The Fascist Movement Arises;;;;;;;;;;;;;
EVTDESC203775;\n\nA group of far-right extremists has begun to organize within the country, and their pamphlets have recently become a thorn in our regime's side. Their views are on the fringe, and their methods of spreading their views have been clandestine so far. They preach order, unity, strength, homogenous cultures, and national exceptionalism, and while this may please the common man, they are still a potential threat to our regime.;;;;;;;;;;;;;
EVTOPTA203775;Keep an eye on them. Do you have the latest stock ticker?;;;;;;;;;;;;;
EVTNAME203776;The Fascists Go Openly Public;;;;;;;;;;;;;
EVTDESC203776;\n\nThanks to increased awareness of the fascist platform amongst our people, the fascist organizations within our nation have begun to go public in their demonstrations. They have begun to stalk the streets, intimidating others, and have attacked their communist ideological enemies. This roughhousing may or may not be good for the nation, but we can't explicitly support one side or the other without changing our regime or committing political suicide.;;;;;;;;;;;;;
EVTOPTA203776;Let the fascists play at politics a while.;;;;;;;;;;;;;
EVTOPTB203776;We must keep order in the streets!;;;;;;;;;;;;;
EVTNAME203777;Fascist Rallies!;;;;;;;;;;;;;
EVTDESC203777;\n\nThe local fascist organizations have largely united and created a series of awareness-raising and strength-flaunting rallies. These rallies have the amazing ability to inspire people and convert them to the fascist cause, and even have the potential to influence our very government. The communist and liberal groups within our nation have been pestering us to make a decision about these extremists, and this is surely a defining moment in our nation's politics.;;;;;;;;;;;;;
EVTOPTA203777;I have to admit that their slogans are appealing.;;;;;;;;;;;;;
EVTOPTB203777;This has gone on for far too long. This must end.;;;;;;;;;;;;;
EVTNAME203805;Greater Denmark rises!;;;;;;;;;;;;;
EVTDESC203805;Given our glorious status in the world, nationalists within our country have taken it upon themselves to encourage a rebirth of our ancestral Viking roots. While this has great traction amongst the already nationalistic, government intervention could give this movement the push needed to become a truly national movement. This will, of course, worry the rest of the world, but what are they compared to the glory and might of our nation?;;;;;;;;;;;;;
EVTOPTA203805;FOR DENMARK!;;;;;;;;;;;;;
EVTOPTB203805;What? No.;;;;;;;;;;;;;
EVTNAME66689;Lucky Nations;;;;;;;;;;;;;
EVTDESC66689;Sometimes in this world, nations seem to be blessed by God in certain periods. Their leaders are brilliant, their people are hardy, they excel in warfare, produce amazing works of culture, and their economies boom. Do we live in such a world? If Lucky Nations are turned on, ten random westernized nations who are not Great Powers and five random non-western nations will be given special bonuses that will enable them to shake up the status quo of the world by giving them significant bonuses.;;;;;;;;;;;;;
EVTOPTA66689;Turn Lucky Nations On.;;;;;;;;;;;;;
EVTOPTB66689;Keep Lucky Nations Off.;;;;;;;;;;;;;
EVTNAME38510;Moving the Capital;;;;;;;;;;;;;
EVTDESC38510;In 1840 Said bin Sultan, Sultan of Muscat and Oman moved his capital from the Omani city of Muscat to the economic heart of his empire, the African island of Zanzibar in a successful attempt to increase the amount of products he could export from the region.;;;;;;;;;;;;;
EVTNAME11200;Setting the Borders of Italy;;;;;;;;;;;;;
EVTDESC11200;With our Union of Italy at hand, how should we draw the border between Austria and Italy?;;;;;;;;;;;;;
EVTNAME11201;Petition Austria for Savoie?;;;;;;;;;;;;;
EVTDESC11201;We have been notified of Austria's intent to unify the Italian peninsula. Should we ask them to cede control of Savoie, which possesses as sizable French population?;;;;;;;;;;;;;
EVTNAME11202;French Claims in Italy;;;;;;;;;;;;;
EVTDESC11202;France has expressed interest in our union of Italy. They ask for us to return to them Savoie, which has a sizable French population.;;;;;;;;;;;;;
EVTNAME11203;French Claims in Italy;;;;;;;;;;;;;
EVTDESC11203;France has expressed interest in our union of Italy. They ask for us to return to them Savoie, which has a sizable French population. In addition, they also demand Piemonte. If we accede to both of these demands our union of Italy will surely been seen as flimsy excuse to divide Italy between us.;;;;;;;;;;;;;
EVTNAME11204;The Papal Question;;;;;;;;;;;;;
EVTDESC11204;How should we deal with the Papal State in our union of Italy?;;;;;;;;;;;;;
EVTNAME11205;Freedom or Subservience?;;;;;;;;;;;;;
EVTDESC11205;Should we establish our union of Italy as a truly independent state, or as a puppet to the Austrian crown? Granting them independence would help legitimize the actions we've taken so far, both in the eyes of the other greater powers and in the eyes of the Italian people.;;;;;;;;;;;;;
EVTNAME11210;Setting the Borders of Italy;;;;;;;;;;;;;
EVTDESC11210;With our Union of Italy at hand, how should we draw the border between Austria and Italy?;;;;;;;;;;;;;
EVTNAME11211;Ask France to recognize Austrian claims?;;;;;;;;;;;;;
EVTDESC11211;We have been notified of France's intent to unify the Italian peninsula. Should we ask them to recognize our claims to the lands of Lombardy-Venice?;;;;;;;;;;;;;
EVTNAME11212;Austrian Claims in Italy;;;;;;;;;;;;;
EVTDESC11212;Austria has expressed interest in our union of Italy. They ask for us to recognize their claim to Lombardy-Venice.;;;;;;;;;;;;;
EVTNAME11213;Austrian Claims in Italy;;;;;;;;;;;;;
EVTDESC11213;France has recognized only our claims to Venice. They have dismissed our claim to Lombardia.;;;;;;;;;;;;;
EVTNAME11214;Austrian Claims in Italy;;;;;;;;;;;;;
EVTDESC11214;France has recognized our claim to Lombardy-Venice.;;;;;;;;;;;;;
EVTNAME11240;South Italy;;;;;;;;;;;;;
EVTDESC11240;Cultural differences separate the southern half of the peninsula from the north. Should Italy be split along these lines? Two Sicilies might govern the region better.;;;;;;;;;;;;;
EVTNAME9988800;$FROMCOUNTRY$'s bid for independence;;;;;;;;;;;;;
EVTDESC9988800;A diplomat from $FROMCOUNTRY$ has approached us with a request to free $FROMCOUNTRY$ from their oppressive masters. We could attempt a coup that would install an independent government in $FROMCOUNTRY$, and $FROMCOUNTRY$ would gladly join us in our war.;;;;;;;;;;;;;
EVTNAME9988801;$FROMCOUNTRY$ accepts offer.;;;;;;;;;;;;;
EVTDESC9988801;$FROMCOUNTRY$ has agreed to our offer, we must now join them in their war.;;;;;;;;;;;;;
EVTNAME9988802;$FROMCOUNTRY$ declines offer.;;;;;;;;;;;;;
EVTDESC9988802;$FROMCOUNTRY$ has refused our offer.;;;;;;;;;;;;;
EVTNAME9988803;$FROMCOUNTRY$ has altered the deal.;;;;;;;;;;;;;
EVTDESC9988803;$FROMCOUNTRY$ has accepted us under their protection. Unfortunately it seems we will still be a pawn to be shuffled between the greater powers.;;;;;;;;;;;;;
EVTNAME188112;General Volkhovski's Landing;;;;;;;;;;;;;
EVTDESC188112;One of the first events of the restarted Caucasian War was General Volkhovski's landing in Circassia, near the modern town of Sochi. Originally plagued by setbacks due to Circassian resistance and poor organization, it was a good start and learning experience for the Russian armed forces.;;;;;;;;;;;;;
EVTOPTA188112;Let the landing commence!;;;;;;;;;;;;;
EVTOPTB188112;Let us bide our time.;;;;;;;;;;;;;
EVTNAME188113;Conflict at Tepsue;;;;;;;;;;;;;
EVTDESC188113;The Russians made a large landing at Tepsue soon after the Caucasian War restarted, intending to crush opposition in western Circassia after their successful occupation of eastern Circassia a decade earlier. Historically, the occupation was a reasonable success, yet casualties were very high on both sides and neither belligerent forgot the lessons learned during this conflict.;;;;;;;;;;;;;
EVTOPTA188113;We will crush the Circassians!;;;;;;;;;;;;;
EVTOPTB188113;We will do what is necessary and no more.;;;;;;;;;;;;;
EVTNAME188114;Colonel Obshevski Gives A Speech;;;;;;;;;;;;;
EVTDESC188114;Historically, soon after the conflict at Tepsue, Russian Colonel Obshevski gave a speech to the local Circassian population about the advantages of being under Russian control and the virtues of not rebelling against their Russian masters. The Circassians did not forget it, to the detriment of the Russians.;;;;;;;;;;;;;
EVTOPTA188114;Let the Circassians know who is boss.;;;;;;;;;;;;;
EVTOPTB188114;Is this really necessary?;;;;;;;;;;;;;
EVTNAME188115;Imam Shamil Gains Power;;;;;;;;;;;;;
EVTDESC188115;Imam Shamil has gained power and become the Imam of the Caucasian Imamate! His frequent attacks against Russian outposts throughout the region are worrisome, and a decision is needed as to what to do with his resistance movement.;;;;;;;;;;;;;
EVTOPTA188115;Let us fight back!;;;;;;;;;;;;;
EVTOPTB188115;Attempt to pull out of our weaker outposts.;;;;;;;;;;;;;
EVTNAME188116;United Circassian Offensive;;;;;;;;;;;;;
EVTDESC188116;The Circassian resistance has managed to take out our minor outposts through sneak attacks, seizing supply depots, and what can be termed guerrilla warfare. Although we have suffered much, our ready state of alertness prevented an overly large massacre of our people and has prevented our major outposts and fortresses from being overrun by the Circassians.;;;;;;;;;;;;;
EVTOPTA188116;They will pay for this!;;;;;;;;;;;;;
EVTNAME188117;United Circassian Offensive;;;;;;;;;;;;;
EVTDESC188117;Although we attempted to pull out of our weaker outposts, the Circassians have ambushed our traveling forces and seized our supplies. Our larger outposts relied on these smaller reinforcements to properly defend, and we have suffered some losses in our major military and civilian centers. This perceived weakness has given the Circassians free reign to massacre our people, and has shamed us on a world scale.;;;;;;;;;;;;;
EVTOPTA188117;An unfortunate event, to be sure.;;;;;;;;;;;;;
EVTNAME188118;Imam Shamil Offers a Truce;;;;;;;;;;;;;
EVTDESC188118;Imam Shamil has stated his demands regarding the Caucasus: independence, a return to the status quo of 1834, or death! Historically, the Imam and the Tsar agreed to a peace treaty, which was respected for almost a decade, as it worked out to both sides' advantage. The Russians had been humiliated at the Caucasus, but the Circassians could not hold out much longer.;;;;;;;;;;;;;
EVTOPTA188118;They will pay in time.;;;;;;;;;;;;;
EVTOPTB188118;Let them go, we have failed in the Caucasus.;;;;;;;;;;;;;
EVTNAME188119;Unrest in the Caucasus;;;;;;;;;;;;;
