Key;English;French;German;Polish;Spanish;Italian;Swedish;Czech;Hungarian;Dutch;Portuguese;Russian;Finnish;
EVTDESC1904191413;Picture showing the Panama Canal Company Liquidation Court Trial in $CAPITAL$, $COUNTRY$. The Panama Canal Scandal was a corruption affair that broke out in $COUNTRY$ in $YEAR$. Close to a billion francs were lost when the government took bribes to keep quiet about the Panama Canal Company's financial troubles, in what is regarded as the largest monetary corruption scandal of the 19th century.;Picture showing the Panama Canal Company Liquidation Court Trial in Paris, France. The Panama Canal Scandal was a corruption affair that broke out in the French Third Republic in 1892. Close to a billion francs were lost when the government took bribes to keep quiet about the Panama Canal Company's financial troubles, in what is regarded as the largest monetary corruption scandal of the 19th century.;Picture showing the Panama Canal Company Liquidation Court Trial in Paris, France. The Panama Canal Scandal was a corruption affair that broke out in the French Third Republic in 1892. Close to a billion francs were lost when the government took bribes to keep quiet about the Panama Canal Company's financial troubles, in what is regarded as the largest monetary corruption scandal of the 19th century.;Picture showing the Panama Canal Company Liquidation Court Trial in Paris, France. The Panama Canal Scandal was a corruption affair that broke out in the French Third Republic in 1892. Close to a billion francs were lost when the government took bribes to keep quiet about the Panama Canal Company's financial troubles, in what is regarded as the largest monetary corruption scandal of the 19th century.;Picture showing the Panama Canal Company Liquidation Court Trial in Paris, France. The Panama Canal Scandal was a corruption affair that broke out in the French Third Republic in 1892. Close to a billion francs were lost when the government took bribes to keep quiet about the Panama Canal Company's financial troubles, in what is regarded as the largest monetary corruption scandal of the 19th century.;Picture showing the Panama Canal Company Liquidation Court Trial in Paris, France. The Panama Canal Scandal was a corruption affair that broke out in the French Third Republic in 1892. Close to a billion francs were lost when the government took bribes to keep quiet about the Panama Canal Company's financial troubles, in what is regarded as the largest monetary corruption scandal of the 19th century.;Picture showing the Panama Canal Company Liquidation Court Trial in Paris, France. The Panama Canal Scandal was a corruption affair that broke out in the French Third Republic in 1892. Close to a billion francs were lost when the government took bribes to keep quiet about the Panama Canal Company's financial troubles, in what is regarded as the largest monetary corruption scandal of the 19th century.;Picture showing the Panama Canal Company Liquidation Court Trial in Paris, France. The Panama Canal Scandal was a corruption affair that broke out in the French Third Republic in 1892. Close to a billion francs were lost when the government took bribes to keep quiet about the Panama Canal Company's financial troubles, in what is regarded as the largest monetary corruption scandal of the 19th century.;;;;;;
EVTDESC1904191414;A caricature on the scandal. It reads: "Few new toys this year: we're liquidating everything that remains of the stock of jack-in-the-boxes that say: Papa, -Nana, -Mama, -Panama." A concluding picture of the bankruptcy was formed in $YEAR$. Some 800,000 $COUNTRY_ADJ$ people, including 15,000 single women, had signed for stocks, bonds and founder shares from the Panama Canal Company, to the sum of - the then considerable amount of - approximately 1,8 billion gold Francs.;A caricature on the scandal. It reads: "Few new toys this year: we're liquidating everything that remains of the stock of jack-in-the-boxes that say: Papa, -Nana, -Mama, -Panama." A concluding picture of the bankruptcy was formed in 1892. Some 800,000 French people, including 15,000 single women, had signed for stocks, bonds and founder shares from the Panama Canal Company, to the sum of - the then considerable amount of - approximately 1,8 billion gold Francs.;A caricature on the scandal. It reads: "Few new toys this year: we're liquidating everything that remains of the stock of jack-in-the-boxes that say: Papa, -Nana, -Mama, -Panama." A concluding picture of the bankruptcy was formed in 1892. Some 800,000 French people, including 15,000 single women, had signed for stocks, bonds and founder shares from the Panama Canal Company, to the sum of - the then considerable amount of - approximately 1,8 billion gold Francs.;A caricature on the scandal. It reads: "Few new toys this year: we're liquidating everything that remains of the stock of jack-in-the-boxes that say: Papa, -Nana, -Mama, -Panama." A concluding picture of the bankruptcy was formed in 1892. Some 800,000 French people, including 15,000 single women, had signed for stocks, bonds and founder shares from the Panama Canal Company, to the sum of - the then considerable amount of - approximately 1,8 billion gold Francs.;A caricature on the scandal. It reads: "Few new toys this year: we're liquidating everything that remains of the stock of jack-in-the-boxes that say: Papa, -Nana, -Mama, -Panama." A concluding picture of the bankruptcy was formed in 1892. Some 800,000 French people, including 15,000 single women, had signed for stocks, bonds and founder shares from the Panama Canal Company, to the sum of - the then considerable amount of - approximately 1,8 billion gold Francs.;A caricature on the scandal. It reads: "Few new toys this year: we're liquidating everything that remains of the stock of jack-in-the-boxes that say: Papa, -Nana, -Mama, -Panama." A concluding picture of the bankruptcy was formed in 1892. Some 800,000 French people, including 15,000 single women, had signed for stocks, bonds and founder shares from the Panama Canal Company, to the sum of - the then considerable amount of - approximately 1,8 billion gold Francs.;A caricature on the scandal. It reads: "Few new toys this year: we're liquidating everything that remains of the stock of jack-in-the-boxes that say: Papa, -Nana, -Mama, -Panama." A concluding picture of the bankruptcy was formed in 1892. Some 800,000 French people, including 15,000 single women, had signed for stocks, bonds and founder shares from the Panama Canal Company, to the sum of - the then considerable amount of - approximately 1,8 billion gold Francs.;A caricature on the scandal. It reads: "Few new toys this year: we're liquidating everything that remains of the stock of jack-in-the-boxes that say: Papa, -Nana, -Mama, -Panama." A concluding picture of the bankruptcy was formed in 1892. Some 800,000 French people, including 15,000 single women, had signed for stocks, bonds and founder shares from the Panama Canal Company, to the sum of - the then considerable amount of - approximately 1,8 billion gold Francs.;;;;;;
EVTDESC1904191415;In $YEAR$ the $COUNTRY_ADJ$ sold their equipment to the Americans for 40 million dollars.;In 1902 the French sold their equipment to the Americans for 40 million dollars.;In 1902 the French sold their equipment to the Americans for 40 million dollars.;In 1902 the French sold their equipment to the Americans for 40 million dollars.;In 1902 the French sold their equipment to the Americans for 40 million dollars.;In 1902 the French sold their equipment to the Americans for 40 million dollars.;In 1902 the French sold their equipment to the Americans for 40 million dollars.;In 1902 the French sold their equipment to the Americans for 40 million dollars.;;;;;;
EVTDESC19049144;In order to build a canal across the Panama isthmus, we will need to come to an agreement with the nation that controls it.;;;;;;;;;;;;;
EVTDESC9049145;$FROMCOUNTRY$ has approached us with a treaty to build a canal across the Panama isthmus. While this would have economic benefits for $COUNTRY$, the $FROMCOUNTRY_ADJ$ negotiators have been incredibly aggressive-- and the terms they offer are almost insulting. If we agree, it will anger the $COUNTRY_ADJ$ people and embarrass our country. Is this the act of a close ally?;;;;;;;;;;;;;
EVTDESC9049147;$COUNTRY_ADJ$ negotiators are outraged. The $FROMCOUNTRY_ADJ$ government has refused our terms, fair though they were. Some have suggested this is hardly the act of an $COUNTRY_ADJ$ ally, and that $FROMCOUNTRY$ can no longer be trusted. They say we should aid the local rebels in the isthmus in setting up an independent government of their own, and that such a nation would be far more agreeable.;;;;;;;;;;;;;
EVTDESC9049148;$FROMCOUNTRY$ has dealt us a treacherous hand. Believing the Panamanians will be far more agreeable to their treaty, they have prompted the rebels to declare independence from $COUNTRY$ and actively prevented us from crushing them. Some believe we should give in and repair relations with the $FROMCOUNTRY_ADJ$ while we can. Still others say we should fight!;;;;;;;;;;;;;
EVTNAME992221;Massacres of Badr Khan;;;;;;;;;;;;;
EVTDESC992221;Badr Khan Bey, A Hakkari Kurdish Amir, combined with other Kurdish forces led by Nurallah, attacked the Christian Assyrians, intending to burn, kill, destroy, and, if possible, exterminate the Assyrians race from the mountains.;;;;;;;;;;;;;
EVT180000DESC;\n\nNow that the war is over, the question arises whether or not we should allow the slaves we enlisted during the war to remain free, or send them back to work on the plantations. We made a promise to secure their freedom, but wars are a fickle thing, and some sacrifices have to be made for the betterment of the nation.;;;;;;;;;;;;;
EVT181000DESC;\n\nWith the dawn of the twentieth century, slavery in modern countries is fading away due to the prevalence of industry. A mere thirty years ago $COUNTRY_ADJ$ strength may have been founded on the backs of our slaves, but as tractors, automobiles, trains and other machines are making industry replace old mass labor, we have to make a distinct choice. Do we organize our slave economy, favoring it over industrial strength, or do we join the onward march of progress and free ourselves from the shackles that a slave society has forced us into? Just as fifty years ago a great house was divided, so now our $COUNTRY$ must become all one thing, or all the other: strong in the grip of slavery, or strong in the freedom of progress.;;;;;;;;;;;;;
EVT183000DESC;\n\nThe Confederate States of America are offering us our colony of Haiti, to be controlled by our government. This would allow us a stronger presence in the Caribbean and the New World as a whole, so should we accept this offer?;;;;;;;;;;;;;
EVT185000DESC;\n\nWithout a leader, the Atlantic Slave Trade cannot continue. We have no choice but to end our trade, and focus on slavery within the bounds of our own country and neighboring nations - or, should we have the power, we can lead the slave trade in place of the fools who dismantled it.;;;;;;;;;;;;;
EVT186000DESC;\n\nOnce we may have made slavery the centerpiece of our country, but those times have passed. The time of mass labor and the slave trade is over, and we now sever all our attachments to those detestable pieces of our history.;;;;;;;;;;;;;
EVTNAME187000;The Apache Wars;;;;;;;;;;;;;
EVTDESC187000;\n\nIn order to expand $COUNTRY_ADJ$ hegemony in the former Native American provinces, there has to be some amount of integration or assimilation. One group of tribes has taken to this suggestion violently, and have begun organizing an uprising.;;;;;;;;;;;;;
EVTOPTA187000;\n\nLet them charge against Dixie steel!;;;;;;;;;;;;;
EVTDESC187100;\n\nThe leader of the Apache rebels, Geronimo, has been imprisoned and the spirit of his people has been broken. Now, nothing prevents us from settling these lands we have claimed.;;;;;;;;;;;;;
EVT187610DESC;\n\nIn 1854, Elisha Otis demonstrated the first passenger-carrying elevator, an invention which would prove invaluable in the construction of modern, multi-story buildings.;;;;;;;;;;;;;
EVT187620DESC;\n\nLegendary showman (and scam artist) P.T. Barnum opened his first three-ring circus in 1871, beginning a circus craze that would last well into the 20th century. Of course, most of the excitement and the curios he displayed were all fake, but that was all part of the show - and the money.;;;;;;;;;;;;;
EVT187630DESC;\n\nIn order to improve the efficiency of railroads in our nation, we have adopted a system of standard time to prevent any confusion between train stations on the length of our railroad networks. We will name the center of these time-zones "Confederate Standard Time", and we believe that this idea will be well-liked by similarly minded countries.;;;;;;;;;;;;;
EVT187640DESC;\n\nPioneered by men like Scott Joplin and Ernest Hogan, ragtime is a genre of music that began amongst African-Americans in the South. Afterwards, it became widely known and widely played on piano, and had a key role in popularizing new music recording methods and the later genre of jazz.;;;;;;;;;;;;;
EVT187650DESC;\n\nBlues music, like ragtime and jazz before it, was first played and composed by Afro-American musicians of the American South. While jazz enjoyed popularity amongst blacks and whites in the 1920s and 1930s, blues was mostly relegated to black listeners until after the Second World War. It was arguably formed as a musical genre in 1912 with the publishing of Hart Wand's "Dallas Blues", but has its roots in traditional slave songs of the 19th century. Most famously, blues later became the bedrock for the most popular musical sensation of them all: rock n' roll.;;;;;;;;;;;;;
EVT187660DESC;\n\nThough the North always was the industrial center of America, in the Deep South there was the city of New Orleans, always full of sound and lights. The epitome of southern prosperity, New Orleans was a hub of trade and immigration, and at its peak was the third largest city in the entire United States.;;;;;;;;;;;;;
EVT187670DESC;\n\nThe city of New Orleans always has had an association with the festival of Mardi Gras, a Christian cultural celebration taking place prior to the season of Lent brought to the area by French Catholic colonists. Normally it is meant to be just a single day of celebrations, but in New Orleans the colorful and energetic Mardi Gras can last for several days more. Mardi Gras was recognized as an official state holiday of Louisiana in 1875.;;;;;;;;;;;;;
EVT187680DESC;\n\nPoliteness, etiquette, and the warm comforts of home: these define the ideal of Southern hospitality, and is a major characterizing point of our nation. People are expected to respect their neighbors and use polite terms even when addressing strangers. Some feel that this is an act put on to cover up Southern flaws such as slavery and widespread poverty, but its nature can be traced back to the traditional Christian moral influence on the Southern states before secession. Regardless, it's made a good mark on our country, and we're proud of it.;;;;;;;;;;;;;
EVT187690DESC;\n\nFounded in 1871, the National Rifle Association was originally a set of shooting clubs organized to improve the marksmanship of American soldiers. After the Civil War, it was noted that few shots fired actually hit their targets, so improved drill was in order. These shooting clubs improved skill with firearms, and contributed to the military as a whole moving away from the classic style of rank and file warfare, which put focus on volume of fire rather than accuracy. Within a few decades, firearms and marksmanship became a proud part of the country's culture.;;;;;;;;;;;;;
EVT188000DESC;\n\nAn infestation of boll weevils has struck our cotton crops in $PROVINCENAME$! Farmers are fearing that our supply of cotton won't last with this insect terrorizing our provinces, and many are suggesting that we abandon cotton to focus on different trade goods. Should we follow their advice, or try to recover the cotton?;;;;;;;;;;;;;
EVT188100DESC;\n\nRising up from the south, the boll weevil is a dreadful little insect that seems to have little interest in anything but planting its eggs in cotton flowers and buds. Regardless of its origins, it poses a major threat to our cotton industry, and must be stopped at all costs. For the time being, though, we fear that there may be no direct way of containing the insect, not on a large scale.;;;;;;;;;;;;;
EVT187700DESC;\n\nOne hundred years ago, the Thirteen Colonies organized and succeeded in their rebellion against their British colonial oppressors, forming the United States of America on the 4th of July, 1776. We have seen this country through fire and water, but by God, we will never let America fall. Now unto the end of time, the United States will be a shining name in the pages of history, a beacon of freedom and democracy in the world. Today of all days, we truly should be proud.;;;;;;;;;;;;;
EVT187710DESC;\n\nTraveling along the western trails into California, a $COUNTRY_ADJ$ wagon group known as the Donner party has been discovered... or, at least, what is left of it. The people of the Donner party were stranded in the wilderness for so long that their minds were lost, and they succumbed to cannibalism and other savage acts. With the revelation of this news, the world can now see the mortifying reality of life in Western America.;;;;;;;;;;;;;
EVT187720DESC;\n\nDue to recent heavy rainfall and the negligence of a local construction company, a dam on the Little Conemaugh River has burst, flooding and decimating Johnstown, Pennsylvania. The cleanup costs will be higher than any disaster we've seen before, and more importantly, the people will soon be looking for someone to place the blame upon. The government could step in and take care of everything in place of the local industrialists and clubs that may have caused the flood, or we can require that the groups pay from their own pockets to fix their mistake.;;;;;;;;;;;;;
EVT187730DESC;\n\nThough our war with the Confederate States is far from over, it isn't going either poorly or well. However, that doesn't stop the war from being a contentious issue, and in New York most notably the people have staged an uprising against the local government, demanding that the strict conscription practices in place for the war be rescinded. We're in the middle of a war, so we have to choose some way to deal with them, without sacrificing our draft. The question is, are these riots worth putting down, or are our other concerns far greater?;;;;;;;;;;;;;
EVT187740DESC;\n\nJames Madison, fourth president of the United States of America and the man titled "The Father of the Constitution", was a key figure in the founding of our nation. On June 28th, 1836, he passed away - much to the chagrin of those close to him, who wished for him to follow the "tradition" of Thomas Jefferson and John Adams, who both died on Independence Day.;;;;;;;;;;;;;
EVT187750DESC;\n\nThe Gulf of Mexico is no stranger to extreme wind and rain, but in 1900, a certain hurricane blew away any old records. The storm decimated Galveston, Texas, and reached the Canadian Maritimes before dissipating completely. In cost of lives and money, few other disasters can compare, and this is an especially heavy blow for the coastal areas of the Gulf and Texas.;;;;;;;;;;;;;
EVT187760DESC;\n\nA man going by the name of Doctor Howard Henry Holmes has been apprehended and executed after murdering up to two-hundred people after the last $COUNTRY_ADJ$ World's Fair. According to police reports, he built up a so-called "Murder Castle" in $CAPITAL$, killing primarily young women that he lured to his lair. Using legitimate medical contacts he was able to dispose of the bodies, and for a long time he remained far out of suspicion. Only after leaving the city due to economic troubles did Holmes end up being captured, as a result of alleged horse theft. Afterwards the truth of his grisly crimes came to light, and he was sentenced to death.;;;;;;;;;;;;;
MISSFLOOD1DESC;\n\nAlong the Missouri River and the Upper Mississippi, heavy rainfall and inadequate preparation have led to major floods, the worst in decades. With the increasing population of $COUNTRY$ especially in the areas around the Mississippi and its tributaries, it is becoming increasingly important to develop a set of levees and ditches to prevent high water from wiping out whole towns.;;;;;;;;;;;;;
MISSFLOOD2DESC;\n\nNot long after last decade's horrendous floods along the Upper Mississippi, there has been another year of rain and subsequent floods along the very same Mississippi River. We had prepared and made sure riverside towns were prepared for any threat of flooding, but this time the floods hit mostly rural and new colonial towns, which hadn't yet managed to create systems of levees to cope with rising water levels.;;;;;;;;;;;;;
MISSFLOOD3DESC;\n\nThe worst floods yet have hit many of our cities, no matter how high we built the levees nor how low and long we dug the ditches. New Orleans, shining gem of Louisiana, has been dealt a heavy blow, along with cities and regions all along the mighty Mississippi River. Even modern technology could not save us, and so we can only pray that something of this scale never happens again to our country.;;;;;;;;;;;;;
EVT189000DESC;\n\nOur country is now a slave state of $FROMCOUNTRY$, and our government now functions solely to operate the mechanisms of the vile slave trade. There is no freedom left in $COUNTRY$.;;;;;;;;;;;;;
EVTOPTA189000;Liberty has been stolen from our country.;;;;;;;;;;;;;
BOLLWEEVILMENACE;A New Menace;;;;;;;;;;;;;
EVTOPTA188100;We are not faced with the lesser of two weevils, that is for sure.;;;;;;;;;;;;;
MISSFLOODTITLE;Flood on the Mississippi!;;;;;;;;;;;;;
EVTOPTA187750;No man could have prepared for this disaster.;;;;;;;;;;;;;
EVTOPTA187770;We should have prepared better for this! What happened to those levees?;;;;;;;;;;;;;
EVTOPTA187774;...the levees weren't strong enough.;;;;;;;;;;;;;
EVTOPTA187778;I don't think we could have done anything to stop this.;;;;;;;;;;;;;
WEEVILINFEST;Boll Weevil Infestation;;;;;;;;;;;;;
WFMURDER;Murder at the World's Fair!;;;;;;;;;;;;;
EVTOPTA187760;What kind of twisted madman would do this?;;;;;;;;;;;;;
GALVESTONTITLE;Galveston Hurricane;;;;;;;;;;;;;
FATHERCONSTITUTION;Father of the Constitution;;;;;;;;;;;;;
EVTOPTA187740;This man helped make our nation, and he will be missed.;;;;;;;;;;;;;
NYDRAFTRIOTS;New York Draft Riots;;;;;;;;;;;;;
EVTOPTA187730;We cannot afford to have soldiers put down these riots. Let them end themselves.;;;;;;;;;;;;;
EVTOPTB187730;Send in the troops. We won't let civilians ruin our war effort.;;;;;;;;;;;;;
JTOWNFLOOD;The Johnstown Flood;;;;;;;;;;;;;
EVTOPTA187720;Force the dam owners to pay reparations to any survivors.;;;;;;;;;;;;;
EVTOPTB187720;Hold the dam owners blameless. This was an act of God, not a liability.;;;;;;;;;;;;;
DONNERPARTY;The Donner Party;;;;;;;;;;;;;
EVTOPTA187710;How could such horror occur in our country?;;;;;;;;;;;;;
USACENTENNIAL;One Hundred Years of Freedom!;;;;;;;;;;;;;
EVTOPTA187700;Let all Americans celebrate our nation's centennial!;;;;;;;;;;;;;
NRATITLE;The National Rifle Association;;;;;;;;;;;;;
EVTOPTA187690;These clubs will help the sorry state of our army, and win us prestige.;;;;;;;;;;;;;
EVTOPTB187690;Shut them down. If they want arms, let them become soldiers.;;;;;;;;;;;;;
SOUTHERNHSPT;Southern Hospitality;;;;;;;;;;;;;
EVTOPTA187680;Treat all our own people like family.;;;;;;;;;;;;;
EVTOPTB187680;Open our arms to our neighbors, and bring them into our home.;;;;;;;;;;;;;
MARDIGRASTITLE;Festival of Mardi Gras;;;;;;;;;;;;;
EVTOPTA187670;Let the good times roll!;;;;;;;;;;;;;
NEWORLEANSTITLE;La Nouvelle-Orleans;;;;;;;;;;;;;
EVTOPTA187665;Long live the jewel of the South!;;;;;;;;;;;;;
BLUESBABYBLUES;Rise of the Blues;;;;;;;;;;;;;
EVTOPTA187650;Nothing important will come out of this new music.;;;;;;;;;;;;;
RAGTIMENJAZZ;Ragtime and Jazz;;;;;;;;;;;;;
EVTOPTA187640;What kind of backwards noise is this?;;;;;;;;;;;;;
CENTRALTIMEZONE;Standard Time Adopted;;;;;;;;;;;;;
EVTOPTA187630;I reckon this just came right on time.;;;;;;;;;;;;;
BARNUMPARTYTENT;The Greatest Show on Earth!;;;;;;;;;;;;;
EVTOPTA187620;There's a sucker born every minute.;;;;;;;;;;;;;
ELISHAELEVATOR;The Passenger Elevator!;;;;;;;;;;;;;
EVTOPTA187610;Raise me up, Elisha!;;;;;;;;;;;;;
GERONIMOSURRENDER;Geronimo Surrenders;;;;;;;;;;;;;
EVTOPTA187100;Finally, we can assimilate them into the Confederate nation.;;;;;;;;;;;;;
SLAVETRADEEND;An End to the Slave Trade;;;;;;;;;;;;;
EVTDESC186500;\n\nWith the abolition of slavery in our country, so too will we block the world's slave trade.;;;;;;;;;;;;;
EVTOPTA186500;Slavery is no more, for the good of our nation! §GLose 4 infamy§W;;;;;;;;;;;;;
MASSLABOUROVER;Mass Labor Outlawed;;;;;;;;;;;;;
EVTOPTA186000;We've moved past our old barbaric ways once and for all. §GLose 1 infamy§W;;;;;;;;;;;;;
SLAVETRADEOVERBAD;Slave Trade Ended!;;;;;;;;;;;;;
EVTOPTA185000;This is an outrage!;;;;;;;;;;;;;
NEWSLAVES;Newly Arrived Slaves;;;;;;;;;;;;;
NEWSLAVESOPTION;Get them to work.;;;;;;;;;;;;;
EVTDESC187800;\n\nBritain, the world's leader in enforcing the end of slavery, has caused us a bitter defeat. They have used their political force to demand that we end the practice of slavery in $COUNTRY$, and in our position, there is little that can be done.;;;;;;;;;;;;;
EVTDESC187810;\n\n$FROMCOUNTRY$ has brought an end to slavery in their country thanks to British diplomacy!;;;;;;;;;;;;;
SLAVEENDBRITISH;Slavery Ended in $FROMCOUNTRY$!;;;;;;;;;;;;;
