Key;English;French;German;Polish;Spanish;Italian;Swedish;Czech;Hungarian;Dutch;Portuguese;Russian;Finnish;
EVTDESC202030;\n\nFor a musical jubilee, which was part of the International Exhibition of $YEAR$, the Italian composer Giuseppe Verdi prepared a cantata, called 'Inno delle nazione' (Hymn of the Nations), including different hymns, representing three European countries: Great Britain (God save the King), France (La Marseillaise) and Italy (Fratelli d'Italia). The Inno delle nazione exalted the brotherhood of man, and became a huge success, when it was performed, making a lasting impression. This was not only true concerning Verdi's talent, but also true for the young nation state of Italy, which became a part of international affairs.;;;;;;;;;;;;;
EVT202017OPTA;France is the protector of Rome;;;;;;;;;;;;;
roman_republic_joins_title;Join Italy!;;;;;;;;;;;;;
roman_republic_joins_desc;Italy is the fate of Rome, and Rome is the fate of Italy. Let's join our Italian brothers!;;;;;;;;;;;;;
roman_republic_joins_ITS_title;Join Italy!;;;;;;;;;;;;;
roman_republic_joins_ITS_desc;Italy is the fate of Rome, and Rome is the fate of Italy. Let's join our Italian brothers!;;;;;;;;;;;;;
EVTNAME202045;La Mole Antoniellana;;;;;;;;;;;;;
EVTDESC202045;\n\nThe Mole Antonelliana is a major landmark building in Turin. Named after the architect who built it, Alessandro Antonelli, the building was conceived and constructed as a synagogue. The Jewish community of Turin - with a budget of 250,000 lire and the intention of having a building worthy of a capital city - hired Antonio Antonelli. Antonelli promised  to build a synagogue for 280,000 lire. The relationship between Antonelli and the Jewish community was not happy. He proposed a series of modifications which raised the height to 167 meters, over 46 meters higher than the dome in the original design. Such changes, in addition to greater costs and construction time than were originally anticipated, did not please the Jewish community and construction was halted in 1869, with a provisional roof. The people of Turin, who had watched the synagogue rise skyward, demanded that the city take over the project. The state considered to establish a museum dedicated to the Italian unification, reflecting the greatness of the Risorgimento - in one of the highest buildings of Europe.;;;;;;;;;;;;;
EVTNAME202051;Pascoli: La grande proletaria si è mossa!;;;;;;;;;;;;;
EVTDESC202051;\n\nGiovanni Pascoli was an Italian poet and classical scholar. He studied at the University of Bologna, where his teacher and mentor was Giosuè Carducci. Pascoli, even in a period of Positivism and scientism, believed that life is a mystery. Only symbolic associations discovered in the humble things of nature can lead man to catch a glimpse of the truth behind mere appearances. His later poems share similar themes but are more experimental, and reflect his knowledge of classical antiquity. They were a great influence on later Italian poets, who incorporated his melancholy themes into their own works. He wrote in both Italian and Latin, he also translated English poetry. Pascoli was also a political activist, sympathizing with Socialism. In $YEAR$, when the War of Libia broke out, he assumed a prominent role in the public debate. Pascoli's interventionist politicis were not unique in Italian intellectual circles: his rhetoric helped to shape the public mind and to create feelings of patriotism, of fraternal pride and of a shared destiny.;;;;;;;;;;;;;
EVTOPT202060;A triumphal march for Italian culture!;;;;;;;;;;;;;
EVTOPT202061;Qual piuma al vento, muta d'accento, e di pensiero!;;;;;;;;;;;;;
EVTOPT202061A;Italy must never unify!;;;;;;;;;;;;;
EVTOPT202063;Dies, Dies, Dies Iraeee!;;;;;;;;;;;;;
EVTOPT202065;Italy is chained...;;;;;;;;;;;;;