Key;English;French;German;Polish;Spanish;Italian;Swedish;Czech;Hungarian;Dutch;Portuguese;Russian;Finnish
SHETLANDISLANDS;\n\nAbout 170km northeast of Scotland there is an archipelago called the Shetland Islands. It has an oceanic climate, complex geology, rugged coastline, and many low, rolling hills. In all, the Shetlands are made up of about 300 islands and skerries, amounting to an area of nearly one thousand five hundred square kilometers, a thousand of which belong to the largest island, ironically named 'the Mainland'. The archipelago fell under Scottish rule in 1469, when it was ceded by the Kingdom of Norway. Shetlanders are known to have impressive nautical skill, as they have centuries of experience in fishing. Many have made a name for themselves by putting their expertise to use in the Royal Navy.;;;;;;;;;;;;;
ISLEOFWIGHT;\n\nSeparated from Hampshire by the Solent, a strait 4-8km in width, the Isle of Wight is England's largest island at nearly four hundred square kilometers. It has played an essential part in the defense of the ports of Southampton and Portsmouth and has been near the front line of conflicts through the ages, having faced the Spanish Armada. Though the island was last invaded by the French in 1545, the British government has built many fortifications on it over the centuries, hoping to defend against any possible future landings. The Isle of Wight is mostly rural, with most people employed in farming, fishing, or boat-building, although a small tourist sector has formed of late.;;;;;;;;;;;;;
LONGISLAND;\n\nWith a land area of a little over three thousand six hundred square kilometers, Long Island is the largest island in the contiguous United States. It extends 190km eastward into the ocean from New York Harbor with a maximum north–south width 37 km. It also possesses a ring of barrier islands that extend for 75km along its south shore, known as the Outer Barrier. Long Island was first settled by Europeans in 1640, when the town of Southold was established by the Rev. John Youngs from Connecticut. Most of the population is currently concentrated on its western end, close to the island of Manhattan. The rest of the island is rural and primarily devoted to agriculture.;;;;;;;;;;;;;
COMMANDERISLANDS;\n\nThe Commander Islands, called Komandorskiye Ostrova in Russian, are a series of islands in the Russian Far East, a part of the Aleutian Islands, located about 175 km east of the Kamchatka Peninsula in the Bering Sea. Treeless and sparsely populated, the islands consist of Bering Island, Medny Island, and fifteen islets and rocks. There is only one permanently inhabited settlement, Nikolskoye, a miserable hamlet with a population of a couple hundred. Though the island group is part of the Aleutian volcanic arc, the next island in the chain, Attu, is located over 300km further east. The Commander Islands received their name from Commander Vitus Bering, whose ship wrecked on the then uninhabited Bering Island on his return voyage from Alaska in 1741. He died on there along with much of the crew. Though the islands are desolate and destitute, they could still serve as a naval base of some utility, giving us the ability to extend our influence in the Bering Sea.;;;;;;;;;;;;;
PESCADORESISLANDS;\n\nThe Pescadores Islands are an archipelago of 90 islands situated in the Strait of Fokien roughly 50 kilometers away from Formosa's western coast. The largest island of Magong is home to a temple to the goddess Mazu, as well as the settlement of Makeng. Numerous smaller islands, such as Baisha and Xiyu make up the rest of the archipelago. The islands were already settled by Chinese fishermen in 1171, however they were only formally incorporated into China in 1281 during the Yuan dynasty. They have remained under Imperial Chinese control in the centuries since, with the exception of a brief occupation by the Dutch East India Company in the seventeenth century. The main economic activity is fishing, as there is not much arable land available. In truth, the archipelago's value is not in its economy or its people, but in its strategically vital position. It controls the sea between Formosa and the mainland, being able to interdict shipping between the two, and importantly also that which goes between the East and the South China Seas.;;;;;;;;;;;;;
OKIISLANDS;\n\nThe Oki Islands, a small archipelago about 43 nautical miles north of Honshu in the Sea of Japan, are made up of the remains of two stratovolcanoes that have eroded over millions of years. The largest island, Dogo, with the highest point, Mount Daimanji, at 608 meters, makes up one of the volcanoes, while the three smaller islands of Nishinoshima, Nakanoshima and Chiburijima are the remains of the other volcano, which collapsed and split in three. Additionally, there are over 180 smaller outlying islets, rocks and skerries surrounding the four main islands. In total, the Oni Islands have an area of just under 350 square kilometers. Historically, the remote archipelago, which has been a part of Japan since at least the seventh century, has served as a place of exile for multiple deposed emperors.;;;;;;;;;;;;;
KHURIYAMURIYA;\n\nThe Khuriya Muriya Archipelago is a group of five islands located forty kilometers south of the Arabian Peninsula's Dhofar region. The islands are sparsely populated, with the local inhabitants subsisting off of herding goats, catching birds and fishing. Due to the granite geology and the dry climate, the archipelago is barren apart from some tufts of grass and moss, allowing no agricultural usage. Due to the hostile environment, establishing a naval base would not be a simple matter. It has been noted, however, that the islands possess significant deposits of guano, a valuable fertilizer, of which there are estimated to be hundreds of thousands of tons. The guano could potentially be mined, shipped to Europe and sold at a hefty profit. It has also been proposed that the islands could serve as a base for a telegraph connection between Yemen and India, which could link up the European telegraph network to the Indian subcontinent. In addition to these potential uses, the archipelago would most certainly grant us greater influence over the Arabian Peninsula.;;;;;;;;;;;;;
SADOISLAND;\n\nLocated 32km from the Japanese coast, the island of Sado is one of Japan's largest if one excludes the four main islands of the Japanese Archipelago. The island, which has been inhabited for at least ten thousand years, has been a part of Japan since at least the seventh century AD. The island remained a backwater for a millennium, being used at times as a place of exile for influential figures and even an emperor. This came to an end when the island was conquered by the Uesugi clan in 1589, which led to the discovery of gold in 1601. The island's bountiful mines produce gold to this day, and there have been no signs of depletion, especially now that more modern excavation techniques have made previously inaccessible deposits available. By virtue of its mineral resources, Sado has been an important source of income for the Japanese government for many centuries. Annexing Sado would not only allow us to deprive Japan of a significant source of income, it would additionally grant us a naval base in the Sea of Japan.;;;;;;;;;;;;;
TSUSHIMAISLAND;\n\nThe Tsushima Archipelago, which lies halfway between Japan and Korea in the center of the Korea Strait, is made up the main island of Tsushima, which is divided in half by a canal, and over 100 small islets. The island has historically always been considered a part of Japan, becoming an official province in the early sixth century AD. Due to its fortuitous position inbetween Japan and Korea, Tsushima has always been a major center of trade. This linchpin of the Japanese Archipelago's defense was invaded by the Mongols and the Koreans during the Middle Ages, both of whom seized the island but failed to reach Japan itself. This demonstrates Tsushima's vital role both in defending and threatening Japan. If we were to take control of it, we would obtain a powerful strategic position in the region, thus depriving Japan of one of its most important defensive lines and granting our navy navy massive influence in the East China Sea, the Korea Strait and the Sea of Japan.;;;;;;;;;;;;;
CHEJUISLAND;\n\nWith a length of 73km and a width of 31km, Cheju is Korea's largest island, measuring in at a total of nearly two thousand square kilometers. It lies in the Korea Strait, about 80km south of the nearest point on the Korean Peninsula. Until the year 938, the island was an independent kingdom called Tamna when it became a vassal state of Korea under the Goryeo dynasty. The kingdom was finally brought to an end when the island was placed under firm central control in 1404 by Taejong of Joseon, leaving it under Korean control for over 400 years. Cheju is of volcanic origin, dominated by Hallasan: a volcano almost 2000m high and the tallest mountain in southern Korea. Its size as well as its strategic position somewhat removed from the mainland but simultaneously close enough to threaten the nearby coasts make it a valuable base of operations in the East China Sea and the Korea Strait.;;;;;;;;;;;;;
SOCOTRAISLAND;\n\nSocotra, locally know as Saqatri, is an island in the Indian Ocean located almost 400 kilometers east of the Horn of Africa. It is the main island of an archipelago of the same name. With an area of almost four thousand square kilometers, Socotra comprises 95% of the landmass of the eponymous archipelago, which consists of the four larger islands of Socotra, Darsa, Samha and Abd al-Kuri, as well as three small islets to the north. The archipelago is home to some of the most unique and unusual species in the world, with a third of its plant life being unique to the islands. Socotra's geography is also noteworthy, being divided into narrow coastal plains, a limestone plateau and the Hajhir Mountains. The islands, which are traditionally a part of Yemen, were occupied by the Portugese for four years at the start of the 16th century, after which they reverted to the control of the Mahra Sultanate. Socotra's position at the tip of the Horn of Africa would be perfect for a naval base, interdicting the passage from the Read Sea to the Indian Ocean.;;;;;;;;;;;;;
QESHMISLAND;\n\nQeshm is an arrow-shaped island in the strategic Strait of Hormuz, measuring roughly 1,500 square kilometers in surface area. Separated from the Iranian mainland by the Clarence Strait, Qeshm is the largest island in the Persian Gulf. The city of Qeshm, located at the easternmost point of the island, is 22 kilometers from the mainland port of Bandar Abbas, while the closest point of the island is but two kilometers from the mainland. On account of its strategic geopolitical situation near the mouth of the Persian Gulf, it has been frequently attacked by invaders, including the Ilamids, Umayyads and Abbasids, as well as the Portuguese, English and Dutch. The inhabitants' leading occupation is fishing, as there is little cultivated land, though some dates and melons are grown.;;;;;;;;;;;;;
CHUSANISLANDS;\n\nThe Chusan Islands are a group of some 400 islands in the East China Sea, located at the entrance of the Hangchow Bay. The islands have steep and rugged geography with elevations of up to 250 meters. This is due to them being the submerged continuation of the mountain ranges in Fukien and Chekiang. Due to the amount of silt discharged from the mouth of the Yangtze River many of the islands are surrounded by mud banks. The archipelago was brought under Chinese administration in the 8th century, with one of the smaller islands becoming an important Buddhist center. It became a place of pilgrimage during the Song Dynasty due to the belief that it had a connection to Avalokitesvara, the goddess of mercy. Some of the monasteries were looted in a Dutch raid in 1661. Currently, the islands have become an important part of the trade in the area. Their position on the eastern Chinese coast would allow us to strengthen our influence on Shanghai and the Yangtze Delta, as well as eastern China as a whole.;;;;;;;;;;;;;
CORSICAISLAND;\n\nLocated around 90km from Tuscany, the island of Corsica is the Mediterranean's 4th largest island, with a sizeable population to match. Naturally, the island's position in the middle of the Tyrrhenian Sea and its proximity to the Italian and French coasts, paired with its size would prove it a useful port from which we could project our naval influence across the western Mediterranean. Corsica is, in fact, close enough to the Straits of Sicily and Gibraltar to allow us to control naval entry into the region. The island has always been a key token of Mediterranean geopolitics. During the Middle Ages, it was one of the only islands in the Mediterranean able to resist the Muslim invasions, being held by Genoa until revolting in a brief period of independence, whereupon it was annexed by France in May 1769, just in time for Napoleon to be born on French soil 3 months later.;;;;;;;;;;;;
BELEARESISLAND;\n\nThe Balearic Islands are an archipelago in the western Mediterranean Sea composed of 4 islands, namely Mallorca, Ibiza, Menorca and Formentera. Among the four islands, Mallorca, the largest by size, is also home to the majority of the archipelago's population. Being located so close to the French and Spanish coasts, the possession of these islands would be quite useful, as a navy projecting power from them would go a long way towards keeping both nations in check, whilst also granting us the ability to blockade or at least interdict the entrance to the Mediterranean. The archipelago fell to Muslim forces during the Middle Ages, only to be conquered by the Kingdom of Aragon, which owned the islands until its unification with Castile. They remained under Spanish control barring a brief British occupation of Menorca and a French invasion during the Napoleonic Wars.;;;;;;;;;;;;;
BOLAMAISLAND;\n\nLocated in the Atlantic Ocean to the west of the Geba and Grande de Buba river deltas, the Bijagós Islands are a group of about 88 islands and islets, of which twenty are permanently inhabited. The archipelago is nearly thirteen thousand square kilometers in size, and its economy is largely rural, with most families living from subsistence farming and fishing. The islands would make for a useful supply stop on the route along the West African coast, as is evidenced by the fact that Britain attempted to seize the most populated island, Bolama, in 1792 and 1814. The failed attempts to colonize the islands also demonstrate that there is a difficulty to be faced if we are to take control of them: Diseases like yellow fever, malaria and sleeping sickness are very dangerous to Europeans who are especially susceptible to them. They decimated several European settlements and forced Britain to abandon both of its attempts at colonization.;;;;;;;;;;;;;
