AI_FEARS_US_TITLE1;$TAG_0_0_UPPER$ FEARS OUR MIGHT!;;$TAG_0_0_upper$ FÜRCHTET UNSERE MACHT!;;;;;;;;x;;;
RESEARCH_NEWS_TITLE_LARGE2;Breakthrough in $TAG_0_0$!;;Durchbruch in $TAG_0_0$!;;;;;;;;;x;;
RESEARCH_NEWS_LARGE2;$TAG_0_0_ADJ$ scientists have announced yesterday that after months of dedicated and focused research, a new breakthrough in the field of $STRING_0_1$ has been made. It is expected that the entrepreneurs and government of $TAG_0_0$ will soon start putting this newly acquired knowledge to good use, applying it in practical ways throughout the nation.;;$TAG_0_0_ADJ$e Wissenschaftler verkündeten gestern nach Monaten konzentrierter und engagierter Forschung einen bahnbrechenden Erfolg im $STRING_0_1$-Forschungsfeld. Es wird erwartet, dass Unternehmer und Regierung in  $TAG_0_0$ schon bald die neuen Erkenntnisse gewinnbringend in der gesamten Nation einsetzen.;;;;;;;;;x;;
RESEARCH_NEWS_TITLE_MEDIUM2;Breakthrough in $TAG_0_0$!;;Durchbruch in $TAG_0_0$!;;;;;;;;;x;;
RESEARCH_NEWS_MEDIUM2;$TAG_0_0_ADJ$ scientists have announced a breakthrough in the field of $STRING_0_1$. This new knowledge will soon be applied in practical ways, said one of the researchers.;;$TAG_0_0_ADJ$e Wissenschaftler verkündeten einen bahnbrechenden Erfolg im $STRING_0_1$-Forschungsfeld. Die neuen Erkenntnisse werten laut einem der Forscher schon bald gewinnbringend eingesetzt werden.;;;;;;;;;x;;
RESEARCH_NEWS_TITLE_SMALL2;Breakthrough in $TAG_0_0$!;;Durchbruch in $TAG_0_0$!;;;;;;;;;x;;
RESEARCH_NEWS_SMALL2;$TAG_0_0_ADJ$ scientists have recently announced a breakthrough in the field of $STRING_0_1$.;;$TAG_0_0_ADJ$e Wissenschaftler verkündeten kürzlich einen bahnbrechenden Erfolg im $STRING_0_1$-Forschungsfeld.;;;;;;;;;x;;
INVENTION_NEWS_TITLE_LARGE2;New patent!;;Neues Patent!;;;;;;;;;;;x
INVENTION_NEWS_LARGE2;Science Report: Improvements and innovations in the field of $STRING_0_1$ have been patented and registered by researchers in $TAG_0_0$. The documentation of these advancements, although currently a secret kept behind closed doors, is expected to progressively spread to other lands and in time contribute to the progress of science in the world. ;;Forschungsbericht: Verbesserungen und Innovationen im Feld von $STRING_0_1$ wurden von Forschern in $TAG_0_0$ patentiert und eingetragen. Es wird damit gerechnet, dass die Dokumentation dieser Fortschritte trotz bisheriger strenger Geheimhaltung in anderen Ländern weite Verbreitung finden wird und dem wissenschaftlichen Fortschritt der gesamten Welt nutzen wird.;;;;;;;;;;;x
INVENTION_NEWS_TITLE_MEDIUM2;New patent!;;Neues Patent!;;;;;;;;;;;x
INVENTION_NEWS_MEDIUM2;Improvements and innovations in the field of $STRING_0_1$ have been registered in the National Patent Office of $TAG_0_0$. ;;Verbesserungen und Innovationen im Feld von $STRING_0_1$ wurden im Nationalen Patentamt in $TAG_0_0$ eingetragen.;;;;;;;;;;;x
INVENTION_NEWS_TITLE_SMALL2;New patent!;;Neues Patent!;;;;;;;;;;;x
INVENTION_NEWS_SMALL2;New improvements and innovations in the field of $STRING_0_1$ have been patented in $TAG_0_0$. ;;Neue Verbesserungen und Innovationen im Feld von $STRING_0_1$ wurden in $TAG_0_0$ patentiert.;;;;;;;;;;;x 
EDITORIAL_ABSMON;Editorial: why it is right and proper to hate anti-legitimists - providence itself demands it! Why, these neer-do-wells would have the peasant rabble govern themselves (see page 10) ;;Redaktionelles: warum es richtig und angemessen ist, Anti-Legitimisten zu hassen  die Weitsicht verlangt es!Tunichtgute würden Bauerngesindel sich selbst regieren lassen (weiter auf S. 10);;;;;;;;;x;;
EDITORIAL_PRUCON;Editorial: why it is right to hate reformists of every stripe - the natural order demands it! Why, these liberal speculators and cosmopolitans would run our nation as a whorehouse (see page 10);;Redaktionelles: warum es richtig ist, Reformisten aller Couleur zu hassen  die Natur gebietet es! Liberale Spekulanten und Kosmopoliten würden unsere Nation wie Bordell führen (mehr auf S. 10);;;;;;;;;x;;
EDITORIAL_CONMON;Editorial: why it is right to hate republicans - stability demands it! Why, without a figurehead to smile benevolently upon us, intrigue and the guillotine will destroy us all (page 10);;Redaktionelles: warum es richtig ist, Republikaner zu hassen  Stabilität verlangt es! Ohne gütig auf uns herablächelnden Repräsentanten werden Intrigen und Guillotine unser Ende sein (S. 10);;;;;;;;;x;;
EDITORIAL_DEMOCRACY;Editorial: why it is right to hate revolutionaries of every stripe - because they cannot be bribed! Why, men of such zeal and ridgid doctrinism show no respect for the rule of law (pg. 10);;Redaktionelles: warum es richtig ist, Revolutionäre aller Couleur zu hassen  sie sund unbestechlich! Männer mit solchem Eifer und starren Doktrinen haben keinerlei Respekt vor Gesetz (S. 10);;;;;;;;;x;;
EDITORIAL_PRESDICT;Editorial: why it is right to hate subversives  the President demands it! Why, these criminals only yesterday crudely vandalised a marble statue of his Excellency in the capital (see page 10);;Redaktionelles: warum es richtig ist, Staatsfeinde zu hassen  Präsident verlangt es! Erst gestern haben diese Kriminellen Statue Seiner Exzellenz in Hauptstadt schändlich vandalisiert (S. 10);;;;;;;;;x;;
EDITORIAL_BOURDICT;Editorial: why it is right to hate the poor  your own rational self-interest demands it! Why, these parasitic gutter people choose to be poor. Show pity to them at your peril. (see page 10);;Redaktionelles: warum es richtig ist, die Armen zu hassen  der rationale Egoismus verlangt es! Dieser parasitäre Abschaum hat die Armut gewählt. Mitleid auf eigenes Risiko. (mehr auf S. 10);;;;;;;;;x;;
EDITORIAL_PROLDICT;Editorial: why it is right to hate the parasites  the party demands it! Why, even the lowliest village baker is an exploiter of the masses. Eradicating the rich will free us all (see page 10);;Redaktionelles: warum es richtig ist, Parasiten zu hassen  die Partei verlangt es! Selbst kleinster Dorfbäcker nutzt Massen aus. Die Reichen auszumerzen, wird uns befreien (mehr auf S. 10).;;;;;;;;;x;;
EDITORIAL_FASCDICT;Editorial: why it is right to hate the parasites  the party demands it! Why, even the lowliest village baker is an exploiter of the masses. Eradicating the rich will free us all (see page 10);;Redaktionelles: warum es richtig ist, Parasiten zu hassen  die Partei verlangt es! Selbst kleinster Dorfbäcker nutzt Massen aus. Die Reichen auszumerzen, wird uns befreien (mehr auf S. 10).;;;;;;;;;x;;
FAKE_UNKNOWN;Promising new writer Ellis Bell has written a fascinating look into matters of love in the moors of Yorkshire in Wuthering Heights. We look forward to seeing more from this young man.;;Der junge Schriftsteller Ellis Bell schrieb faszinierende Einsichten in Liebesdinge im Moor von Yorkshire in Wuthering Heights. Wir freuen uns auf weitere Arbeiten dieses jungen Mannes.;;;;;;;;;x;;
FAKE_UNKNOWN;Literary scandal! Wuthering Heights writer Ellis Bell is in fact a woman named Emily Brontë! The novel's popularity continues unabated as the petticoats of London sigh for Heathcliff.;;Literaturskandal! Wuthering Heights Autor Ellis Bell ist in Wirklichkeit eine Frau namens Emily Brontë! Popularität des Romans ungebrochen, Londons Frauenherzen schmachten nach Heathcliff.;;;;;;;;;x;;
FAKE_UNKNOWN;Richard Francis Burton, translator of The Thousand and one Nights and Kama Sutra, has infiltrated the hajj in Mecca. For his exclusive account of his travels, see p10.;;Der Übersetzer von Tausendundeine Nacht und dem Kamasutra, Richard Francis Burton, infiltrierte den Haddsch in Mekka. Exklusiver Reisebericht auf Seite 10.;;;;;;;;;x;;
FAKE_UNKNOWN;Actress Virginia Rappe found dead in Fatty Arbuckle's New York hotel suite. It is time to rein in the Hollywood playboys and their degenerate films before they ruin our nation's moral values.;;Schauspielerin Virginia Rappe tot in Fatty Arbuckles Hotelsuite in New York aufgefunden. Zeit, die Playboys und dekadenten Filme Hollywoods zu zügeln, oder die Moral der Nation geht zugrunde.;;;;;;;;;x;;
FAKE_UNKNOWN;George Gershwin's new composition Rhapsody in Blue mixes classical and jazz stylings to create a sophisticated-yet-playful bridge of old and new sounds befitting of our modern era.;;George Gershwins neue Komposition Rhapsody in Blue vermischt klassische Elemente mit Jazz, um eine verspielte Brücke zw. alter und neuer Musik zu schlagen, die zu unserer modernen Zeit passt.;;;;;;;;;x;;
FAKE_UNKNOWN;F. Scott and Zelda Fitzgerald depart New York to seek a brighter future in the American expatriate community in Paris. It seems all the most talented Americans end up in Paris eventually.;;F. Scott und Zelda Fitzgerald verlassen New York, um eine bessere Zukunft in der amerik. Gemeinschaft in Paris zu suchen. Scheinbar landen alle talentierten Amerikaner neuerdings in Paris.;;;;;;;;;x;;
FAKE_UNKNOWN;In yet another unintended side effect of the Volstead Act's prohibition of alcohol, Americans are pioneering a variety of new cocktails in an attempt to make bootleg alcohol palatable.;;Ein weiterer Seiteneffekt des Alkoholverbots des Valstead Acts: Amerikaner sind wegweisend in der Erfindung neuer Cocktails, um schwarzgebrannten Alkohol trinkbar zu machen.;;;;;;;;;x;;
FAKE_Cthulhu;Ph'nglui mglw'nafh Cthulhu R'lyeh wgah'nagl fhtagn;;Ph'nglui mglw'nafh Cthulhu R'lyeh wgah'nagl fhtagn;;;;;;;;;x;;
some_fake_1836_title_12;Cherry Blossoms;;Kirschblüten;;;;;;;;;;;x
some_fake_1836_12;Japanese government decides the new national colour will be that of a cherry blossom, for it best represents this marvellous country's national character. Calling it 'pink' is outlawed.;;Regierung Japans wählt die Farbe von Kirschblüten als neue Nationalfarbe, die den wunderbaren Charakter der Nation am besten wiederspiegelt. Es ist verboten, die Farbe 'rosa' zu nennen.;;;;;;;;;;;x 
some_fake_1836_title_13;The Good River;;Der gute Fluss;;;;;;;;;;;x
some_fake_1836_13;A team of expert American cartographers deliver the most accurate drawings of the 'good' Ohio River to date, to be included in future local and international maps. More rivers to follow.;;Team amerik. Kartographie-Experten präsentiert aktuellste Zeichnungen des 'guten' Ohio-Flusses, die in nationalen und internationalen Karten verwendet werden. Weitere Flüsse werden folgen.;;;;;;;;;;;x
some_fake_1836_title_14;Jan Mayen;;Jan Mayen;;;;;;;;;;;x
some_fake_1836_14;Inexplicably high numbers of migrants are reported to have moved recently to the barren island of Jan Mayen in the Arctic Ocean. 'We were tired of all that noise' revealed one of the pioneers.;;Unglaublich viele Migranten sind laut Berichten kürzlich auf die karge Insel Jan Mayen im Arktischen Ozean gezogen. 'Wir hatten den Lärm satt', sagte einer der Pioniere.;;;;;;;;;;;x 
some_fake_1880_title_8;Lunatics Act;;Geisteskranken-Verordnung;;;;;;;;;;;x
some_fake_1880_8;Recent legislation requires ship owners to pay a fine should their arriving vessel discharge into the ports of this country a person or persons assessed as lunatics, idiots or convicts.;;Neue Gesetzesverordnung belegt Schiffseigner mit einer Geldstrafe, wenn sie Menschen die geisteskrank, Idioten oder Sträflinge sind, mit ihrem Schiff in die Häfen dieses Landes entladen.;;;;;;;;;;;x 
some_fake_1890_title_8;Lucky 55;;Die Glücklichen 55;;;;;;;;;;;x
some_fake_1890_8;Fifty four confirmed winners of the state lottery to split between themselves a record amount of prize money. 'I can't find my ticket!', complains the hapless fifty fifth.;;54 bestätigte Gewinner der Staatslotterie teilen sich Rekordgewinn. 'Ich kann mein Los nicht finden!', beklagt der unglückliche 55. Gewinner.;;;;;;;;;;;x 
some_fake_1910_title_11;Dreadnought hoax;;Schlachtschiff-Humbug;;;;;;;;;;;x
some_fake_1910_11;A group of young artistocrats, disguised with turbans and blackened faces as a party of Abyssinian princes, trick their way into the Royal Navy's flagship for a private tour of the vessel.;;Gruppe junger Aristokraten, verkleidet als Delegation des abessinischen Prinzen, mit Turbanen und geschwärzten Gesichtern, erschwindelt private Führung durch Flagschiff der königl. Marine.;;;;;;;;;;;x 
some_fake_1910_title_12;Radios Killing Culture?;;Zerstören Radios die Kultur?;;;;;;;;;;;x
some_fake_1910_12;The radio has recently come about, causing concerns that it will kill society and socialization. Proponents say only thought-provoking and intelligent broadcasts will be considered.;;Mit Einführung des Radios wächst die Sorge um den Fortbestand der Gesellschaft und Sozialisation. Befürworter betonen, dass nur zum Nachdenken anregende, intelligente Sendungen geplant werden.;;;;;;;;;;;x 
some_fake_1910_title_13;Revolt of the Lash;;Der Peitschen-Aufstand;;;;;;;;;;;x
some_fake_1910_13;Black crewmen of the Brazilian Navy mutiny against their white officers. They threaten to fire upon Rio de Janeiro if racial abuse and physical violence against lower ranks are not abolished.;;Schwarze Besatzung der brasil. Marine meutert gegen ihre weißen Offiziere. Sie fordern Ende der Rassendiskriminierung und körperlichen Gewalt gg. Untergebene oder Rio de Janeiro werde brennen.;;;;;;;;;;;x 
some_fake_1920_title_13;Men's Dress Reform Party;;Partei zur Reform von Männerkleidung;;;;;;;;;;;x
some_fake_1920_13;New movement urges men to dress more beautifully and hygienically. 'Most members wish for shorts, a few for the kilt, nearly all hate trousers.' The MDRP also opposes the wearing of hats.;;Neue Bewegung fordert Männer zu ansehnlicherer und sauberer Kleidung auf. 'Viele Mitglieder wünschen sich kurze Hosen, manche Kilts, fast alle hassen lange Hosen.' MDRP lehnt auch Hüte ab.;;;;;;;;;;;x
dino_fake_1830_title_1;Ornithichnology;;Ornithichnologie;;;;;;;;;; ;x
dino_fake_1830_1;Prof. Hitchcock reports fossil tracks of birds discovered near the Connecticut river in Massachusetts. Some of the foot marks indicate that they were made by some enormous species of bird...;;Prof. Hitchcock meldet Entdeckung von Fossilienspuren von Vögeln nahe des Connecticut-Flusses, Massachusetts. Einige Spuren deuten auf riesige Vogelart hin;;;;;;;;;;;x
dino_fake_1830_title_2;Plateosaurus;;Plateosaurus;;;;;;;;;;;x
dino_fake_1830_2; In honour of Dr. Engelhardt, original discoverer of the remains, Dr. von Meyer named a new giant saurian as Plateosaurus engelhardti. It seems to be related to Iguanodon and Megalosaurus.;; Zu Ehren des Entdeckers Dr. Engelhardt nannte Dr. von Meyer einen neuen riesigen Saurier 'Plateosaurus engelhardti'. Er scheint mit Iguanodon und Megalosaurus verwandt zu sein.;;;;;;;;;;;x
dino_fake_1830_title_3;Thecodontosaurus;;Thecodontosaurus;;;;;;;;; ;;x
dino_fake_1830_3;This unusual saurian has teeth in its sockets instead of having them fused to the jaw like modern reptiles, say Dr. Riley and Dr. Stutchbury, the describers of this lizard.;;Dieser ungewöhnliche Saurier besaß Zähne in Zahnhöhlen, nicht wie moderne Reptilien direkt mit dem Kiefer verbundene, wie Dr. Rilez und Dr. Stutchbury, Entdecker der Eidechse, sagen.;;;;;;;;;;;x
dino_fake_1830_title_4;Poekilopleuron;;Poekilopleuron;;;;;;;;;;; x
dino_fake_1830_4;Dr. Eudes-Deslongchamps resports on a new saurian known from vertebrae, ribs and limbs. He thinks this animal is related to the Megalosaurus.;;Dr. Eudes-Deslongchamps meldet aufgrund von Wirbel-, Rippen- und Gliedmaßen-Funden einen neuen Saurier. Er glaubt, das Tier ist mit dem Megalosaurus verwandt.;;;;;;;;;;;x
dino_fake_1840_title_1;Dinosauria;;Dinosauria;;;;;;;;;;;x
dino_fake_1840_1; Dinosauria is the name Prof. Owen proposed for the tribe of Saurians that include Megalosaurus, Hylaeosaurus and Iguanodon. These dinosaurians are remarkable for their large size.;; Prof. Owen schlug für die Sauriergattung, der Megalosaurus, Hylaeosaurus und Iguanodon angehören, den Namen Dinosauria vor. Ihre Größe ist bemerkenswert.;;;;;;;;;;;x
dino_fake_1840_title_2;Cetiosaurus;;Cetiosaurus;;;;;;;;;;;x
dino_fake_1840_2; A new giant fossil sea-dwelling reptilian was discovered. Prof. Owen named it Cetiosaurus, which means whale lizard.;; Neue Entdeckung eines riesigen, aquatischen Reptil-Fossils. Prof. Owen nannte es Cetiosaurus, was Wal-Echse bedeutet.;;;;;;;;;;;x
dino_fake_1840_title_3;Cardiodon;;Cardiodon;;;;;;;;;;;x
dino_fake_1840_3;A single heart shaped tooth was discovered in Wiltshire, England. After analyzing it Prof. Owen decided to give it the name of Cardiodon.;;Ein einzelner, herzförmiger Zahn wurde in Wiltshire, England entdeckt. Prof. Owen entschloss sich nach seiner Analyse, ihn Cardiodon zu taufen.;;;;;;;;;;;x
dino_fake_1840_title_4;Regnosaurus;;Regnosaurus;;;;;;;;;;;x
dino_fake_1840_4;After some jaws of the Iguanodon were discovered, Dr. Mantell assumed his error in a previously assigned portion of a jaw to this beast and now described it as a separate species.;;Nach dem Fund einiger Kieferknochen des Iguanodons vermutete Dr. Mantell einen Fehler in seiner vorherigen Zuordnung eines Kiefers zu diesem Biest und beschreibt ihn nun als separate Spezies.;;;;;;;;;;;x
dino_fake_1840_title_5;Dinosauria?;;Dinosauria?;;;;;;;;;;;x
dino_fake_1840_5;Biologist Richard Owen creates first life-size concrete sculptures of extinct gigantic reptiles, fossils of which were discovered in South Africa and New Zealand. He calls them 'dinosauria'.;;Biologe Richard Owen erstellt erste lebensgroße Skulpturen von ausgestorbenen, gigantischen Reptilien, deren Fossilien in Südafrika und Neuseeland entdeckt wurden. Er nennt sie 'Dinosauria'.;;;;;;;;;;;x
dino_fake_1850_title_1;Dinosaurians in America;;Dinosaurier in Amerika;;;;;;;;;;;x
dino_fake_1850_1;Dr. Leidy has described two new dinosaurians from America, named Trachodon and Deinodon. Other undeterminate lacertians named Palaeoscincus and Troodon were also discovered.;;Dr. Leidy beschrieb zwei neue Dinosaurier aus Amerika, namens Trachodon und Deinodon. Weitere untergeordnete Echsen namens Palaeoscincus und Troodon wurden ebenfalls entdeckt.;;;;;;;;;;;x
dino_fake_1850_title_2;Hadrosaurus;;Hadrosaurus;;;;;;;;;;;x
dino_fake_1850_2;This new dinosaurian appears to be related to the Iguanodon. Dr. Leidy suspects the animal sustained itself in a bipedal erect posture.;;Dieser neue Dinosaurier scheint mit dem Iguanodon verwandt zu sein. Dr. Leidy vermutet bei dem Tier einen aufrechten Gang auf zwei Beinen.;;;;;;;;;;;x
dino_fake_1860_title_1;Compsognathus;;Compsognathus;;;;;;;;;;;x
dino_fake_1860_1;A new species of saurian was found and was named Compsognathus. Dr. Wagner says the lizard reminds us somewhat of birds but such relationship cannot be justified.;;Neue Saurierspezies entdeckt und Compsognathus getauft. Dr. Wagner sagt, die Echse erinnere fern an Vögel, doch ein solcher Bezug sei nicht erwiesen.;;;;;;;;;;;x
dino_fake_1860_title_2;Archaeopteryx;;Archaeopteryx;;;;;;;;;;;x
dino_fake_1860_2;A finely fossilized feather was discovered and Dr. von Meyer named it Archaeopteryx which means ancient feather or wing.;;Ein perfektes Fossil einer Feder wurde entdeckt und Dr. Wagner taufte sie Archaeopteryx, was für eine altertümliche Feder oder einen Flügel steht.;;;;;;;;;;;x
dino_fake_1860_title_3;johnstoni, Astrodon johnstoni!;;johnstoni, Astrodon johnstoni!;;;;;;;;;;;x
dino_fake_1860_3;After Dr. Johnston named some saurian teeth as Astrodon, Dr. Leidy now completes the name and gives it a specific epithet in his honour.;;Nachdem Dr. Johnston einige Saurierzähne als Astrodon bezeichnete, vollendet Dr. Leidy nun den Namen zu dessen Ehren mit diesem spezifischen Beinamen.;;;;;;;;;;;x
dino_fake_1860_title_4;Laelaps;;Laelaps;;;;;;;;;;;x
dino_fake_1860_4;Professor Cope announces the discovery of a terrifying rapacious gigantic dinosaur related to Megalosaurus and Dinodon.;;Professor Cope verkündet die Entdeckung eines furchterregenden, räuberischen, riesigen Dinosauriers, der mit Megalosaurus und Dinodon verwandt ist.;;;;;;;;;;;x
dino_fake_1860_title_5;Elasmosaurus;;Elasmosaurus;;;;;;;;;;;x
dino_fake_1860_5;E.D. Cope reports on a new enaliosaur related to the Plesiosaurus, but with a much longer tail.;;E.D. Cope meldet einen neuen Enaliosaurus, der mit dem Plesiosaurus verwandt ist, aber einen viel längeren Schwanz hat.;;;;;;;;;;;x
dino_fake_1860_title_6;Archaeopteryx;;Archaeopteryx;;;;;;;;;;;x
dino_fake_1860_6;Archaeopteryx fossils discovered in Bavaria. Described as 'the first bird' and 'the missing link between dinosaurs and birds', it constitutes the proof Darwin needed to validate his theory.;;Archaeopteryx-Fossilien in Bayern gefunden. Die 'ersten Vögel' bilden 'fehlende Verbindung zwischen Dinosauriern und Vögeln' und liefern den Beweis, den Darwin für seine Theorie brauchte.;;;;;;;;;;;x
dino_fake_1860_title_7;Hypselosaurus;;Hypselosaurus;;;;;;;;;;;x
dino_fake_1860_7;Mr. Matheron reports on vertebrae and giant egg fragments from a likely aquatic saurian he names Hypselosaurus from the Fuveau basin.;;Mr. Matheron meldet Funde von Wirbelknochen und gigantischen Eifragmenten eines womöglich aquatischen Sauriers im Fuveau-Becken, den er Hypselosaurus taufte.;;;;;;;;;;;x
dino_fake_1870_title_1;WAR!;;KRIEG!;;;;;;;;;;;x
dino_fake_1870_1;After Dr. Marsh reported openly to the public Dr. Copes error in placing Elasmosaurus head in its tail they have become sworn enemies and a ferocious scientific competition has now started.;;Dr. Marshs Veröfentlichung, dass Dr. Cope den Kopf des Elasmosaurus irrtümlich am Schwanzende anbrachte, machte sie zu Erzrivalen und ein erbitterter wissenschaftl. Wettstreit hat begonnen.;;;;;;;;;;;x
dino_fake_1870_title_2;More on Archaeopteryx;;Mehr zum Archaeopteryx;;;;;;;;;;;x
dino_fake_1870_2;New fossils of the primitive bird Archaeopteryx show shocking reptilian features as claws and teeth. Evolutionists are making a big deal of these findings and call it a missing link.;;Neue Fossilien des primitiven Vogels Archaeopteryx zeigen schockierende Reptilienmerkmale wie Klauen und Zähne. Evolutionisten reißen sich um die Entdeckung, sie sei ein fehlender Link.;;;;;;;;;;;x
dino_fake_1870_title_3;Prof. Huxleys Insanity!;;Prof. Huxleys Wahnsinn!;;;;;;;;;;;x
dino_fake_1870_3;Many prominent palaeontologists are fearing for Prof. Huxleys mental state after he proposed another ridiculous evolutionary claim: he says reptilian dinosaurians and birds are related!;;Viele bekannte Paläontologen fürchten um Prof. Huxleys Geisteszustand, nachdem er eine weitere lächerliche Evolutionstheorie vortrug: er sagt, reptilische Dinosaurier und Vögel sind verwandt!;;;;;;;;;;;x
dino_fake_1870_title_4;Stegosaurus;;Stegosaurus;;;;;;;;;;;x
dino_fake_1870_4;A new kind of weird and enormous turtle was discovered in the North American West. Prof. Marsh called it Stegosaurus, meaning roofed lizard.;;Eine neue Art einer merkwürdigen, gigantischen Schildkröte wurde im Westen Nordamerikas entdeckt. Prof. Marsh nennt sie Stegosaurus, was soviel wie überdachte Eidechse heisst.;;;;;;;;;;;x
dino_fake_1870_title_5;Pteranodon;;Pteranodon;;;;;;;;;;;x
dino_fake_1870_5;A breakthrough discovery by O.C. Marsh. Airborne creatures fossils of which were found in North America, unlike any other species of pterosaurian, seem to had lacked teeth entirely.;;Bahnbrechende Entdeckung von O.C. Marsh. In Nordamerika gefundene Fossilien von fliegenden Kreaturen hatten, im Gegensatz zu anderen Pterosaurus-Arten, keine Zähne.;;;;;;;;;;;x
dino_fake_1870_title_6;Agathaumas;;Agathaumas;;;;;;;;;;;x
dino_fake_1870_6;Buried in a coal formation in Wyoming lied 'the wreck of one of the princes among giants', as E.D. Cope described of what was undoubtedly the largest land animal known to date.;;Laut E.D. Cope liegt in einer Kohleformation in Wyoming 'das Wrack eines Prinzen unter den Giganten', zweifelsohne das bislang größte, entdeckte Landtier.;;;;;;;;;;;x
dino_fake_1870_title_7;Bridger Basin works;;Arbeiten in Bridger Basin;;;;;;;;;;;x
dino_fake_1870_7;Marsh, Cope and Leidy move their excavation work to the Bridger Basin area in Wyoming. Their camps mere miles apart, top three paleontologists are reported to never speak with one another.;;Marsh, Cope und Leidy verlagern Ausgrabungsarbeiten nach Bridger Basin, Wyoming. Trotz benachbarter Lager wechseln die drei führenden Paläontologen kein Wort miteinander.;;;;;;;;;;;x
dino_fake_1870_title_8;Vote of no confidence;;Misstrauensvotum;;;;;;;;;;;x
dino_fake_1870_8;Professor Marsh is elated over his election to the prestigious National Academy of Sciences. Professor Cope is reported to have been the only member of the academy to cast a 'no' vote.;;Professor Marsh erfreut über seine Wahl in anerkannte Nationale Akademie der Wissenschaften. Laut Meldungen votierte Professor Cope als einziges Akademiemitglied mit 'Nein'.;;;;;;;;;;;x
dino_fake_1870_title_9;Hesperornis;;Hesperornis;;;;;;;;;;;x
dino_fake_1870_9;Professor Marsh announces discovery of Hesperornis, a tall and almost wingless aquatic volucrine propelling with powerful hind legs and using his toothed beak to snatch underwater prey.;;Professor Marsh verkündet Entdeckung des Hesperornis, eine große, fast flügellose Seekreatur, mit kraftvollen Hinterläufen und einem Schnabel mit Zähnen, für die Beutejagd unter Wasser.;;;;;;;;;;;x
dino_fake_1870_title_10;Marsh among the Sioux;;Marsh bei den Sioux;;;;;;;;;;;x
dino_fake_1870_10;In their boldest excursion to date, professor Marsh and his party cross the Sioux territory to reach the most promising excavation sites in the White River Badlands in South Dakota.;;Bei der bislang gewagtesten Exkursion dringen Prof. Marsh und sein Team in Gebiet der Sioux vor, um vielversprechende Ausgrabungsorte in den White River Badlands, South Dakota, zu erreichen.;;;;;;;;;;;x
dino_fake_1870_title_11;Marsh's camp raided!;;Überfall auf Marshs Lager!;;;;;;;;;;;x
