Key;English;French;German;Polish;Spanish;Italian;Swedish;Czech;Hungarian;Dutch;Portuguese;Russian;Finnish
EVTDESC600103;\n\nDespite some initial setbacks, Rosas managed to beat the traitor José Justo de Urquiza and his army of Unitarian savages and foreign enemies. The Ejército Grande was shattered, with Brazil and Uruguay suing for peace, leaving Urquiza and his allies under our mercy. New governors are already being appointed to the provinces, with Rosas hoping that the Argentine Confederation can finally find some degree of peace now. While this incident has been dealt with, we can't deny that it brought into question some matters regarding the Federal Pact and national organizaiton, which Rosas will need to adress if he wants to solidify his legacy as the Father of the Argentine Confederation.;;;;;;;;;;;;;
EVTDESC600102;\n\nWith their momentum from the bloodless takeover of Santa Fé, Urquiza, together with his Uruguayan and Brazilian allies, managed to win the decisive Battle of Caseros, leading Rosas to resign and flee the country, effectively exiling him to England. With this great victory, Urquiza is left as the definitive master of the Argentine Confederation. Luckily, the general is already preparing the ground for a new constitutional convention, promoting the San Nicolás Agreement, setting the bases for the national organization of the future Argentine Constitution. Sadly, Buenos Aires refused to ratify the pact, leading to Urquiza to intervene in the province, putting down any dissent for the time being...;;;;;;;;;;;;;
EVTDESC600105;\n\nIt would seem that Urquiza's Federal Intervention on Buenos Aires wasn't enough to quell the Unitarian sentiment in the city. Urquiza left the city in the 8th of September to preside over the Constitutient Congress' sessions, and 3 days later, in the 11 September, a bloodless coup by took over Buenos Aires, with the new government in the city preparing to act against Urquiza!;;;;;;;;;;;;;
EVTDESC600106;\n\nDepiste our victories in the Litoral, the interior provinces of the Argentine Confederation seem to be having their fair share of trouble. Sensing the Federalist infighting, many Federalist governors in the interior were deposed, with one of the more worrying examples being found in the north, being of the provinces of Tucumán, Salta and Santiago del Esterro which—after changing hands a couple of times—all ended up under the control of an Unitarian alliance in the north, led by Manuel Taboada. Despite the calls for help from the Federalist governor of Tucumán—Celedonio Gutiérrez—against Manuel Taboada and his ally José María del Campo, Urquiza wasn't of much use, leading to del Campo's takeover of Tucumán and the persecution of Federalists in Tucumán.;;;;;;;;;;;;;
EVTDESC600107;\n\nEven with their overwhelming influence over the Santiago del Esterro and its neighboring provinces, the Northern Alliance under Manuel Taboada has finally come it is end, leading to more stability over the region. That is not to say that his Liberal Party is dead, sadly such an Unitarian tool can't hardly die as easily as Taboada.;;;;;;;;;;;;;
EVTDESC600108;\n\nThe Argentine Constitution of $YEAR$ was promulgated by Provisional Director José Justo de Urquiza. Being the 3rd Argentine Constitution of the country, it would see more success than the 1st and 2nd constitutions—which both were proposed by Buenos Aires but failed to gain support from the other provinces. The Constitution was based on the Federal model and the Federal Party's ideas, on top of being heavily inspired by the United States Constitution and the pioneering ideas of Juan Bautista Alberdi. Its text granted high level of independence to the Argentine provinces, a strong executive branch government and a bicameral national congress. \n\nLess than a year after the promulgation of the constitution, Urquiza would assume office as the 1st President of the Argentine Confederation.;;;;;;;;;;;;;
taboada_alliance;Taboada's Alliance;;;;;;;;;;;;;
unitarian_federal_clashes;Unitarian-Federal Clashes;;;;;;;;;;;;;
EVTDESC600109;\n\nIt seems that the victory against Rosas was only the first step for the new Argentine Confederation. While the armies of Buenos Aires were quick to be beaten and an ex-Rosist mutiny laid siege to the city, allying with Urquiza, such a siege appears to have no end in sight. \n\nWe were already starved off of money to play our troops, but we hoped that the blockade of the city would make it fall soon enough. Sadly, such plans went down the drain once Commander John Halstead Coe accepted a bribe from the Buenos Aires' government in exchange for the surrender of the navy in favor of Buenos Aires. Now, with no prospect to ever finish the siege like that, we are forced to withdraw...;;;;;;;;;;;;;
EVTDESC600110;\n\nAfter a prolonged conflict with Rosas, we ended up in an uneasy stalemate. Urquiza's coffers were running dry and—despite having the money to fund his troops—Rosas's army was under severe disadvantage, due to Urquiza's Brazilian and Uruguayan auxiliaries. On top of that, with the lack of reinforcement's from the interior, Urquiza had enough leverage to propose a deal: Rosas could keep the Confederation, but Urquiza and his allies would break off from the Confederation, forming the Independent State of the Litoral.;;;;;;;;;;;;;
EVTDESC600111;\n\nAfter a prolonged conflict with Rosas, we ended up in an uneasy stalemate. Urquiza's coffers were running dry and—despite having the money to fund his troops—Rosas's army was under severe disadvantage, due to Urquiza's Brazilian and Uruguayan auxiliaries. On top of that, with the lack of reinforcement's from the interior, Urquiza had enough leverage to propose a deal: Rosas could keep the Confederation, but Urquiza and his allies would break off from the Confederation, forming the Independent State of the Litoral.;;;;;;;;;;;;;
EVTDESC600112;\n\nWhile the idea of a "Republic" in Mesopotamia isn't new, this is the first time we achieve true independence in the region, with the last "Republic of Entre Rios" being mostly a statement against the Unitarian government that sat in Buenos Aires at the time. While our ambition was to overthrow Rosas, both Urquiza and his allies are satisfied with having Mesopotamia under his control, leading to the free navigation of Paraná and Uruguay Rivers. Now, with our independence accepted by Buenos Aires, there is a small debate about what to call our nation: "Republic of Mesopotamia" or "Independent State of Litoral"?;;;;;;;;;;;;;
EVTDESC46653;\n\n$FROMCOUNTRY$ are proposing a border and navigation treaty to resolve some of our border disputes with them. It involves the cession of the Paraguayan Misiones in exchange for the recognition of Paraguayan independence, dropping all claims to Pilar and entering an alliance with them against the government in Buenos Aires. It also gives Paraguay rights to navigate through our rivers.;;;;;;;;;;;;;
EVTDESC46654;\n\n$FROMCOUNTRY$ accepted our proposal! Our troops are already withdrawing from Missiones and a small celebration is being held at the new border with $FROMCOUNTRY_ADJ$ government officials to celebrate the start of a great friendship between our two nations! \n\nWe hope they can help us dissuade Argentinian claims in the Chaco.;;;;;;;;;;;;;
EVTDESC46655;\n\n$FROMCOUNTRY$ rejected our proposal! With this potential ally rejecting our overtures, we are forced to further entrench our position between our hostile neighbors. We can only hope $FROMCOUNTRY$ isn't planning on attacking us instead.;;;;;;;;;;;;;
league_of_the_free_peoples_desc;§RGain 5 infamy§! Between foreign and personal interests, to some degree, Entre Rios independence from the Argentine Confederation was founded on bases of the wish to uphold the ideals of Federalism. To reinforce our place as the bastion of "True Federalism", we could—to some degree—claim to be the true successor to the League of the Free Peoples, the state that—under José Gervasio Artigas—gave birth to the Federalist movement in Argentina. Doing so would put us at odds with our old allies, which now occupy territory which was once part of the League and would also rekindle our hostilities with Buenos Aires, which not only may still claim to be successors to the League, but also hold the Province of Córdoba, which was also part of the League to some degree.;;;;;;;;;;;;;
league_of_the_free_peoples_title;Claim the Mantle of the League of the Free Peoples;;;;;;;;;;;;;
juliana_connection_title;Legacy of the Juliana Republic;;;;;;;;;;;;;
juliana_connection_desc;§RGain 5 infamy§! With the birth of the Uruguayan Federation and the integration of the Gauchos from Rio Grande do Sul, the old ties between Uruguay and the local population have been rekindled. Despite the differences between us and the local population, we faced a lot of sympathetic sentiment in the region, with some like-minded even offering to pull some strings to find support across the northern border, in Santa Catarina, to try and give us a chance to claim the region. Santa Catarina was once occupied by the Rio-Grandense Republic during the Ragamuffin War, with the Juliana Republic being established. With support from the Farrapos in Rio Grande do Sul, we could claim the region and shorten our border with Brazil significantly.;;;;;;;;;;;;;
reinvade_paraguay_title;End Paraguay's Independence;;;;;;;;;;;;;
reinvade_paraguay_desc;§RGain 10 infamy§! During the Platine Wars of Independence, Paraguay's fate stood on the edge of a knife. At the start, during the First Junta of Buenos Aires, Manuel Belgrano tried to invade Paraguay to liberate it from Royalist forces. Not only Belgrano in that task but Artigas also tried to incorporate Paraguay in the League of the Free Peoples, an prospect that also found no success. With both failed attempts on the conquest of Paraguay by Platine forces, the country's independence was secured. But now—as we carry the mantle of the League of the Free Peoples—Paraguay stands as the only country—besides us—between Argentina and Brazil. Thus, conquering it would not only avenge Artigas' attempt, but also become a stronger buffer between the two giants that border us.;;;;;;;;;;;;;
become_BAB_CRT_title;The Tower of Babel;La tour de Babel;Der Turm von Babylon;;La Torre de Babel;;;;;;;;;
become_BAB_CRT_desc;Very little progress has been made in the past few thousand years on that greatest of all building projects initiated by our proud ancestors. With Mesopotamia's recent ascent to power and standing in the world, there is some talk... though all talk has been strangely hard to understand lately... of starting the project back up again! With modern technology, who knows what wonders could be accomplished?;Au cours des derniers millénaires, très peu de progrès ont été faits sur le plus grand projet de construction initié par nos illustres ancêtres. Avec la montée en puissance récente et la nouvelle place dans le concert des nation de l'Iraq, on parle - même si récemment, le discourt s'est fait incompréhensible - de relancer le projet ! Avec la technologie moderne, qui sait quelles merveilles pourraient être accomplies ?;Im Laufe der letzten Jahrtausende wurden beim größten aller Bauprojekte, begonnen von unseren stolzen Vorfahren, kaum noch Fortschritte erzielt. Durch den kürzlichen Aufstieg des Iraks zu Macht und Ansehen in der Welt gibt es Gespräche ... die in letzter Zeit merkwürdigerweise nur schwer zu verstehen waren ... das Projekt wieder aufzunehmen! Welche Wunder wohl durch den Einsatz moderner Technologie möglich wären?;;En los últimos milenios apenas se han hecho progresos en el mayor de los proyectos de construcción iniciado por nuestros orgullosos antepasados. ¡Con el reciente ascenso de Irak en el concierto de las naciones, cada vez más voces (aunque cada vez más confusas, también es cierto) hablan de reiniciar el proyecto! Con la tecnología moderna, ¿quién sabe qué maravillas se podrían alcanzar?;;;;;;;;;
EVTDESC600113;\n\nNot long after the Argentine Confederation under Urquiza sanctioned their new constitution, the newly-independent State of Buenos Aires was sure to follow suit and sanction their own constitution. While the document doesn't outright declared independence from the Argentine Confederation, it leaves clear that Buenos Aires won't join the Confederation, unless it has the right to revise the Confederation's Constitution before joining.;;;;;;;;;;;;;
EVTDESC800900;\n\nWhile Federalism triumphed over Unitarism with the readmission of Buenos Aires into the Argentine Confederation, that is not to say that Federalism was quite safe. In the recent years, as the Argentine Confederation evolves, the old caudillos that were the heads of the Federalist Party are less and less able to gather power and influence, effectively changing the party's dynamics in the last few years. With the declining power of the caudillos, the party started to enjoy new factions, threatening to break away the party, the most relevant of which being the National Autonomists, the head of which is Nicolás Avellaneda, who is not only aligned with important figures like Alberdi, but is also a proponent of the institutional modernization of the Confederation. Should Avellaneda take over the Federalist party, he is sure to let Federalism evolve to something better suited for the years to come.;;;;;;;;;;;;;
EVTDESC800901;\n\nDespite his involvement in the 1830 Sedition, by the 1840's, as the liberal revolutions ravaged Europe, Samuel Gottfried Kerst was back in Germany to witness the liberal revolutions that swept across his fatherland. There he would become an active player in Prussian politics, working for its administration until it coming at odds with Prussia naval strategy. After falling out with the Prussian Navy, Kerst would become member of the Prussian Parliament and then a newspaper editor. \n\nMore recently, Kerst has published a series of works about German immigration to Brazil and the Rio Grandense Republic, promoting waves of German immigration, to Brazil's detriment.;;;;;;;;;;;;;
oribe_repaying_the_favor_title;Repaying the favor;;;;;;;;;;;;;
oribe_repaying_the_favor_desc;When Rivera—with help from his Anglo-French backers—deposed Oribe, Rosas was the man which not only hosted Oribe in exile, but also went to war to restore Oribe to the Uruguayan presidency. Now, as Oribe sits at the head of the Uruguayan politics once again, Rosas is facing problems back home, with the governor of Entre Rios—José Justo de Urquiza—revolting against him. It is about time we return the favor and help Rosas against this insurgency.;;;;;;;;;;;;;
EVTDESC600114;\n\nWhen Rivera—with help from his Anglo-French backers—deposed Oribe, Rosas was the man which not only hosted Oribe in exile, but also went to war to restore Oribe to the Uruguayan presidency. We are not surprised to know that now, as Urquiza wages a war against Rosas, Manuel Oribe has declared full support to Rosas, declaring war on Urquiza and his allies.;;;;;;;;;;;;;
EVTDESC600115;\n\nWhen Rivera—with help from his Anglo-French backers—deposed Oribe, Rosas was the man which not only hosted Oribe in exile, but also went to war to restore Oribe to the Uruguayan presidency. We are not surprised to know that now, as Urquiza wages a war against Rosas, Manuel Oribe has declared full support to Rosas, declaring war on Urquiza and his allies.;;;;;;;;;;;;;
EVTDESC600116;\n\nWith our triumph against the traitorous Urquiza, we can't overlook the help Manuel Oribe provided us by being quick to declare war against Urquiza. Rosas can't help but consider if a closer relationship with Oribe's Uruguay would be in order, an idea that was tossed around before, but post-ponned by Urquiza's revolt. With Anglo-French influence expelled from Uruguay, no one could oppose us if we were to sign a treaty declaring Oribe to the governor of the Provincia Oriental.;;;;;;;;;;;;;
EVTDESC600117;\n\nWith our triumph against the traitorous Urquiza, Rosas couldn't help but see the value Oribe had been to his Confederation. Naturally, seeking to deepen their partnership, Rosas proposed to Oribe that Uruguay join the Argentine Confederation, with him as its provicial governor, of course.;;;;;;;;;;;;;
EVTDESC800902;\n\nMany of the men who fought under Urquiza against Rosas wanted one thing and one thing only, a democratic constitution for the Argentine Federation. While we have little hope of implementing such a constitution on the Argentine Confederation—still under Rosas—with our independence, we can at least let our people bear fruit of such ideas. With nothing in his way, Urquiza called for a constitutional congress in Santa Fé, which has just finished the final draft of the Constitution of $COUNTRY$, following our federalist and democratic ideals.;;;;;;;;;;;;;
EVTDESC600118;\n\nDespite our allies planning to do a naval invasion of Santa Fé from Sacramento, General Justo José de Urquiza, with the help of his Uruguayan and Brazilian auxiliaries, managed to beat Rosas at the Battle of Monte Caseros, which prompted the Argentine tyrant to flee from the battlefield to Buenos Aires, where he would disguise himself and embark on a ship out of the country, effectively exiling himself and handing over the country to Urquiza.;;;;;;;;;;;;;
EVTDESC600119;\n\nOur relations with our southern neighbors aren't the best. Argentina has tried—and failed—to invade our nation in the past and they still claim that we are just a rebelious province of their confederation. While the current head of the confederation Juan Manuel de Rosas is set on one day reconquering Paraguay, a revolt has broken on the other side of the border, with the Province of Corrientes being currently controlled by Unitarians that oppose his government. While they already count with Uruguayan support, giving them further support would only weaken Rosas and maybe provide us with leverage to negotiate our independence with the Unitarians in the future.;;;;;;;;;;;;;
rosas_dead;The Death of Rosas;;;;;;;;;;;;;
commission_angelis_constitution_title;Implement Angelis' Constitution;;;;;;;;;;;;;
commission_angelis_constitution_desc;The traitor José Justo de Urquiza once commissioned journalist and historian Pedro de Angelis a constitution. While Urquiza was defeated by our great leader Rosas, the constitutional project went ahead, with the finished 135-long constitution being published in Angelis' journal in Buenos Aires. Rosas—at first—personally wasn't very keen on Angelis and his work, but with time our great leader approached Angelis personally to publish some intellectual projects of his government, creating a bridge between the two men. \n\nWith Rosismo evolving and Rosas' health starting to fade, it may be for the best that—instead of relying on Rosas' son to carry his regime on—we commission Angelis' constitution to be sanctioned as the official constitution of the Argentine Confederation.;;;;;;;;;;;;;
EVTDESC600120;\n\nPrincess Alice arrival in Buenos Aires was a celebrated one. It was hard to convince the English government to let Alice be crowned Queen of Argentina, but—after guaranteeing Alice would reign as a constitutional monarch—the British Royal Family accepted letting Alice be our queen. \n\nJust like that, today, on the year of our Lord $YEAR$, Alice Maud Mary, also known as Princess Alice of the United Kingdom, was crowned as Queen Alice I, of the Saxe-Coburg-Gotta dynasty, first queen of the Argentine Monarchy. Long live the Queen!;;;;;;;;;;;;;
EVTDESC600121;\n\nSadly, for one reason or another, the British Royal Family refused to let Princess Alice be crowned Alice I of Argentina. While this is quite a setback to Rosas monarchical plans, maybe, if he is so set on following this path, the dictator could declare himself Protector of Argentina and Restorer of the Order, granting him the title of king Juan Manuel de Rosas I, the first of the Rosas dynasty, first king of the Argentine Monarchy.;;;;;;;;;;;;;
province_of_paraguay_title;Cut Negotiations with Paraguay;;;;;;;;;;;;;
province_of_paraguay_desc;§RGain 10 infamy§! "Relations with the Province of Paraguay, which have been severed for many years, will be definitively restored by the first Legislative Congress that meets after the present Constitution is sworn in." — These are the exact words in Angelis' Constitution. While vague, Angelis confessed—at a later date—to including it as a path to reintegrate Paraguay into the Confederation. Paraguay has long been a great reason of shame and a thorn in our side, with its dictator—Carlos Antonio López—having supported both the Unitarians in Corrientes and the traitors under Urquiza. But—following Angelis draft—we have established negotiations with Asunción which have yet to be fruitful. Maybe it is about time we cut off our relations with Paraguay and end their independence once and for all.;;;;;;;;;;;;;
VNZ_prov_gov_liberal;Interim Government of Colombia;;;;;;;;;;;;;
EVTDESC600122;\n\nWith out victory against the secessionists, the new reformist government can declare itself the "Interim Government of Colombia", with the hope of soon reforming an unified Colombia.;;;;;;;;;;;;;
EVTDESC600123;\n\nSadly, be it by our idleness or our failure to unite Colombia by force, the reformist spirit that started the reformist revolt has long since faded, leaving us to officially drop the claims to an unified colombian state once for the time being.;;;;;;;;;;;;;
EVTDESC600124;\n\nThe French Blockade, while not enough to make us kneel under its weight, surely hit our nation quite hard, so much so that the landowners of Buenos Aires started to conspire with our French and Unitarian enemies to depose our great leader from Buenos Aires. This conspiracy was able to reach Rosas' personal friend, Manuel Vincente Maza, whose son was chosen as son of said conspiracy. As the conspirators were ready to strike, Rosas managed to arrest Maza's son, which—after supposedly trying to help his son—was assassinated in his office, with his son being executed in the next day. With that, the revolt lost the support in Buenos Aires itself, with it being limited to a small army in the south of Buenos Aires. The army was meant to be lead by Juan Galo de Lavalle, the old Unitarian governor of Buenos Aires, but he ended up being leading his army into Entre Rios, were he found some degree of success, leaving the revolt in Buenos Aires to fight on its own.;;;;;;;;;;;;;
EVTDESC600125;\n\nOnce, the interior was safely under the rule of Facundo Quironga. But ever since his death in 1835, things began to change. Governors of the interior provinces began to slowly be swayed to the Unitarian cause, leading to a small revolt by Domingo Cullen, which was swiftly dealt with by governor Juan Pablo López—of Santa Fé. Now, with the war against Corrientes waging on another bigger, more threatening revolt, has come to be, with the governor of Tucumán—Marco Manuel Avellaneda—rallying an coalition against Rosas, joining forces with the governors of Salta, Jujuy, Catamarca and La Roja. Rosas tried to prevent the uprising by seizing Tucumán's guns, but the general he sent—Gregorio Aráoz de Lamadrid—joined forces with the coalition—due to his Unitarian background.;;;;;;;;;;;;;
ARG_prov_gov_liberal;Northern Coalition;;;;;;;;;;;;;
unite_with_argentina_title:Unite with the Argentina;;;;;;;;;;;;;
unite_with_argentina_desc;Our old disputes with the Federalist Party led to our secession from the old Argentine Confederation. With the fall of the Federalist government, the Unitarians took over Argentina, destroying the old confederation and declared the creation of the Argentinian Republic, which closely alligns with our ideals. Perhaps now it's time we finally rejoin Buenos Aires...;;;;;;;;;;;;;
EVTDESC600126;\n\nWhen Alto Peru was incorporated in the Argentine Confederation, it was bound to have a special status. Since then, Argentine politics have slowly sapped into Bolivia, with disputes between Unitarians and Federalists also happening in Alto Peru, as they also happened in the Argentine Interior. Together with the governors of La Roja, Santa Fé and—of course—Buenos Aires, the Governor of Alto Peru was one of the pivotal federalist governors in the confederation. But recently, the old governor left the office, giving way to a new governor, less alligned with Rosas and his ideals. Now, be it for a desire to trully support the Bolivian people, to support the Unitarians or pure madness, the new governor of Alto Peru has declared, in La Paz, war on Rosas and his Federalist confederation, rallying the Bolivian people to his side. Sadly, we can't say that the entire country followed the governor's idea, with provinces like Tarija and Salta regrettably declaring loyalty to the confederation, taking arms against us.;;;;;;;;;;;;;
EVTDESC600127;\n\nWhen Alto Peru was incorporated in the Argentine Confederation, it was bound to have a special status. The governor of Alto Peru was—among the governors of La Roja, Santa Fé and, of course, Buenos Aires—one of the most important governors in the Argentine Confederation. But after serving us truthfully, the governor of Alto Peru was deposed by one of his subordinates, which now, in our moment of weakness, has declared war on Rosas, trying to have Bolivia to rule as his little fiefdom. Luckily, some of Alto Peru sees this madness and chooses to take arms against the mad caudillo, declaring allegiance to governor Rosas and his confederation.;;;;;;;;;;;;;
