Key;English;French;German;Polish;Spanish;Italian;Swedish;Czech;Hungarian;Dutch;Portuguese;Russian;Finnish
welcome_the_romanians_title;Welcome the Romanians;;;;;;;;;;;;;
welcome_the_polish_title;Welcome the Polish;;;;;;;;;;;;;
welcome_the_yugoslavs_desc;As we grant a special place for the slavs in our nation, we have already granted rights to the Croats, but, with our centuries-long influence over the South Slavic peoples, it is only natural that we start striving to integrate all of the South Slavs into our nation, granting them a place in our Austro-Slavic union over the Danube.;;;;;;;;;;;;;
welcome_the_romanians_desc;After a total transformation of our nation into a Danubian Federation, the Romanians already have a place in our nation, due to them being the dominant population in Transylvania. But, with Romania under our influence, we could spend some political capital to integrate it into our nation, expanding the our nation until it reachs the Black Sea.;;;;;;;;;;;;;
welcome_the_polish_desc;With our union with the Slavic people, one of the biggest slavic groups in our nation are the Polish. Naturally, ever since the partitions of Poland, we ruled over a significant Polish minority, keeping it even as Napoleon created the Duchy of Warsaw. Now, with the Polish becoming members of our Austro-Slavic nation, we have the change to protect the Polish from both Prussian and Russian threats, by integrating them into our nation once we manage to hold enough sway over them.;;;;;;;;;;;;;
EVTDESC800854;\n\nWith the success of our revolution against the $COUNTRY_ADJ$ aristocracy, we give light to a new era for our people. But now, with the rise of Socialism, it seems that a new wave of ideas has have hit our nation. While these new ideas are still a minority in our government, we can't deny that the winds of change are upon us and—with the liberal mindset that sparkled the Revolutions of 1848 becoming the new status quo—we have no doubt that the socialists are here to stay, as new faction pushing political change.;;;;;;;;;;;;;
truly_baltic_title;A Truly Baltic Nation;;;;;;;;;;;;;
truly_baltic_desc;§RGain 10 infamy§! Despite enjoying German help to fight the Russians, we couldn't risk having the Germans taking the place of the Russians as our new overlords. Because of that, the revolution was born, with the Baltic people storming the Landtag and declaring the creation of $COUNTRY$. Despite that, we can't deny that Germany still holds lots of sway over our nation, bringing some question to the legitimacy of our regime. So, to quell any doubts about the sovereignty of $COUNTRY$, we shall prove ourselves to be a truly Baltic republic, by claiming Prussia, leaving it clear once and for all that we aren't mere subservient to Berlin. \n\n§RPulling yourself out of German protection is a dangerous game for the player, especially if you are a Radical Republic! Not only you will have no protector against Russia, but the European powers won't shy away from putting down a nation that openly defies the European order, no matter how puny it looks!§!;;;;;;;;;;;;;
baltic_ambition_title;Our Ambitions;;;;;;;;;;;;;
baltic_ambition_desc;Despite being a Russian governate until recently, we managed to achieve a quite privileged position among Europena powers, despite maybe still not reaching the level of prestige and power of nations such as France and Britain. That, paired with our agressive expansion, left us wanting more. Now that we are free from outside influence, our nation grew more and more ambitious and, with the conquest of Prussia, we couldn't help but feel emboldened to persue such ambitions.;;;;;;;;;;;;;
EVTDESC800856;\n\nAs the dust settles from our conquest of Prussia, there grows the speculation about what is the next step for our great nation. Thus, now, the time has come for a bold step to be taken: $COUNTRY$ is to persue the leadership of Germany! Inspired by the Revolutions of 1848, we recognize that the true revolution shall be carried by us, with the destiny of Germany being the unification under $COUNTRY_ADJ$ banner! \n\n§RDespite giving you a hand in your first steps towards seizing the leadership of Germany, from now on, you are on your on! You shall unify Germany in your regime's image, or die trying!§!;;;;;;;;;;;;;
EVTDESC800857;\n\nAs the dust settles from our conquest of Prussia, there grows the speculation about what is the next step for our great nation. Thus, now, the time has come for a bold step to be taken: $COUNTRY$ is to persue the liberation of the Polish, Lithuanians and Ruthenians within the Russian Empire! Inspired by the repeated attempts of freedom persued by the Polish, Lithuanian and Ruthenian people, we can't help but feel forced to liberate from Russian rule, to persue a multinationl state, able to resist Russia under $COUNTRY_ADJ$ leadership. \n\n§RDespite giving you a hand in your first steps towards liberating the lands of the old Commonwealth, from now on, you are on your on! You shall liberate Eastern Europe in your regime's image, or die trying!§!;;;;;;;;;;;;;
EVTDESC73649209;\n\nAfter the last Schleswig War, the Austrian Empire promissed us that it would realize a referendum in Schleswig at a later date, to let the population decide if they truly wanted to become a part of Germany, seeing as it has a significant Danish population. Thus, when war broke out between it and Prussia, we feared that that promise may soon be null and void, as Austria would be unable to fulfill if it was defeated but, int a surprising turn of events, Austria has managed to keep their position as head of the German world and thus, maybe it is a good time to ask about that referenfum they promised.;;;;;;;;;;;;;
EVTDESC73649200;\n\nAfter the last Schleswig War, we promissed the Danes that we would realize a referenfum in Schleswig at a later date, to let the population decide if they truly wanted to become a part of Germany, seeing as it has a significant Danish population. Thus, when war broke out with Prussia, this promise became the least of our concerns. But now, with our resounding victory against Prussia, the Danes seem to think it is the best time for us to fulfill our little promise.;;;;;;;;;;;;;
EVTDESC73649201;\n\nThe Austrians have accepted to realize the referendum! We shall know the results in a month or so...;;;;;;;;;;;;;
EVTDESC73649202;\n\nThe Austrians have refused to realize the referendum! It would seem that the victory against Prussia has embolden them beyond reason...;;;;;;;;;;;;;
EVTDESC73649203;\n\nThe Danish asked for a referedum in Schleswig and the Austrians aquiested. Lets see how it goes...;;;;;;;;;;;;;
EVTDESC73649204;\n\nIt was a tense month in Schleswig, with the Danish and German populations still felling a certain animosity from the Schleswig War. But it would seem that the vote is finally over, with North Schleswig voting to join Denmark, while the South chose to remain German!;;;;;;;;;;;;;
EVTDESC73649205;\n\nIt was a tense month in Schleswig, with the Danish and German populations still felling a certain animosity from the Schleswig War. But it would seem that the vote is finally over, with Schleswig voting to remain German!;;;;;;;;;;;;;
EVTDESC73649206;\n\nIt was a tense month in Schleswig, with the Danish and German populations still felling a certain animosity from the Schleswig War. But it would seem that the vote is finally over, with Schleswig voting to return to the Danish!;;;;;;;;;;;;;
EVTDESC800858;\n\nWith our rise in status to that of a Asian power we found ourselves with the desire to build a proper sphere of influence in Asia, with the Chosen Peninsula being one of our most strategic targets. Korea, being one of the first places to pledge loyalty to the Manchus was firmly in the Qing sphere of influence, with significant Russian influence on top of that. But, lately, we managed to get a significant foothold in Korea, leading some of our advisors suggest that, if we want to remain holding sway over Korea, that it is for the best that we help it modernize itself, making it more resistant to Russian and Chinese influence in the process...;;;;;;;;;;;;;
japanese_sponsored_modernization;Japanese Government Advisors;;;;;;;;;;;;;
japanese_sponsored_modernization_desc;Officials from Japan are working with our government to oversee our own modernization. We hope to use their knowledge to pursue reforms in all aspects, from social to military.;;;;;;;;;;;;;
mantetsu_jap;South Manchuria Railway — Mantetsu;;;;;;;;;;;;;
mantetsu_jap_desc;The Mantetsu was established after the agressive takeover of most of the Russian Eastern China Railway, following the Japanese victory in the Russo-Japanese War. The company would grow rapidly, going beyond a simple railway company. Soon, the Mantetsu would expand its operations into coal mines, harbors, research centes and even hotels. Now, with our invasion of Manchuria, the Mantetsu became an essential part of our occupation of the region, not only becoming responsible for around 25% of our tax revenue, but also deeply penetrating every sphere of everyday life in Manchuria.;;;;;;;;;;;;;
mantetsu_mck;South Manchuria Railway — Mantetsu;;;;;;;;;;;;;
mantetsu_mck_desc;The Mantetsu was established after the agressive takeover of most of the Russian Eastern China Railway, following the Japanese victory in the Russo-Japanese War. The company would grow rapidly, going beyond a simple railway company. Soon, the Mantetsu would expand its operations into coal mines, harbors, research centes and even hotels. Now, with our invasion of Manchuria, the Mantetsu became an essential part of our occupation of the region, not only becoming responsible for around 25% of our tax revenue, but also deeply penetrating every sphere of everyday life in Manchuria.;;;;;;;;;;;;;
EVTDESC800859;\n\nAfter solidifying our position in Korea, it was only natural that our next target would be Manchuria. When we first rose to great power status, Manchuria was firmly under Russian influence. However, after a violent takeover of the Russian-owned Chinese Eastern Railway, we succeeded in replacing them as the informal overlord of the region, establishing the South Manchuria Railway Company—Mantetsu. \n\nThe company gradually came to dominate Manchurian affairs, culminating in our invasion of the region and, with Manchuria under our control, our advisors have presented a plan to use Mantetsu to develop it into a true crown jewel of our empire.;;;;;;;;;;;;;
EVTDESC800860;\n\nBeing completely expelled from Manchuria, our investments in the region have been seized, leaving the Mantetsu defunct and making it cease its operations, forever.;;;;;;;;;;;;;
mantetsu_farms_mines;Mantetsu Farms and Mines;;;;;;;;;;;;;
EVTDESC800861;\n\nWith Japanese investment pouring into Manchuria through the Mantetsu, the South Manchuria Railway Company not only has been expanding mining operations throughout Manchuria but its research wing has also introduced many advancements to our agriculture, turning us into one of the biggest exportes of soy, for example.;;;;;;;;;;;;;
EVTDESC800862;\n\nWith our victory against Russia and the expulsion of Slavs from the Far East, it is about time we decide on how our gains will be administered. While most of the Far East would be either directly ruled as a colony or be run by local semi-independent governments, Outer Manchuria brings us an interesting question. Some executives in the Home Islands have been pushing for Outer Manchuria to be integrated into our puppet government in Manchuria, so the Mantetsu and its subsidiaries are able to operate freely on it. \n\nWhile we aren't totally opposed to this idea, with the effort we put into annexing the territory and expelling the Russians from it, we can't say that we are eager to hand it over to our puppet.;;;;;;;;;;;;;
mantetsu_jap_improved;South Manchuria Railway — Mantetsu;;;;;;;;;;;;;
mantetsu_jap_improved_desc;The Mantetsu was established after the agressive takeover of most of the Russian Eastern China Railway, following the Japanese victory in the Russo-Japanese War. The company would grow rapidly, going beyond a simple railway company. Soon, the Mantetsu would expand its operations into coal mines, harbors, research centes and even hotels. Now, with our invasion of Manchuria, the Mantetsu became an essential part of our occupation of the region, not only becoming responsible for around 25% of our tax revenue, but also deeply penetrating every sphere of everyday life for Japanese settlers in Manchuria. \n\nNow, with the rise of Mangyo, most of Mantetsu investment has been absorved and repurposed into serving the developing Manchurian economy, Mantetsu's role has been devolved mainly into its railway lines, planning and research.;;;;;;;;;;;;;
EVTDESC800863;\n\nMantetsu has served us well in furthering our interests in Manchuria and being a profitable company in our nation, one of our most profitable enterprise actually. But now—with our Invasion of Manchuria—we need to evolve our economic policy in Manchuria, such as to properly build it as a nation, despite still being, in practice our colony. Thus—after some small disagreements with the Kwantung Army—Yoshisuke Aikawa, founder of the Nissan zaibatsu, has established the Manchurian Industrial Development Company, integrating a great deal of Mantetsu's investments. Now, despite still operating its railway lines and its research wing their profits have diminished quite a bit, Luckily, we can still count on it to showcase the modernization of Manchuria under our rule.;;;;;;;;;;;;;
mantetsu_research_wing;Mantetsu Research Wing;;;;;;;;;;;;;
mantetsu_research_wing_desc;The Mantetsu engaged in a country-wide development project, with not only its Research Wing being a center piece of Japan's colonial program, but also devoloping the country's heavy industry and soybean agriculture, with land cultivation increasing in 70% in 20 years, not to mention the construction of schools, libraries and hospitals promoted by the Mantetsu.;;;;;;;;;;;;;
EVTDESC800864;\n\nWith the formation of the Mantetsu, a considerable investment has been put into Manchuria. The railway lines were the first to be developed, together with hotels and warehouses to service them. After that, the Mantetsu built schools, libraries and even hospitals, with a wave of development into mining and agricultre following suit, headed by the Mantetsu Research Wing.\n\nBeing considered the centerpiece of Japan's colonial policy in Manchuria, the Mantetsu Research Wing is paramount to the development of our government. \n\nWhile it is mostly focused on agricultural developments for now, we have no doubt that we can only benefit from the brightest minds in Japan putting their heads into developing Manchuria.;;;;;;;;;;;;;
EVTDESC800865;\n\nThe Chosen Government Railway, also known as Sentetsu, was established after our annexation of Korea, from Korea's old military railways nationalized at the orders of the Japanese Resident-General of Korea. \n\nAlthough the Sentetsu has grown quite a bit since its creation—integrating smaller private railways lines—the Sentetsu is nowhere near the level of the Mantetsu in Manchuria. Thus, we are giving the Mantetsu jurisdiction over the Sentetsu, in hopes that the South Manchuria Railway Company can modernize the Sentetsu's locomotives while expanding its fleet. \n\nWithout a doubt, the integration between these railways lines can only bring good to our nation, especially if it means bringing the Sentetsu to Mantetsu's standards.;;;;;;;;;;;;;
sentetsu;Mantetsu-Sentetsu Integration;;;;;;;;;;;;;
mantetsu_integration;Mantetsu Integration;;;;;;;;;;;;;
mantetsu_settling;Mantetsu Settlements;;;;;;;;;;;;;
mantetsu_mck_improved;Manchurian Industrial Development Company — Mangyo;;;;;;;;;;;;;
mantetsu_mck_improved_desc;Following the Japanese Invasion of Manchuria and the economic success of Mantetsu, the South Manchuria Railway Company helped the Kwantung Army develop a economic and industrial plan for the future of Manchuria, inviting Yoshisuke Aikawa, the founder of the Nissan zaibatsu who proposed the establishment of the Manchurian Industrial Development Company, also known as Mangyo, a joint venture owned 50% by Nissan and 50% by the Manshukoku government. \n\nDespite being rejected at first in favor of Kwantung plans, Aikawa soon would have its way, successfully pulling investment into Manchuria and integrating Mantetsu investments into the Mangyo, managing to surpass the Home Islands in certain sectors by the end of Mangyo's first five year plan.;;;;;;;;;;;;;
EVTDESC800866;\n\nThe Asia Express was a super express passenger train operated by the Mantetsu, quickly becoming its most iconic train and the fastest one in all of Asia at the time. With American reporters praising its speed and luxurious comfort, it was a showcase of Japanese technology and the advancements made by the Mantetsu, being one of the world's first locomotives to have fully enclosed and air-condioned carriages. \n\nThe Asia Express served as the Mantetsu's greatest piece of propaganda, not only showing its developments in Manchuria, but also becoming its greatest symbol, making so the company—together with the Asia Express—would live on the public consciousness for years to come—even well after Japan is expelled from Mainland Asia.;;;;;;;;;;;;;
EVTDESC800867;\n\nWith the Japanese Invasion of Manchuria and the propping up of $COUNTRY$, the economy of our state becomes of primary importance to the Japanese government, with Japanese officials recognizing that a poor economy would be a breeding ground for anti-Japanese and communist elements. Thus, the Kwantung Army—which quickly took Mantetsu's place as the main Japanese authority in Manchuria—came forth with an economic and industrial plan for the future of Manchuria, inviting Yoshisuke Aikawa, the founder of the Nissan zaibatsu who proposed the establishment of the Manchurian Industrial Development Company, also known as Mangyo, a joint venture owned 50% by Nissan and 50% by the Manshukoku government.;;;;;;;;;;;;;
EVTDESC800868;\n\nThe death of Emperor Gojong of Korea left us with new problems in our hands. Rumors started circulating that we had poisoned him and were responsible for his death, culminating in a massive demonstration on the day of his funeral, with nation-wide protests that we were forced to crackdown violently, giving origin go the March 1st Movement. \n\nAs if that wasn't enough, with Korea under our hands and our violent crackdown of these protests, many Koreans have fled the Peninsula, leaving towards Shanghai, where some of them would establish the Provisional Government of the Republic of Korea a month later. This organization, despite being one of the less radical elements of fighting for Korean independence, they still present a significant thorn in our side, counting with the support from Americas and some communist elements at home.;;;;;;;;;;;;;
exile_oman_title;Exile Oman;;;;;;;;;;;;;
exile_oman_desc;§RGain 8 infamy§! Oman has been a target of Persian expansion ever since the days before the Islamic invasions, with Persia having last conquered Oman during the Asharid period, under Nader Shah in 1743, a mere century ago. \n\nIn turn, after a prolonged civil war following the overthrow of Shah, Persia's most important port—Bandar Abbas—came under the control of the Imam of Muscat. A lease treaty confirming the port's status under Omani rule from 1794 has recently been revoked by our administration and—together with the invasion of Baluchistan and the western coast of Arabia—assured that our relations with Oman shifted in our favor. \n\nNow, while Oman has built quite an empire with their holdings in Africa, we hold the upper hand against them, being capable of not only seizing their Indian ports, but outright exile the Imam of Muscat to Zanzibar, giving us not only complete control over the Persian Gulf, but also seizing his lands in the Arabian Peninsula.;;;;;;;;;;;;;
secure_trucial_oman_title;Secure the Straits of Hormuz;;;;;;;;;;;;;
secure_trucial_oman_desc;§RGain 6 infamy§! Seizing control over Western Arabia has solidified our position on the Persian Gulf, but stoping now wouble be neglecting the fact that our control over it remains unstable, with its waters being easily blockaded if any naval power were to take control over either side of the Hormuz Strait. With that, after we reintegrate Bandar Abbas and the Island of Hormu back into our rule after years of Omani rule, it would be only natural that, to trully secure the Persian Gulf, we invade the many emirates across the Hormuz Strait. \n\nAnnexing both sides of the Hormuz Strait would not only guarantee our control over the Persian Gulf, but also pacify the many emirs on the Arabian side of it, making sure that their in-fighting won't let western powers encroach in our backyard.;;;;;;;;;;;;;
persian_syria_title;Beyond the Euphrates;;;;;;;;;;;;;
persian_syria_desc;§RGain 10 infamy§! While we are no strangers to Syria, the region hasn't been under our control ever since pre-Islamic Iran, with our nation not being able to rule the region ever since the days of Khosrow II of the Sassanids, shortly before the begining of the Muslim conquest of Persia. But now—with our positon as a rising power in the world stage and in the Middle East—we can westle our rivals for control over Syria and the entire Levant—going as far as claiming al-Quds—which would certainly let us be respected not only by Islamic powers, but by Christian ones as well.;;;;;;;;;;;;;
persian_holy_cities_title;Custody over the Holy Cities;;;;;;;;;;;;;
persian_holy_cities_desc;§RGain 8 infamy§! While we never ruled over Hedjaz nor does the region have much in the way of economic or strategic importance, its value to us is hard to understate. With our position as the holders of al-Quds, we earned a great deal of respect from the Christian powers and from the Muslim people—to a lesser degree. While al-Quds is also a holy city in Islam, its importance pales in comparison to the Holy Cities of Mecca and Medina—both found in Hedjaz. Thus—pairing it with our position as a great power—if we were to hold both al-Quds and the Holy Cities of Mecca and Medina we would become the uncontested leaders of the Muslim world, even if we are part of the Shiite minority.;;;;;;;;;;;;;
EVTDESC800869;\n\nThe Prince-Governor of Fars, Husayn Khan Ajudan Bashi, has just led an army towards Bandar Abbas, demanding that the Imam pays 30,000 tomans or give up the city, being repulsed shortly after trying to take the port. \n\nDespite the terms of the lease treaty being somewhat contested, it remained undisputed that such an arrangement was dependent on the Imam of Muscat paying a sum of 4000 tomans a year and, despite that, Muscat has failed to pay the rent on Bandar Abbas time and time again, not because of a lack of coin, but because the Imam knows that we can do nothing about it, considering their superiority at sea. \n\nThus, with Husayn Khan's force being repulsed, we are can only assure the Imam that we have no involvement in this, lest we face his ire.;;;;;;;;;;;;;
EVTDESC800870;\n\nThe Prince-Governor of Fars, Husayn Khan Ajudan Bashi, has just led an army towards Bandar Abbas, demanding that we pay 30,000 tomans or give up the city, being repulsed shortly after trying to take the port. \n\nDespite being under the obligation of paying a sum of 4000 tomans a year, we have been skipping on the port's rent for quite a while, knowing that the $FROMCOUNTRY$ can't do anything about it, lest risk having their ports shelled to the ground. \n\nBut now, with Husayn Khan's foolish display of recklessness, we are forced to consider if sending a threatening message is enough or if we should settle this matter once and for all...;;;;;;;;;;;;;
EVTDESC800871;\n\nWith our victory against the Imamate, the matter of Bandar Abbas is finally settled. Our victory came with a high price, at the start of the war, the Imam's fleet shelled most of our ports, completely disrupting our trade. Luckily, Bandar Abbas remains mostly intact, allowing the city to take over its place as Persia's main port while we rebuild Bushehr.;;;;;;;;;;;;;
EVTDESC800872;\n\nWith our victory against the Iranians, the matter of Bandar Abbas is finally settled. No more will we need to worry about the lease of Bandar Abbas, as now the city is officially a part of our great maritime empire. Better yet, with our shelling of the Iranian ports, Bandar Abbas remains as the only suitable port in the region, allowing us to hold a monopoly over maritime trade in the region.;;;;;;;;;;;;;
EVTDESC800873;\n\nWith our defeat against the Imamate, the matter of Bandar Abbas is finally settled. The Imam's possessions in our side of the gulf are now officialy part of the Imamate, with our state being forced to give up our claims on it. Worse yet, with most of our ports destroyed, Bandar Abbas remains as the only suitable port in the region, forcing us to conduct all of our maritime trade through the Imamate.;;;;;;;;;;;;;
regain_omani_coast_defeat_title;Reclaim the Strait of Hormuz;;;;;;;;;;;;;
